Datetime,Location,Text,Like Count
2020-10-22 13:42:44+00:00,,Great book ... In this unforseen time of covid 19.. this is an even MORE important book to read... To get or keep your mind right !!!! https://t.co/R66MLhdnPW,2
2020-10-23 18:57:09+00:00,"Des Moines, IA","Colonel TIMON OUJIRI, US Army Retired, &amp; Iowa Veterans Home Commandant, provided update to Iowa Veterans of Foreign Wars Fall Pow Wow. Facility response to COVID-19 was phenomenal! NO injuries to Veterans / Residents during Derecho Storm. Excellent leadership. #IowaVFWPowWow2020 https://t.co/0QMzy0Anao",2
2020-10-24 18:00:56+00:00,"Des Moines, IA","After Senate Democrats stonewalled Republican bills. The HEROES Act is full of wasteful spending. 

If House Democrats were serious, they would send a clean COVID-19 relief bill, but they are not. They want to play politics. https://t.co/4SLnOHWx6X",3
2020-10-24 16:46:19+00:00,"Des Moines, IA","Yesterday, more people were diagnosed with covid-19 than Trump’s 2016 margin of “victory.”",0
2020-10-24 00:56:33+00:00,"Urbandale, IA","Year 2 Year...
Through the #pandemic, markets are fighting, roaring as #Covid_19 cases rise — so too is #WallStreet. 
Interesting times we live in. 
#investments #stocks https://t.co/LD7iGBQvbX",1
2020-10-25 01:22:32+00:00,"Iowa, USA",So one of Pence’s top advisors has COVID-19.  Here we go again!!! #TrumpLied200KDied #TrumpCovidHoax #TrumpVirusRedWaveIsHere,2
2020-10-27 21:49:10+00:00,,@JadenHalstead You are missing my point buddy. I am comparing US deaths from each virus to global deaths of each virus. (Because they are different) US is 4.25% of the global population. We were 4.5% of global deaths to swine flu. We are 20% of global deaths for Covid. I think 20% is greater.,3
2020-10-27 16:41:05+00:00,"Des Moines, Iowa  USA",University of Iowa Hospitals and Clinics prepares for COVID-19 vaccine expected in November https://t.co/eYdnIC6OEQ @uiowa @uihealthcare,2
2020-10-27 01:22:13+00:00,"West Des Moines, IA","I only hope they all give each other Covid-19 and die, yes die. Because the newest justice wants nothing less for me. https://t.co/wIzjXNT9dY",1
2020-10-27 00:06:41+00:00,"West Des Moines, IA",@TracyNotaho @Do26618837 @SenSchumer All I see is idiots. 🤷🏻‍♀️#Covidiots #COVID__19,0
2020-10-28 19:46:21+00:00,"Grimes, Iowa","Fall sports went smoothly without any COVID-19 shutdowns. Here's hoping basketball season goes off without a hitch. #fingerscrossed @ Grimes, Iowa https://t.co/zHGnfO3ZiC",2
2020-10-28 18:40:21+00:00,"Des Moines, IA","VIRTUAL Iowa Sports Foundation Board of Directors meeting today. Even in year of COVID-19 Pandemic there’s been great progress in Live Healthy Iowa, &amp; Adaptive Sports Iowa, Iowa Games, Corporate Games, Senior Games–touching lives of 170,000 Iowans!💪Looking forward to 2021.👍🇺🇸 https://t.co/Oaxo65YLqx",3
2020-10-28 11:30:44+00:00,"Des Moines, IA",👀😱🤯 👈🏼 My reaction after seeing video and photos of Justin Turner celebrating with his team AFTER testing positive for COVID 19. We all know you can spread the virus without having symptoms right? Yeah? Cool. https://t.co/p1DppbSIgF,5
2020-10-28 00:32:53+00:00,"Grimes, IA",Total Covid-19 deaths in prior years? I will assume zero... https://t.co/tmXHQFJfai,1
2020-10-29 21:48:39+00:00,,"Today my child’s school sent a letter saying my child had been exposed to Covid 19. It never mentioned my child by name. I have more than 1 child at the school. Brilliance. I emailed asking for clarification, and so far haven’t heard back.",17
2020-10-29 18:55:42+00:00,"Des Moines, IA","Talking elections, voter turnout, absentee ballots, COVID-19 precautions and more with @IowaSOS. Thankful to have Secretary Pate &amp; his office working to help make this year’s record setting Primary Election a great one for Iowans. https://t.co/5StaQyhh3J",3
2020-10-29 18:40:37+00:00,"Nokomis, FL","You don’t say. Facebook/YouTube “researchers,” this one’s for you.

Claims that flu cases are used to inflate COVID-19 case counts are misleading, based on inaccurate numbers https://t.co/0Y7Iv5FRUY via @HealthFeedback",0
2020-10-30 11:23:03+00:00,"Des Moines, IA","@maddoxrules COVID 19 could be looked at as practice for a worse pandemic and we failed miserably. If the government wanted to help, they should have dropped off a large box of food on everyone’s doorstep and told them to stay home for a few weeks.",0
2020-10-30 07:04:39+00:00,"Des Moines, IA",COVID-19 Vaccines - Clinical Trials: The First Step Toward Being Well Is Being Educated - https://t.co/vn0qcrwX7c,0
2020-10-31 01:00:20+00:00,"Des Moines, IA","@SarahBeckman3 Until we have a vaccine that will likely continue to be the case, especially with how the media handles COVID-19. Closing again will be a death knell for many businesses. 

And it’s a subset of people who are afraid, I think most are not with precautions.",0
2020-11-03 22:15:12+00:00,"iPhone: 43.152870,-93.174530","Wearing my pearls for RBG with my work out clothes. Hoping for a blue wave to honor my dad who died from COVID-19. @ Ankeny, Iowa https://t.co/12yz2AiEqx",0
2020-11-03 11:49:28+00:00,"Phoenix, AZ","#ElectionDay is finally here! In a little over an hour, polls across Iowa will open. Make sure you know where your polling location is (it may have changed due to COVID-19). Go to https://t.co/hRNCUrMG0Z to double check. We’re live on #TodayinIowa @WHO13news",2
2020-11-04 21:53:12+00:00,"Ames, Iowa",You can’t lose if you don’t count the votes is today’s version of keeping COVID-19 positivity rates low by not testing.,19
2020-11-04 20:50:22+00:00,"Des Moines, Iowa  USA","#Iowa allocates $28M to help hospitals, counties cope with increase in COVID-19 https://t.co/aJKxRPn0Ae",0
2020-11-05 22:15:03+00:00,"Des Moines, IA",Also worth noting that the last night the @WDMCS school board noted that 45% of the Covid-19 cases among students in the district this school year have come within the last month. https://t.co/3C4xiGLb1N,0
2020-11-05 22:07:31+00:00,"Des Moines, IA","Valley vs Dowling canceled due to Covid-19 positive tests on the Tigers football team, per WDMCS. The maroons will advance.",1
2020-11-05 22:01:20+00:00,"Des Moines, IA",🚨 Covid-19 cases shut down state quarterfinal football matchup. https://t.co/3C4xiGLb1N,2
2020-11-05 21:59:33+00:00,"Des Moines, Iowa","BREAKING: Valley-Dowling canceled.  
Valley has positive COVID-19 cases.  

https://t.co/9oVI2FPoqr",51
2020-11-05 19:42:48+00:00,,"@SassyGirlBoss I've been thinking Covid-19 and perhaps the ICU. I don't think he's healthy enough to have a ""light case"". Just a thought...",0
2020-11-05 19:23:52+00:00,,@OlivviaDay Happy Covid-19 year birthday! It's a once in a century day. Enjoy it! https://t.co/erX7UlhUkA,1
2020-11-05 01:52:18+00:00,"Des Moines, IA",Tonight the @WDMCS has voted to change district wide requirement to face masks instead of face coverings effective November 9th. Board will also meet weekly to discuss Covid-19 metrics as they continue above 10%. NO CHANGE TO HYBRID LEARNING MODEL. Details at 10 @WHO13news https://t.co/2gre58PFzQ,4
2020-11-06 18:03:20+00:00,Des Moines,"ICYMI the Valley-Dowling game scheduled for @WHO13news prime time has been canceled due to Valley COVID-19 positives. Tigers season ends; Dowling advances to semifinals. 

Thank you for all requests for @JustinSurrency @MurphyKeith and crew to do other games, but no time/rights. https://t.co/mWJMIvuvbT",4
2020-11-06 13:47:18+00:00,"Urbandale, IA","Boris's 'Pork Pies!'
England's second wave of Covid-19 was slowing BEFORE lockdown https://t.co/pLzXA5fUIH via @MailOnline",0
2020-11-06 03:12:18+00:00,,"Joe biden-264
Donald Trump-214
Covid-19",6
2020-11-06 00:03:09+00:00,"Highlands Ranch, CO","WOW! Got word today that our 2020 season has been cancelled due to COVID-19. It’s crazy to have your season be cancelled twice in one season. I LOVE this team, and wish the best for the Valley program going forward https://t.co/jVlPtW81mK",186
2020-11-07 19:44:43+00:00,"West Des Moines, IA","@daemonsanddust @hbomax FINALLY!!
I was so afraid we wouldn't get new episodes. 
Thank you so much!
I really hope no one contracted covid-19 to make this possible. But I am grateful for everyone who made this possible.",0
2020-11-07 19:15:38+00:00,"Des Moines, Iowa","DMPS calls special board meeting for Sunday 5PM to discuss COVID-19 surge in Polk County. I’m told Superintendent Ahart will recommend following:

-Waiver to Dept of Ed to resume remote learning
-Suspending start of high school hybrid
-PreK, elem, middle back to remote Nov 16 https://t.co/X0BnzaL3VJ",8
2020-11-07 17:17:37+00:00,"Iowa, USA",Matt Gaetz tests + for Covid-19! What a Fn shame!,0
2020-11-08 20:36:43+00:00,United States,"If you’re inclined to turn to your taste buds for comfort, I would not recommend covid-19 for you.",1
2020-11-09 23:42:36+00:00,,I would like to personally thank @KimReynoldsIA for her negligence and lack of leadership during this Pandemic. Because of her lack of a mask mandate and taking proper action my wife’s heart surgery was delayed because of the spread of COVID-19 in our State. #WearAMask,3
2020-11-09 17:17:52+00:00,"West Des Moines, IA","@ASlavitt We don't know how long it will remain effective. 
With an RNA retro virus spread this widely it's going to mutate quickly. Meaning any vaccine will likely require reformulation regularly or it will become ineffective. Covid-19 isn't going anywhere quickly.",0
2020-11-09 16:59:25+00:00,"Des Moines, IA","An average of **16** Iowans died per day last week due to COVID-19.

We are just behind North and South Dakotas for the highest average rate of infections in the U.S. https://t.co/XE2vLugcJE",20
2020-11-09 05:59:02+00:00,"Urbandale, IA","Far from entertainment!
Chappelle jokes on 'SNL' that COVID-19 kept 'murderous whites' from mass shootings https://t.co/hojeyIuEj4 via @nypost",0
2020-11-10 17:52:41+00:00,"Des Moines, IA","@DMRegister Instead of thinking up snarky comebacks for reporters, maybe the governor developing a real plan to help lower Iowa’s insane number of COVID-19 cases would be time better spent.",40
2020-11-10 17:12:22+00:00,"Des Moines, IA","BREAKING: Gov. Kim Reynolds is issuing new proclamations in light of growing COVID-19 infection rates. Masks are now required at service locations, like salons. https://t.co/VmpuxbhwSf",26
2020-11-10 02:13:25+00:00,"West Des Moines, IA",The number of Iowans hospitalized with Covid-19 is rising at an alarming rate. Please join me in doing all you can to slow the spread to ensure our hospitals and health care workers aren’t overwhelmed. https://t.co/CLvCu5z6IV,37
2020-11-11 19:38:44+00:00,"Waukee, Iowa, USA","Hot Take:  COVID is a left leaning virus.  It doesn’t care if you are black, white, or brown, it is all inclusive and will infect you no matter what your political views are. https://t.co/W11bd0Pe6E",0
2020-11-12 23:33:47+00:00,"Des Moines, IA",Biden Selects Yale Professor Dr. Marcella Nunez-Smith To Co-Chair COVID-19 Task Force - https://t.co/S8Xhmpz1pb,0
2020-11-12 22:53:05+00:00,"Des Moines, IA","In the year of COVID-19, with three Central Iowa teams, these games should be at Drake in a bigger stadium and outside...IMO. https://t.co/dWnAjxqEqk",4
2020-11-12 20:56:04+00:00,"Des Moines, IA",SERIES: ‘In the Air Between Us’ — Why Face Masks Matter in the Fight Against COVID-19 #iowa #maskmandate by @blackiowanews https://t.co/xMzDM5x1KL,0
2020-11-12 13:09:54+00:00,"Iowa, USA","“Their Covid-19 vaccine approach uses genetic material, mRNA, to trick cells into producing bits of protein that look like pieces of the virus. The immune system learns to recognize and attack those bits and, in theory, would react fast to any actual infection.” https://t.co/JWrvPCZwOm",2
2020-11-12 12:19:29+00:00,"West Des Moines, Iowa",@ESPNCaddie running away from casual @TigerWoods fans at the first @PGATOUR event post COVID 19... LOL @TheMasters #Masters2020 #Master https://t.co/Aknrbc2oV7,0
2020-11-12 01:06:20+00:00,"Iowa, USA",Welcome to The Shitshow!! Essential workers are passing it around and Court Ave is ground zero in Des Moines. Some of them are getting it for a second time. Immunity is a myth. #Covid_19 @KimReynoldsIA https://t.co/trQowzFnpE,1
2020-11-13 23:57:09+00:00,"Des Moines, IA","An employee at a Mason City nursing home was working even after they had tested positive for COVID-19.  OSHA did nothing.

“This is not something we pioneered and we’re certainly not the only people to have ever done that,"" CEO Stockberger said.”

Iowa OSHA do your job.",24
2020-11-13 21:28:46+00:00,"Des Moines, Iowa","Grand View Vikings show just how much they feel the loss of 13th year defensive line coach Tom Barnabo (COVID-19). Helmets for Saturday’s game with “BARN” tribute. 
Barnabo also made immeasurable impact at Dowling. Beloved. 💔 
h/t @ToddEBailey https://t.co/AiMhOmnTZi",534
2020-11-13 21:24:02+00:00,"Des Moines, IA","SERIES: ‘In the Air Between Us’ — Why Face Masks Matter in the Fight Against COVID-19, Part 2. Calls for wearing face masks grow amid demand for mask mandate by @blackiowanews https://t.co/jKNzWqk3LG",1
2020-11-13 20:41:02+00:00,"Madison, WI","CONTACT TRACING?!

For those who have had COVID-19, did anyone ever reach out to you about contact tracing? Did you do your own form of contact tracing?

Let me know.",4
2020-11-13 18:25:30+00:00,,"@lisahagan101 Is it called ""shuting down the country"" or is it called ""following scientist's reccomendation for a plan to halt the spread of Covid-19 and save lives""? I'd advise we change the rhetoric.",12
2020-11-13 18:17:49+00:00,,@JSEveret Super Spreader party because they spread BS as well as Covid-19!,1
2020-11-13 17:48:02+00:00,West Des Moines,"Saw a post from a Biden/Harris supporter talking about Covid-19 &amp; it's relation to people's lives at stake, yet won't acknowledge 9mo. abortions as a violation of the right to life...

#SpecialKindofStupid",0
2020-11-14 23:33:56+00:00,"Iowa, USA",But our governor says we still have ventilators available and most of the people dying are over 60 so we’re good. #COVID__19 #CovidKim https://t.co/TQ68JA2kOC,1
2020-11-14 23:26:03+00:00,"Des Moines, IA","SERIES: ‘In the Air Between Us’ — Why Face Masks Matter in the Fight Against COVID-19 Part 3: Iowa infectious disease specialist says ""outbreaks of the virus"" can still occur with mask mandates. #iowa @blackiowanews https://t.co/OKp4vk0ryl",1
2020-11-14 12:52:17+00:00,"Des Moines, IA","No restaurant, no store, no party, no bar, no big family dinner, no social gathering, no sport, no travel plans or vacation, no holiday—in a pandemic—is worth the risk of catching COVID-19. #iowa #WearAMask #StayHome #Thanksgiving #BlackLivesMatter #SocialDistance #WashYourHands",8
2020-11-15 16:44:33+00:00,Des Moines,While some bars are considering closing their doors to help stop the spread of COVID-19 &amp; to keep their employees safe on the second biggest revenue producing night for bars; it comes at no surprise that Voodoo Lounge is out acting like it’s just another Thanksgiving Eve. https://t.co/CXW0c9MZOB,1
2020-11-16 21:24:06+00:00,"Iowa, USA","OMG! FOR ALL WHO THINK COVID19 ISN'T REAL! WATCH THIS &amp; KNOW!CNN's Alisyn Camerota speaks with Jodi Doering, a nurse from South Dakota who says some of her coronavirus patients often don't want to believe that Covid-19 is real, even in their dying moments.
https://t.co/1HgcCWPbu8",5
2020-11-16 20:54:54+00:00," Iowa,USA","@DrEricDing Questions: How about morticians, funeral homes?. Aren't THEY overwhelmed too ? 
How long does the COVID VIRUS remain active on dead body?",0
2020-11-16 17:32:13+00:00,"Des Moines, IA","Last Saturday, 11/7/20 I was near a friend who tested positive for covid.  On 11/11/20, my bf and I got tested.   We still haven’t gotten our test results.  The reason the virus is out of control stems directly from lack of leadership, and blame in Iowa rests squarely w #covidKim",2
2020-11-17 01:48:00+00:00,,"@marcorubio It's the other way around, Covid-19 is filling beds so there will be no room for flu complications.",2
2020-11-18 23:18:23+00:00,,A Quarter of a Million Americans Have Died From Covid-19 https://t.co/egI0rMk09k,0
2020-11-18 17:54:49+00:00,The Doghouse,"@J42766 @DMRegister I can't tolerate Pelosi's actions, eg; holding Covid relief program until after presidential election while millions suffer just to play politics- yet I'm not a monster and wish her and other Dems dead from a virus. Read your tweet again, act like a person.",0
2020-11-18 14:19:54+00:00,"Des Moines, Iowa  USA","Pfizer’s Covid-19 Vaccine 95% Effective in Final Results, Company to Seek Approval Within Days https://t.co/sAzxnsAj8x @WSJ",0
2020-11-18 04:35:18+00:00,"Des Moines, IA","Iowans who beat Covid can help others recover from the virus. The number of recovered Iowans would fill Kinnick Stadium, Hilton Coliseum, UNI-Dome and the Knapp Center combined yet only around 500 have donated convalescent plasma. 
https://t.co/LV0l2LRm8Q",14
2020-11-18 04:23:55+00:00,Iowa ,Iowa nurse watched her father fight COVID-19 in her ICU https://t.co/L09diHeKEK,0
2020-11-18 04:17:57+00:00,Iowa,@AmyGrover873 @LongCaileigh @KamalaHarris Actually herd immunity only develops after the “herd” has been exposed to and recovered from the virus. So if mask wearing actually protected wearers from getting COVID then it would also prevent development of herd immunity.,14
2020-11-19 19:29:19+00:00,"Des Moines, IA","The #derecho upended a significant amount of orchards in #IA01 already struggling due to reduced agritourism from COVID-19. 

Learn more about @USDA programs providing assistance to impacted producers⤵️ #IowaAg https://t.co/bBwdvClOLH",0
2020-11-19 17:44:12+00:00,"Des Moines, Iowa  USA",Winter is coming. That means we need to start fighting covid-19 with humidity. https://t.co/oEcmOXihoB,1
2020-11-19 00:16:36+00:00,"Ankeny, IA","Walz orders temporarily closing of bars, restaurants, fitness centers as COVID-19 cases surge https://t.co/Bar6DBC05R",0
2020-11-20 23:09:00+00:00,,Donnie has Covid-19! Supposedly asymptomatic but why did he test then?,0
2020-11-20 16:06:03+00:00,"Des Moines, IA",But it doesn’t strike a balance because COVID-19 cases are off the charts. Kids can’t go to school. Hospitals are full. People are getting infected and dying. Stay home. Do a virtual Thanksgiving. We are still #inapandemic. https://t.co/EDmnD9yO6h,0
2020-11-21 16:27:15+00:00,Online,@StevijoPayne He is COVID-19 positive?,1
2020-11-22 11:59:17+00:00,"Des Moines, IA","This woman sums it up perfectly, in my opinion.
""The guy lost the election. He should be worried more about taking care of people, with this Covid-19 going on. He's got a pandemic,"" she said. ""Come on. Biden won. Let's move on. Let's help him transition."" https://t.co/0OnprUD4NB",8
2020-11-22 01:21:23+00:00,Republic of Gilead,I think Don Jr. is scientific proof that cocaine is a vector for Covid-19.,1
2020-11-22 00:45:17+00:00,"Iowa, USA",@Hassel_Chris COVID-19 Bowl!,1
2020-11-23 22:54:49+00:00," Iowa,USA","11. How will we ever get this COVID under control, if everyone is not vaccinated? What can we learn from this to Protect US, when the next weird virus or germ hits? Society is already changed....We need planetary unity to save earth.🤝🌍",0
2020-11-23 21:04:56+00:00,Amick Acres,"@CourtneyCare The same number as the entire population of Lamoni  has perished from Covid 19 in Iowa.
#TrumpVirusFail
#GOPcovid19Deniers
#fakeVirusMorons",0
2020-11-23 14:31:44+00:00,"Des Moines, IA","Today in West Des Moines, Iowa, a church that rings it’s bell weekly to mark each COVID-19 victim will ring the bell 187 times. There have been 187 deaths in Iowa since last Monday.",621
2020-11-23 08:10:39+00:00,"Des Moines, IA",Gov. Kim Reynolds’ recent COVID-19 proclamation left some business owners confused. Now one small business owner is asking for clarity  https://t.co/yqEIycSv3l,4
2020-11-24 23:21:49+00:00,"Des Moines, IA",Far from equal – Covid-19 has shone a light on racial disparities in health https://t.co/Rq40dA2u6f,0
2020-11-24 16:11:14+00:00,"Des Moines, IA",Panthers open the season Wednesday without their second leading scorer Trae Berhow due to protocols of Covid-19 https://t.co/mhKoTH2jZQ,5
2020-11-25 23:09:28+00:00,"Des Moines, IA",The view from the ICU – The Midwest is America’s covid-19 hotspot https://t.co/iJTtLTHUsj,0
2020-11-25 20:29:32+00:00,"Iowa, USA","Insanity! The most deaths in a 24 hour period EVER! To go along with it, the most infections in long term care facilities in IOWA EVER! The Dr's say it's going to get worse after the Holiday! Coronavirus in Iowa: Tracking COVID-19 curve of cases, deaths https://t.co/OE9A6td6EU",0
2020-11-25 18:44:31+00:00,"Iowa, USA",Please remember there are 266K chairs that will be empty at tables this Thanksgiving due to souls lost to Covid.  Be gentle with others. Stay safe. Wear a mask. #Thanksgiving #COVID__19 #WearADamnMask,0
2020-11-25 06:57:28+00:00," Iowa,USA",@mhdksafa The growth and spread of racism is parallel to the COVID 19 it seems.,0
2020-11-25 03:05:04+00:00,"Des Moines, IA","First Sergeant Jesse “Butch” Fridley, Iowa Army National Guard Retired, of Kirkville, Iowa, passed away today at 3:27 pm due to COVID-19. He was my 1SG in 1994-95 w/ Company B 224th Engineer Battalion, including Partnership for Peace rotation at JRTC/Fort Polk. Good man. #RIP https://t.co/pXGORWIWO4",5
2020-11-26 20:20:58+00:00,Ankeny IA 50023,"Day 8 with Covid and all the symptoms - dare I say that I feel closer to normal than I have in a week.

May this virus end be near for my family @mookjnsn, @ManBearToast , @PonchoStory , Kayla &amp; daughter, Emily ... also including my Mother, brother and sister. 🙏🏼 #stillblessed",3
2020-11-26 03:43:56+00:00,"Maitland, FL",A lot of COVID-19 contact tracing gonna lead back to thanksgiving dinner and 3-7 Dallas and Washington,1
2020-11-27 20:47:16+00:00,"West Des Moines, Iowa","@nflcommish is an absolute joke. The @NFL decision making process seems inconsistent &amp; not reprensentative of the rules put in place for Covid-19. Make one team play using practice squad players, allow another to recover. @steelers will prevail, but man it’s a bad look #HereWeGo",0
2020-11-27 13:38:45+00:00,"Des Moines, Iowa  USA","When COVID-19 closed his restaurants, Big Al gave away his inventory. Two months later, he was still serving free meals. https://t.co/g6KLYGYs9d #DSMUSA #DSMstrong #DSMlocal",7
2020-11-28 23:36:18+00:00,"Des Moines, Iowa  USA",United Airlines is flying Pfizer COVID-19 vaccine to distribution hubs - Business Insider https://t.co/zmUp7nyGDF,1
2020-11-29 16:15:15+00:00,"Des Moines, Iowa  USA",More campers during COVID-19 brings more money for @IowaDNR https://t.co/OTnEW1q94P #IowaStrong #IowansUnite,1
2020-11-29 03:27:45+00:00,Online,@staceys5551 Ouch.  Take care. Hopefully it isn't COVID-19. Sending positive thoughts.,1
2020-11-30 11:14:12+00:00,"Des Moines, IA",Former Iowa State Sen. Eugene Fraise dies from COVID-19 complications https://t.co/M4Qd9uug8e,0
2020-11-30 06:24:56+00:00,"Des Moines, IA",Only on @WHO13news: The president of @afscme_c61 confirms that a second correctional officer has died from COVID-19 in the state.,0
2020-12-01 15:37:52+00:00,"Des Moines, Iowa  USA",Moderna applies for FDA authorization for its Covid-19 vaccine https://t.co/bd6ck0vCXe,0
2020-12-01 04:18:16+00:00,Des Moines,"I appreciate Senator @ChuckGrassley who after testing positive for COVID-19 isolated and as soon as he was able to, went back to work for the people of Iowa. https://t.co/eird6cMzPA",1
2020-12-02 22:46:33+00:00,"Tama, IA","Iowa is literally sitting on a budget surplus. We could end homelessness and provide COVID-19 relief, but our leaders are simply CHOOSING not to.",210
2020-12-02 21:29:37+00:00,Iowa,"@TigerHawkeye @djfrein @DMRegister The amount of deaths related to COVID-19 is “rather small” when compared to the total number who have been tested. Are you as cavalier to dismiss the importance of those individuals, too?",0
2020-12-02 15:10:15+00:00,"Des Moines, IA",Antibody testing showed COVID-19 was in Iowa as early as January. https://t.co/3x9XHzbX6x,3
2020-12-03 23:39:39+00:00,"Louisville, KY","Just interviewed a daughter and granddaughter who lost their 61-year-old mom/grandma to COVID-19. Their number one message to people was “this is REAL. And you never know when it will hit your family.” Very, very sad. You can watch their full story this weekend on @weareiowa5news",12
2020-12-03 16:22:14+00:00,"Tama, IA","People of Color make up a disproportionate percentage of essential workers and, by extension, COVID-19 infections.

Black Lives Matter is not just about police reform. It is about the way black and brown bodies are seen as disposable in America.",20
2020-12-03 15:35:20+00:00,United States,@BarackObama  I think y’all should be considering HOLOGRAMS not only during the current age of COVID-19 but also for any future contact resistance environmental constraints which would benefit from HOLOGRAPHIC RALLIES!! 🤷🏻‍♀️,0
2020-12-03 15:26:40+00:00,United States,"@staceyabrams In the age of COVID-19 and future viruses, Y’ALL NEED HOLOGRAMS!! 🤷🏻‍♀️",0
2020-12-03 15:00:15+00:00,"Des Moines, Iowa  USA",".@IowaCulture announces $7M fund for grants to qualifying venues, cultural organizations &amp; creative workers suffering economic losses because of COVID-19 https://t.co/6AAJTrZpuM @iowakramer @IowaArtsCouncil @IowaMuseum #IowaStrong #IowansUnite #arts",4
2020-12-03 02:30:41+00:00,"Dead Moines, Iowa",When the COVID-19 shots are released it’ll probably be accompanied by the band LFMAO coming out and belting “Shots! Shots! Shots! Shots! Shots! Shots! Shots!”...,0
