Datetime,Location,Text,Like Count
2020-03-11 23:56:33+00:00,,"2nd Tweet of the day:

Topic of discussion Covid-19 or whatever it’s called. 

Mom: maybe they’ll cancel church. 
Me: why so you don’t feel bad for not going?
Mom:(laughs and doesn’t say anything)",4
2020-03-11 23:46:23+00:00,,"I'm genuinely out of toilet paper and feeling really self conscious that people at Target are going to think I'm secretly one of those coronavirus preppers. 
#toiletpaperpanic #COVID19",4
2020-03-11 23:28:25+00:00,GO CREEK!,"Due to COVID-19 concerns, both the ISU High School Indoor and the WAMAC Indoor Meets have been cancelled.",7
2020-03-11 22:37:40+00:00,Indianola ,Sharing this information is something I commend #SimpsonCollege for doing. Many people want to know what is happening and how the college is preparing if they were to take action relating to COVID-19; regular updates are a great way to keep the students informed and stop rumors. https://t.co/v1cL9Z7Xwc,3
2020-03-11 22:23:32+00:00,,"Isn't it ironic the REPUBLICANS keep lying about the Covid 19 virus but they just keep catching it, you see you can hide you lies from us but your can't hide from God! You didn't know plague could reach the hidden places? I TOLD YOU KARMA WENT TO GO COLLECT REINFORCEMENTS ON YOU",0
2020-03-11 22:21:35+00:00,"Des Moines, IA","If I haven't seen COVID-1 through 18, will I still understand COVID-19?",4
2020-03-11 22:09:56+00:00,"Des Moines, IA",Between jterm and COVid 19 I am not at this university enough to be paying that much for my tuition......,27
2020-03-11 21:49:42+00:00,"Cedar Rapids, IA",Beef House rolls are not an antidote to COVID-19. https://t.co/p6S8xkDW9k,5
2020-03-11 21:27:01+00:00,"Seattle, WA","To those that say THIS is not as worrisome as the flu, it’s worth noting: The @WHO classifies COVID-19 as a pandemic. Hopefully this puts the scale/severity of this geographical spread in perspective. 

SARS in 2003 was not labeled as such. 

#Coronavirus https://t.co/PnnitHbu3S",5
2020-03-11 21:23:48+00:00,,Nebraska’s gift to Dababy is gonna be COVID-19,9
2020-03-11 21:10:32+00:00,"Maryville, MO",Are we overreacting to COVID-19?,0
2020-03-11 20:44:01+00:00,"Omaha, NE",100 of us are gathered in a conference room to discuss CoVid-19.,3
2020-03-11 20:43:01+00:00,"Independence, Iowa",The game legit just changed. #covid-19 #ncaatourney https://t.co/0FbSnCGSP0,0
2020-03-11 20:04:29+00:00,"Omaha, NE","@nsaahome As a nurse, I can confidently say rejecting fans access to state basketball to “protect” them from COVID-19 is not only outrageous, it’s also extraordinarily irresponsible for such a large organization to fall into the hysteria of main stream media. Robbing the kids man",0
2020-03-11 19:44:52+00:00,"St Louis, MO",Joe Burrow and the LSU Tigers would kick the shit out of the Coronavirus #COVID,8
2020-03-11 19:09:34+00:00,,Staff say they are preparing for an influx of Covid 19 cases in Johnson County.,0
2020-03-11 18:40:44+00:00,,"#RightNow there are 2 numbers people in Pottawattamie County can call with any questions or concerns they have when it comes to COVID - 19. (712)890-5368 and (712)890-5369. 

@WOWT6News https://t.co/KCuY880brB",1
2020-03-11 18:08:16+00:00,"Maryville, MO",COVID-19 will not stop me from attending the D2 Central Region Tournament. Give me basketball or give me death!,4
2020-03-11 17:58:10+00:00,,"UI’s full message on Covid-19 ⤵️ 

https://t.co/idzEvkD7QD",0
2020-03-11 17:47:26+00:00,iowa city,"“Following the identification of COVID-19 cases in Johnson County, the University of Iowa is suspending face-to-face instruction for two weeks following spring break. The university will move to virtual instruction beginning March 23, 2020, and continue online courses thr—“ https://t.co/ycxwPwRmZs",7
2020-03-11 15:41:53+00:00,United States,@SenSchumer Why doesn’t the Federal Government deploy mobile covid -19 test units throughout the U.S. paid for by the government?,0
2020-03-11 15:32:02+00:00,"Marion, IA","Guy stops on the steps, licks three fingers after eating. Then touches the railing all the way. I kind of want to go over and wipe it down. #COVID19 #coronavirus #gross https://t.co/U6Mnats6LO",2
2020-03-11 15:22:33+00:00,United States,@gtconway3d Anything on the covid-19 epidemic mr. president?,0
2020-03-11 13:34:58+00:00,"Montgomery, AL","One of the few upsides of our efforts to stave-off COVID-19 is the sudden, unexpected growth (temporarily, at least) of remote working.

Me? Put me on Team Remote. But for a lot of people, me included, there’s a price to pay for this isolation. The price IS the isolation.

1/2",1
2020-03-11 02:48:14+00:00,Iowa,@AOC When will @realDonaldTrump be contracting Covid-19? With his age he’s an at risk population and I wouldn’t mind if he was to demonstrate the seriousness of this illness by passing.,0
2020-03-12 21:28:47+00:00,"Des Moines, IA",A real league (@xfl2020) hasn’t cancelled any games yet that I’m aware of. #mansgame #Covid_19,0
2020-03-12 21:19:16+00:00,north america,Now that all sporting events are cancelled you all will get to experience what it was like to be deployed in the Indian Ocean for 6 months in the 1980s before internet and email ⚓️ #USNavy #lockdown #NCAA #CoronavirusPandemic #Covid_19 https://t.co/0fYgGKPDOq,0
2020-03-12 20:19:23+00:00,"Urbandale, IA","DES MOINES SCHOOLS TO CLOSE UNTIL MONDAY, MARCH 30 - With growing concerns over the COVID-19, or novel Coronavirus, pandemic, Des Moines Public Schools is cancelling all programs, activities and classes for a period of at least 17 days, effective at 6:00 PM on Friday, March 13.",0
2020-03-12 19:15:10+00:00,des moines.,"Downtown DSM where if COVID-19 doesn’t get you, the jwalking will. 😐",0
2020-03-12 19:00:38+00:00,"West Des Moines, IA",@MurphyKeith This is COVID-19 mess is hitting everyone. My son and I were supposed to leave for Peru tomorrow. Trip just got cancelled.,0
2020-03-12 17:58:04+00:00,"Iowa, USA","Not to diminish the terrible impact and consequences of Covid-19, but now no one will be in the office on April 1st. RIP my April Fool’s reign of terror.",10
2020-03-12 17:07:32+00:00,"Des Moines, IA","Out of an abundance of caution, the Des Moines Buccaneers in accordance with the USHL is suspending play until further notice. We will continue to monitor the COVID-19 situation and follow up with updates. Stay tuned to our website and social media. https://t.co/1nRAg2Su45",18
2020-03-12 16:09:42+00:00,"West Des Moines, IA","Due to uncertainty about COVID-19 and to reduce the risk of exposure to our constituents and community, we are postponing the Legislative Forum that was scheduled for Saturday, March 14. We are still looking for feedback from you and encourage you to call or email with questions.",11
2020-03-12 13:46:00+00:00,,From today’s @MorningBrew newsletter: @zoom_us appears to be enjoying a nice bump in stock price due to the COVID-19 fallout. https://t.co/iwbaS1WHBd,2
2020-03-12 05:52:42+00:00,"Des Moines, IA","@danielsgoldman @QuestDX Quest likes to pass along excess charges to patients when insurance companies don’t pay them what they think they deserve. Unless Quest is listening, and wants to stop billing me excess charges on a urine lab from last year that prob cost them $12? Let alone a COVID-19 lab test.",0
2020-03-12 05:47:50+00:00,"Tennessee, USA","fun things for college students to do during #springquarantine2020!
•scream
•spend more time with your friends than your family
•watch conspiracy theory vids about COVID-19
•furiously email your RD in hopes of getting your books back from 10hrs away",7
2020-03-12 02:08:39+00:00,,"I see a handful of former Lynx in the crowd, but no sight of @jakehilmer 

My guess is that he’s bowling a 300, skydiving, developing a vaccine for COVID-19, painting a masterpiece, doing his homework, all with a baseball bat in his left hand and a basketball in his right",51
2020-03-12 01:59:25+00:00,,"You know what? If #Covid_19 takes us all out tomorrow we totally asked for it. 

(Except for @tomhanks please get well soon you're America's sweetheart and we love you) https://t.co/RmMCw4rijb",3
2020-03-12 01:48:02+00:00,"California, USA",What has been cancelled/rescheduled/impacted in your life so far by COVID-19? I’m attempting to file a travel insurance claim on an upcoming flight now...,7
2020-03-12 01:41:58+00:00,"California, USA","Hanks also has a history of type 2 diabetes. Those who are diabetic have higher risks when contracting COVID-19. This is something that scares me. Multiple family members of mine are type 1, and I am insulin resistant. If you’re diabetic, check out this link from @AmDiabetesAssn. https://t.co/wlOodO0Sho",1
2020-03-13 21:21:57+00:00,United States,@Go_Iceland Also messaged on FB.  We have a reservation under Dagel for 3/14-3/20 &amp; need to cancel it and get a refund.  We can not travel right now due to Covid-19.  How do we cancel?,0
2020-03-13 19:32:04+00:00,,@mdnij34 Trump is in over his head with this Covid 19 thing. This is WAY above his cognitive abilities. He is the wrong person to be in charge of anything like this. His forte is his ability to con people. One cannot con Covid 19.,0
2020-03-13 17:25:43+00:00,"ÜT: 41.610219,-93.861754","**SHARE/LIKE/TAG** Happy flex Friday all!

With all the recent happenings regarding COVID-19, we wanted to let everyone know that the 26th annual NANBF Natural Iowa Championships is moving forward and will be held as… https://t.co/cvF53WhHTw",0
2020-03-13 17:21:31+00:00,"ÜT: 41.610219,-93.861754","**SHARE/LIKE/TAG**

Happy flex Friday all!

With all the recent happenings regarding COVID-19, we wanted to let everyone know that the 26th annual NANBF Natural Iowa Championships is moving forward and will be held… https://t.co/SAQLPsKUEn",0
2020-03-13 16:43:55+00:00,"Tennessee, USA","just got two emails within TWO MINUTES of each other that both upcoming @coin and @mikasounds shows i bought tickets for were cancelled/postponed bc of COVID-19,,:,/,/,:,/,if this keeps up i swear,,:,:,/,: https://t.co/3uZdS6q8AE",0
2020-03-13 16:10:01+00:00,"DSM, Iowa",For those needing good news on your timeline.  My niece reached her major milestone of 100 days post transplant and tests show no presence of leukemia cells and her bone marrow is 100% donor cells. Once the Covid-19 risk is less we cant wait to have a huge party for this fighter! https://t.co/pkfnfDxUtk,54
2020-03-13 15:51:03+00:00,Iowa,@ArthurKDallas1 @coronavirus Possibly 3% in hot spots unless they figure out way to flatten the curve. And I'm not sure the hospital industry can handle even a slight uptick given the for-profit consolidations &amp; the push to squeeze out profits. The day of the benevolent doctor/charity owner is gone.#COVID19,1
2020-03-13 14:27:14+00:00,"Des Moines, IA","@audinco The government insured that testing would be affordable though. Right now, my provider charges $300 for COVID-19 testing...that's with my dual insurance plans. There was no charge for H1N1 and SARS would have been $10 had I needed one.",0
2020-03-13 12:43:27+00:00,"Des Moines, IA","@nick4isu COVID-19 is also 10x as deadly as the flu. By preventing community spread and using social distancing lives will be saved. Fear is legitimate, panic is problematic, but when we all work together it can slow the overall impact to our communities.",0
2020-03-13 12:40:31+00:00,"Des Moines, IA","@nick4isu Also, this is not just a bad flu. This has an R0 (r-naught) of about 2.5, the number of people who will be infected by one person with COVID-19.  This is significantly higher than the flu.",0
2020-03-13 12:30:07+00:00,"Des Moines, IA",A new study found the average person who gets COVID-19 is contagious for 20 days.  But one patient they looked at was contagious for 37 days.,0
2020-03-13 11:39:46+00:00,Iowa,Hospital bed space is a key determinant of mortality rates for #Covid_19. Lots of bed space = about a 1% mortality rate. Not enough bed space = up to 3% mortality rate. So any good state or national @coronavirus plan should think about upstaffing and crash bedding program. https://t.co/ggNAZuVdGM,8
2020-03-13 05:39:24+00:00,"Des Moines, Iowa, USA","Processing all the Covid-19 news feels like we’re at Helm’s Deep, under siege and just awaiting what’s to come https://t.co/1vs451jWgE",9
2020-03-13 04:01:55+00:00,"Des Moines, IA",@mattmazurczak @aetiology @OHdeptofhealth You’ve had confirmed covid-19 cases for months??,0
2020-03-13 01:37:26+00:00,"Tennessee, USA",".@TMFanSupport hello! i’m trying to get a refund on my @COIN ticket (with insurance) as COVID-19 has prevented me from being able to attend the event. The US fan support number isn’t working currently, could you help me out?",1
2020-03-13 00:47:51+00:00,"Des Moines, IA","Interesting the last few days seeing how large organizations have responded publicly to the COVID-19 threat. Great to see lots of proactive decision making, particularly within many youth soccer bodies. Very telling when there has been an absence of communication, or thought...",2
2020-03-14 20:43:41+00:00,"Des Moines, IA","""GoFundMe is the bedrock of the American healthcare system, and as the number of Covid-19 cases continues to rapidly spread, we fear the servers just won’t be able to take it."" https://t.co/nhVAobIZMe",0
2020-03-14 16:03:21+00:00,United States,"@glennkirschner2 What else do these people have to do all day but play the stock market, they are stuck indoors....waiting to get a covid-19 test.",0
2020-03-14 15:33:57+00:00,in a zoom meeting,"COVID-19,
ZERO SURRENDER.
STAYING AT HOME,
ON A TWO WEEK BENDERRRRR",1
2020-03-14 15:11:32+00:00,Ted's House ,"Gang, waddaya say we all come together for a little Guinessvirus today and show this covid-19 we won’t be bullied",5
2020-03-14 01:13:23+00:00,"Dallas, TX","tired: supporting your local Chinese takeout restaurant because their business might be unfairly impacted by xenophobic fears surrounding COVID-19.

wired: it’s a Friday night and this what you always have for dinner on Fridays https://t.co/L2BokbLTcL",14
2020-03-14 00:48:47+00:00,"Iowa, USA","@KatieJo512 Funny thing is, they should be already. We have practiced like COVID-19 has been plaguing us incessantly, for the last 30 years",0
2020-03-14 00:45:56+00:00,in medias res,Today I’ve gotten Covid-19 updates from a place I bought weed and several sportsbooks. You really get a picture of yourself.,9
2020-03-14 00:19:45+00:00,outer space ,the media really f*cked us over in educating the public about covid 19 and encouraging panic buying,16
2020-03-15 21:20:30+00:00,"Urbandale, IA",This afternoon the House and Senate announced the legislative session will be suspended for a minimum of 30 days following the announcement of community spread of COVID-19 in Iowa.,0
2020-03-15 19:06:09+00:00,in a zoom meeting,"so apparently COVID-19 has made its appearance in the beautiful city of Des Moines.

Wash your hands",0
2020-03-15 18:21:19+00:00,"Des Moines, IA","Thank you, every company I’ve ever purchased from, for an update on your company and the COVID-19. This seems very necessary.",5
2020-03-15 17:36:08+00:00,"Tennessee, USA",trump after declaring today a day of prayer for COVID-19 despite it violating the separation of church and state https://t.co/eCNoPeQxnC,9
2020-03-15 16:51:51+00:00,United States,Put this up in all stores #Supermarkets #Hoarding #StayTheFHome #panicshopping #COVIDー19 #COVID #StopTheSpread #SocialDistance #coronavirus #SundayVibes #CancelTrump https://t.co/ReCCmMeHHE,0
2020-03-15 03:08:26+00:00,"Des Moines, IA","COVID-19 Fallout Increasing Food Bank’s Need for Food and Volunteers. 
https://t.co/VxyCR9CtjI",2
2020-03-16 21:06:14+00:00,"West Des Moines, IA","Due to COVID-19, the following Good Farm Neighbor Awards are postponed. We look forward to recognizing these deserving farmers in the future! Stay tuned for new event details!
❎
#GoodFarmNeighbor #SupportFarmers #IowaAg https://t.co/UDY17oFVpd",2
2020-03-16 20:13:15+00:00,"Des Moines, IA",COVID 19 UPDATE: DMPS has extended school district closure and not opening until April 13th. https://t.co/CxbW9GckPE,2
2020-03-16 19:44:16+00:00,"Seattle, WA","As the list of prominent figures in politics and media who’ve contracted the virus grows, will we begin to take the threat of #COVID19 more seriously? 

@idriselba we’re all rooting for your safe recovery ❤️! https://t.co/u7wfxHyYdB",4
2020-03-16 18:32:30+00:00,"Des Moines, IA","COVID-19 just doesn’t discriminate when it comes to Health, wealth, social status, or anything. Be as cautious as you can people. IDRIS ELBA. https://t.co/P7I2DPrTOZ",0
2020-03-16 17:41:25+00:00,"Johnston, IA","Kiwanis Club of Johnston
1 hr · 
With the rapid spread of COVID-19 and calls for social distancing, the Johnston Kiwanis Club has decided to postpone our Spring Pancake Breakfast and Book Drive to a later date. We will watch the progress of the spread of the virus closely.",0
2020-03-16 17:34:13+00:00,"Des Moines, Iowa",ICYMI Governor Reynolds announces assistance for employees affected by COVID-19 layoffs. https://t.co/OYXuwXp14s,12
2020-03-16 15:10:30+00:00,Iowa,"Just because someone doesn’t LOOK at risk doesn’t mean they aren’t at risk. You can’t see diabetes, but people with diabetes are significantly more likely to develop complications due to COVID-19 AND the flu.",67
2020-03-16 15:09:11+00:00,Iowa,"My uncle just died. He was in his 50s and had diabetes.  He had flu symptoms, but hadn’t been tested for anything else, so it’s hard to say if it was COVID-19 or not. But regardless, he suddenly died. Just fucking stay home if you don’t feel well. Please.",898
2020-03-16 11:28:14+00:00,"Phoenix, AZ","What’s usually a busy few days at the @dsmairport is rather “eerie.” Many choosing to cancel/postpone trips because of COVID-19. Others, are still taking to the sky saying they will simply practice good hygiene and aren’t afraid of getting sick or being stranded somewhere. @WHOhd https://t.co/gZCj2omuc6",1
2020-03-16 03:40:23+00:00,"Iowa, USA",@SoundOFF13 doesn't the B1G Tournament logo look like the COVID-19 depiction?,0
2020-03-16 01:47:11+00:00,"Minneapolis, MN","BREAKING: As confirmed COVID-19 cases in Iowa jump from 18 to 22 overnight, @iagovernor Kim Reynolds recommends all public schools close for 4 weeks. 

https://t.co/tndwSn0c5q",0
2020-03-17 23:57:06+00:00,"Altoona, IA","#BREAKING The Iowa Department of Public Health reports six additional positive cases of COVID-19 in Iowa. That brings the total to 29 in Iowa. Three of the new cases are from Johnson County, the other three are from Adair, Blackhawk and Dallas Counties. https://t.co/M54R35klKq",1
2020-03-17 23:54:52+00:00,"Des Moines, IA","BREAKING COVID-19 UPDATE: Governor Kim Reynolds releases a statement saying there are 6 additional positive cases in Iowa. Total now up to 29 positive cases. Of the 6, 3 are from Johnson County, and the others are from Adair, Blackhawk and Dallas Counties. https://t.co/XYNWZfPIUG",1
2020-03-17 21:59:56+00:00,"Des Moines, IA","Buying a Home, From Home

You can take advantage of all-time low interest rates and do much of the home buying process from the comfort of your home. As our nation deals with the threat of COVID-19, I'm offering the… https://t.co/FSPD0qbzLm",0
2020-03-17 19:17:16+00:00,"Moulton, IA","As the COVID-19 pandemic continues, @millermeeks will be lending her expertise as a doctor &amp; former IDPH Director to help keep Iowans calm and safe. https://t.co/glbWB8Z0cP",4
2020-03-17 19:05:07+00:00,"Phoenix, AZ",My Iowa Wild neighbor is packing up. AHL is not playing because of COVID-19 like every other league out there right now. Yesterday AHL said the indefinite suspension of play wouldn’t be lifted before May and ordered all teams to send players home. @SoundOFF13 https://t.co/xyC1d53Run,13
2020-03-17 19:02:19+00:00,"Des Moines, IA","How has Atlanta not shut down all restaurants, bars, etc.? My family lives in Fulton County and they’re all still required to work in the office (mother included). Atlanta has over 120 cases. Iowa has just 23 cases statewide and everything’s shut down. #coronavirus #COVID",0
2020-03-17 18:48:23+00:00,"West Des Moines, IA","No evidence immunity supplements hrlp prevent the spread of COVID-19, which is obviously what this is about. If so, you should be making them available free to immunocompromised people.",1
2020-03-17 17:55:21+00:00,"West Des Moines, IA","Before suspending the Legislative Session last night, we passed an emergency bill giving the Governor more authority to handle the pandemic, giving schools more flexibility in decision making, and providing additional resources for COVID-19 testing at the State Hygienic Lab.",3
2020-03-17 17:38:03+00:00,"Des Moines, Iowa",A hotline has been set up for Iowans with questions about COVID-19. The line is available 24/7 by calling 2-1-1.  The state is also providing unemployment assistance for workers impacted by coronavirus-related layoffs and disruptions. Info here: https://t.co/Kdxyr62Pem,8
2020-03-17 17:25:44+00:00,,These are shifts that the Food Bank of Iowa are looking to fill right now. The president of the food bank said it looks like they will lose 80% of their volunteers because they were corporate sponsored help that has been lost because of COVID-19. Sign up to help on their website. https://t.co/T3E7hTdIuw,2
2020-03-17 14:36:18+00:00,"Des Moines, IA",Here’s a recap of COVID-19 coverage in Iowa and Polk County. Remember to call 2-1-1 if you live in Polk County for COVID-19 symptoms and questions in order to free up county medical system which is already on a shortage of supplies. https://t.co/jmKhI2VJ9v,4
2020-03-17 13:43:29+00:00,"Des Moines, IA",@MastaDraegz @anthony_powers @HyVee I would say if it wasn’t for covid 19 they would for sure be bad guys of the year.,1
2020-03-17 12:57:12+00:00,in medias res,Better wear something green today or you’re going to get pinched and also likely infected with Covid-19.,1
2020-03-17 12:34:11+00:00,United States,"@psychdr100 It’s not fair that he is doing nothing to help people while the covid-19 has businesses and working people in lockdown. Mitch is well off, all those kickbacks from the healthcare insurance industry........",0
2020-03-17 06:00:37+00:00,"Waukee, IA","Just left the Capitol early Tuesday morning. We passed an emergency funding bill to keep the state running and to fight the COVID-19 Virus. We are adjourned for 30 days, however I will be in the district answering questions and helping Iowans. https://t.co/0kgakd3mpz",21
2020-03-17 05:29:12+00:00,"Iowa, USA","Nobody told me there'd be days like these
Strange days (and nights) indeed.                       #COVID-19 #coronavirus https://t.co/qrczgEiYGF",8
2020-03-17 01:56:58+00:00,omaha,Urbandale Community School District employee tests positive for COVID-19 https://t.co/Ub9VBuVJaG via @DMRegister,6
2020-03-17 01:48:34+00:00,"Atlanta, GA","Amid the COVID-19 cases in Iowa, these entertainment businesses are still open https://t.co/k7i06woEzh via @DMRegister",1
2020-03-17 01:43:26+00:00,,COVID-19 has me social distancing and back on Twitter.,0
2020-03-17 00:34:31+00:00,"Des Moines, Iowa","Urbandale Schools Supt. Steve Bass via email: 

“I’d like to make you aware that today we learned an Urbandale CSD employee has tested positive for COVID-19. This Karen Acres Elementary employee has sought medical attention and is currently in quarantine.” @WHOhd https://t.co/JiJ7DPKEtn",24
2020-03-18 23:18:01+00:00,Des Moines (is awesome),So what’s the endgame for America after COVID-19? A whole bunch of new social welfare programs or permanent collapse of the working class? Something else?,1
2020-03-18 22:57:10+00:00,"Des Moines, Iowa",Update from Urbandale Schools Superintendent Steve Bass on employee who tested positive for COVID 19. https://t.co/bUOMcurSPl,6
2020-03-18 20:57:24+00:00,"Des Moines, IA",For those interested in the science behind how washing your hands with soap actually works against COVID-19 👩‍🔬 https://t.co/nkwm4trYRg,1
2020-03-18 20:48:08+00:00,"Johnston, IA","Temporary suspension of programs until further notice.
❌ Fingerprinting
❌Car seat installations
❌Community educational programming
❌Solicitor permits

To stay up-to-date on COVID-19, and what is happening in our community, visit https://t.co/DwDtigShfv.",0
2020-03-18 18:56:57+00:00,Iowa/Ohio/California,My work just did a total 180 on their COVID-19 orders from last week 😂 it’s like someone new is in charge of operations,0
2020-03-18 18:27:55+00:00,Tech Noir💫,"It might come as a surprise to you, chuck, but it’s not 1918 anymore. Also, the Spanish flu originated in Kansas. Also, you could call it by it’s scientific name, COVID-19 or Coronavirus like any other level headed person. https://t.co/hCt36e65FQ",3
2020-03-18 16:12:22+00:00,"Des Moines, IA","Coronavirus or COVID-19.

Don’t ever say.....the “Chinese Virus”",28
2020-03-18 13:08:30+00:00,"Des Moines, IA",We’re blasting One Shining Moment the second we beat covid 19.,9
2020-03-18 13:08:20+00:00,"Ankeny, Iowa",What’s your current work status due to the Corona Virus? #coronavirus #covid19,0
2020-03-18 03:53:50+00:00,"Boston, MA",What does COVID 19 stand for? wrong answers only,3
2020-03-18 03:40:14+00:00,"Des Moines, IA",Des Moines Bar Owner Giving Back Instead of Giving Up After Closures From COVID-19 https://t.co/sJBknBvvtv,2
2020-03-18 02:52:41+00:00,xoxo Kat Fey,I am going to do that COVID-19 tweet updates. I’m a day behind but day 1 highlight was cooking stir fry to attempt to make my life feel a bit more normal and working from home with my buddy Sammi! https://t.co/cI4XVZ06g5,13
2020-03-18 02:27:54+00:00,"Des Moines, IA",Chuck Norris was exposed to Coronavirus.  COVID-19 has been sent to quarantine for 14 days.,0
