Datetime,Location,Text,Like Count
2020-06-06 01:45:54+00:00,"Dubuque, IA","Here’s the latest #CoronaVirusUpdate in Iowa. #ialegis

• 387 new cases (total 21093)

• This week, 6,271 people filed initial claims for IA unemployment assistance

• New COVID-19 Iowa Eviction and Foreclosure Prevention Program: https://t.co/wcAc8DYY31 https://t.co/U4D1FneHkP",1
2020-06-07 23:20:02+00:00,"Iowa, USA","@higginized  I would absolutely love to meet you and your family, hopefully before football season,  if the COVID-19 stuff allows us. You and your family are always welcome in my home, and, even though I am only an alum and fan, your family is family",1
2020-06-08 07:14:01+00:00,"Des Moines, IA","Weekend 1 of 3 is in the books for helping my pals at Des Moines Public Schools photograph “personal commencements” for the graduating Class of 2020. Due to the ongoing COVID-19 pandemic, seniors from each of the… https://t.co/exXB6l4xjT",0
2020-06-08 06:58:51+00:00,"Des Moines, IA","Weekend one of three is in the books for helping my pals at Des Moines Public Schools photograph “personal commencements” for the graduating Class of 2020. Due to the ongoing COVID-19 pandemic, seniors from each of… https://t.co/E6w6V57oQ5",1
2020-06-09 20:27:36+00:00,north america,"Hey @Murph_Andy @MurphyKeith @AndyFales remember a few weeks ago you all were asking your listeners if they actually knew anyone who tested positive for covid-19?
Two. I now know 2. Just got a contact tracing call about coworkers. 😷",1
2020-06-09 20:17:23+00:00,,Okay honestly curious. Have you or someone you PERSONALLY know been diagnosed with Covid-19,0
2020-06-09 02:10:59+00:00,"Des Moines, IA",“School’s Out for Summer” ...or more like spring AND summer due to the COVID-19 pandemic... A chalkboard calendar with February events is seen on a wall at Des Moines’ North High School as students in the Class of… https://t.co/ZTxqQbCBSB,0
2020-06-10 16:24:49+00:00,"Urbandale, IA","Hundreds of stores to close, layoffs attributed to #COVID__19 #pandemic fallout. https://t.co/f52siDOwjO",1
2020-06-10 15:39:55+00:00,"Des Moines, Iowa","Iowa State University announces fall semester will start a week early and wrap up the day before Thanksgiving. 

Also from ISU: plans for COVID-19 testing and contact tracing, class size and delivery and occupancy rates for the residence halls to limit the spread on campus.",79
2020-06-11 19:04:28+00:00,"West Des Moines, IA","Read my latest Statehouse News which includes: 

- COVID-19 recovery agenda details
- Our ""Plan for a More Perfect Union""

 https://t.co/THArLeQE73 https://t.co/u7ACp8bhMZ",2
2020-06-11 13:44:28+00:00,,How Protesting Could Affect The Spread Of COVID-19 https://t.co/gdH5Gh4sbz,0
2020-06-11 03:07:39+00:00,"Des Moines, Iowa","Right now, at 10pm in the Iowa Senate, we are debating a bill that would actually create immunity from liability for businesses and other entities whose negligence allows COVID-19 to spread. Over 600 Iowans have died and this is the only bill on the topic https://t.co/RigiSTf5xO",54
2020-06-12 21:48:12+00:00,Iowa,"Thanks @CapCityFruit for hosting Secretary @MikeNaigIA and @SenJoniErnst in Norwalk. Covid-19 has been a disruption, but efforts continue to distribute produce to every corner of Iowa! 

📦10,000 @USDA Food Boxes per week
⛽New sites for produce, like small town gas stations https://t.co/tM93WaOwUp",9
2020-06-12 19:35:13+00:00,,"Pottawattamie County reports highest single-day total of new COVID-19 cases of pandemic, spike among young adults https://t.co/hpFtesTrQZ via @nonpareilonline",0
2020-06-12 15:58:57+00:00,Iowa,"Sec. @Mikenaigia helped @CapCityFruit and DMARC load fresh produce boxes today as a part of the @USDA Food Box program. 

50,000 Americans per week + farmers benefit from these 20lb kits of US produce offered to boost food security during Covid-19! https://t.co/g3l2NclFKL",10
2020-06-12 11:09:38+00:00,"Des Moines, Iowa  USA",#Iowa is one of the states hit least by unemployment claims caused by COVID-19 pandemic https://t.co/j4V3Hs3IYx @wallethub,1
2020-06-13 14:36:33+00:00,"West Des Moines, IA","Iowa Courthouses will open for non-jury trials July 13. COVID-19 protective measures have been made including markings that denote 6 feet of spacing, and limiting the number of people who can gather in certain areas of the courthouse at one time.",0
2020-06-13 14:32:53+00:00,"West Des Moines, IA",Test Iowa is now providing more COVID-19 testing across the state. There are now 10 drive-thru Test Iowa sites and seven Test Iowa clinics. Find a location at: https://t.co/XItwgYoI1M. To get tested contact your doctor or take the assessment online at https://t.co/t8yBuo6U1H.,1
2020-06-13 12:52:06+00:00,West Des Moines,"COVID-19: Straight Answers from Top Epidemiologist Who Predicted the Pandemic
https://t.co/6iny0ooQgd",0
2020-06-14 07:39:45+00:00,"Ankeny, Iowa","Had a great time in Roland, Iowa last night. Great seeing old friends, however Covid-19 is obviously over for rural Iowa. Bruno was right on @1460kxno this past week when he agreed with the Iowa State Fair being shut down this summer. Rural Iowa does not care🤷‍♂️",0
2020-06-14 04:42:09+00:00,"Des Moines, IA","Weekend 2 of 3 helping my pals at Des Moines Public Schools photograph “personal commencements” for the graduating Class of 2020. Due to the ongoing COVID-19 pandemic, seniors from each of the district’s 5… https://t.co/HgUI3R7VJP",0
2020-06-14 00:22:56+00:00,"Waukee, Iowa","A modelling framework to assess the likely effectiveness of facemasks in combination with ‘lock-down’ in managing the COVID-19 pandemic | Proceedings of the Royal Society A: Mathematical, Physical and Engineering Sciences https://t.co/SKSOyOe7y7",0
2020-06-15 20:29:47+00:00,"Norwalk, IA","This is what going to NSDA Nationals looks like...due to COVID-19, the tournament was moved from Albuquerque, NM to online. It’s weird, but we’ll take it. I’m just hanging out with Evan and Joe between rounds. https://t.co/qay5gHTOJt",11
2020-06-15 06:49:10+00:00,"Des Moines, IA",A graduating senior tosses her mortarboard cap in the air outside Lincoln High School in Des Moines after attending her “personal commencement” time slot during the ongoing COVID-19 pandemic. @ Abraham Lincoln High… https://t.co/L0dPwN5O9d,0
2020-06-15 06:19:19+00:00,"Des Moines, IA","Due to the ongoing COVID-19 pandemic, social distancing guidelines are practiced as graduating seniors arrive for their assigned “personal commencement” time slots at Abraham Lincoln High School in Des Moines. @… https://t.co/ej8n5rtTzp",0
2020-06-16 22:42:50+00:00,"West Des Moines, IA","@NewsHour when covering the V.P.'s claims about covid-19 why do you fail to mention their is no scientific or medical basis for his claims?
Instead of spreading lies you should seek to inform viewers with accurate facts &amp; defend the truth. Not regurgitate uninformed claims.",0
2020-06-16 17:00:17+00:00,"Waukee, IA",@Ken_Rosenthal What legacy?   His legacy left the building before Covid 19 ever hit the coasts of the US.  That ship sailed with how he handled/didn’t handle the Astros cheating.,0
2020-06-16 16:36:35+00:00,,Due to Covid-19 we will not be hosting our Summer K-6 Basketball Camps. We will however be holding a 7th and 8th Grade Basketball Camp July 15-17. More information to come soon.,2
2020-06-16 15:03:22+00:00,"Washington, DC","Glad GW is going to be implementing testing in the fall. Heck, Iowa couldn’t even guarantee testing to everyone or even to those who had COVID-19 symptoms 🤦🏻‍♂️",3
2020-06-17 19:44:29+00:00,"Des Moines, Iowa  USA","Generic Steroid Drug Improves Survival in Severe Covid-19 Patients, Study Finds https://t.co/NjFO4giWZ1 via @WSJ",1
2020-06-17 18:59:37+00:00,"Ankeny, IA","I just sent a message to my members of Congress and the @FCC urging them to support #ERate funding for students’ home internet access. Will you join us and help support #remotelearning for all students during the COVID-19 crisis? https://t.co/U87EwPJ1mi 

#principalsadvocate",3
2020-06-17 15:39:29+00:00,Amick Acres,"@aubrey_huff The Covid 19 eats lung tissue.
It eats lung. Its kills you as it suffocates you.
Go brave boy, go. Be bold.
Into the valley of death.",0
2020-06-18 18:43:12+00:00,"Phoenix, AZ","Convalescent plasma donations are helping those hospitalized with COVID-19. In fact, for every one donation, four different patients can be treated. https://t.co/QJg3eXjCDq",0
2020-06-18 16:54:55+00:00,Runnells Iowa,@Luebke_Tina @IA_Cub A guy that covers the Big 12 said this is a good thing.  Kids are coming from all over the country and testing positive. Get them all in the complex and quarantined and get the covid-19 in and out of the program in the next 2 months. Seems like a valid point.,6
2020-06-19 13:33:11+00:00,"Seattle, WA","My final investigative piece on 

@KCCINews: Who was involved in high-level conversations about COVID-19 outbreaks at meatpacking plants

https://t.co/kfxBhyVcMd",45
2020-06-21 05:59:25+00:00,"Des Moines, IA","The last of 3 long weekends helping my pals at Des Moines Public Schools photograph “personal commencements” for the graduating Class of 2020. Due to the ongoing COVID-19 pandemic, seniors from each of the… https://t.co/W0gtbMoBIq",1
2020-06-22 21:38:48+00:00,"Des Moines, IA ",@kendradsimmons and I explain Iowa’s new law limiting COVID-19 liability for businesses: https://t.co/l5tFzdTsZx,1
2020-06-22 17:10:51+00:00,"Des Moines, IA","Was reading a random tweet about the economy shutdown, COVID-19, and a few other topics and the tweet really just disappeared from my timeline before my eyes. Weird shit going on around here.",0
2020-06-22 12:24:17+00:00,The Big House ,"If you go to a hospital for anything in America right now you’re likely to get a Covid-19 test. So all those kidney stones, strokes, hypertensions, etc we weren’t seeing for 3 months we are now. Those people are being tested, too. So are you in hospital with the virus or for it? https://t.co/vUXQbE4t7N",2
2020-06-23 22:47:29+00:00,"Iowa, USA","@ChrisMWilliams I will drop more than a few prayers for you tonight...and may donate to a ""Chris Williams Season Ticket"" for a COVID-19 survivor at The Jack (as much as that pains me as a Hawkeye)...it's not a rivalry now. Kick its ass. I am sure I will get it at some time as a provider...",2
2020-06-23 17:42:08+00:00,"Seattle, WA","“No other state has fewer COVID-19 restrictions in place than #Iowa does when it comes to using face masks in public and the reopening of child-care programs, restaurants and bars, according to a new national survey.”

Thoughts? Too little too soon? https://t.co/YcIY483WtW",12
2020-06-23 17:32:15+00:00,"Des Moines, Iowa",Just wanted to let my radio &amp; CF audience/Twitter family know that I have tested positive for COVID-19. This is no picnic. Please take it seriously. I will be fine and have been at home in quarantine since I started feeling symptoms on Saturday.,990
2020-06-23 16:01:55+00:00,"Des Moines, IA",Covid-19 Tests: Unpleasant to get! Especially when you have been hospitalized for severe nosebleeds in recent weeks.,1
2020-06-23 11:30:38+00:00,"Des Moines, IA","Letter from Major General Ben Corell reports that 35th Annual Iowa National Guard Alumni Day CANCELLED for 2020 due to Coronavirus 2019 (COVID-19). The 36th Annual Alumni Day will take place on August 7, 2021. https://t.co/AZuIrkSMEt",0
2020-06-24 22:53:31+00:00,Iowa ,😷 Surge in COVID-19 Cases in Story County Cause Businesses to Voluntarily Re-Close https://t.co/srXNbAdjLU,0
2020-06-25 21:03:03+00:00,"Chicago, IL","Just got tested for COVID-19 through Test Iowa. Super fast and easy. 

Why get tested? Peace of mind for sure - but also for my coworkers. As someone who covers protests, demonstrations, marches it helps ensure I can continue to do my job safely.",31
2020-06-25 15:20:11+00:00,"Des Moines, Iowa","The two scheduled high school baseball games at Principal Park today are both postponed after staff member tested positive for COVID-19. 

Games were Ankeny Christian vs Orient Macksburg.
Indianola vs Gilbert. 
More info to come.",6
2020-06-25 01:56:10+00:00,"Des Moines, IA","A3 to your A3... Does it really even count if Orlando dropped out because of positive COVID-19 tests? It seems like we’re forcing the issue of normal life again here in the US, when we’re clearly not remotely close to ready. #SoccerChat https://t.co/SVjXMgzsgn",2
2020-06-26 21:22:35+00:00,"Des Moines, IA","So as of today, in the US we have approximately 4.25% of the world’s population, but approximately 25% of the world’s COVID-19 cases and deaths... 🤔",9
2020-06-26 17:30:59+00:00,,"'Grave concerns': COVID-19's surge in Sunbelt states shows the virus, not testing, to blame https://t.co/7FV4C6eIty via @usatoday",1
2020-06-27 17:24:38+00:00,,Iowa's COVID-19 fatalities surpass eighth leading annual cause of death - Bleeding Heartland https://t.co/WykAheKvNL,0
2020-06-29 14:16:20+00:00,"Des Moines, IA",Op-Ed: Your college may ask you to sign a waiver for harm inflicted by COVID-19. Don't do it https://t.co/L4FDag4iv0,0
2020-06-30 21:56:09+00:00,"Des Moines, IA",Was just told Manson-NW Webster had canceled the remainder of their baseball season after a member of the program tested positive for Covid-19. @weareiowa5news,3
2020-06-30 15:34:59+00:00,"Iowa, USA",Happy #worldsocialmediaday I love what I do and wouldn’t change it for the world. More to come! Covid-19 isn’t going to stop my momentum! 😎 @ Saylorville Lake https://t.co/BhDPCBeADC,0
2020-06-30 06:59:44+00:00,,@JohFreder ok douche bag....fuck off!!!!! You are as fake as covid 19!!!!,0
2020-07-01 22:15:25+00:00,"Des Moines, Iowa  USA",FDA issues guidance on COVID-19 vaccine approval https://t.co/yq3kZIqWaR via @wsj,0
2020-07-01 01:22:34+00:00,"Des Moines, IA","I'm so grateful to have a parent in our program who is an epidemiologist and has been monitoring/tracking COVID-19 and understands spread, particularly in our area. I spoke with her tonight regarding our return to training. Her advice and partnership will be invaluable.
#grateful",19
2020-07-02 17:36:23+00:00,"Des Moines, IA","Grand View Lutheran Church (GVLC)[@ELCA|@SEIASynod], Des Moines, Iowa, is ready for our first in-person church service since March 15, 2020, due to COVID-19. Pews marked off, self-serve bulletins, sanitizing area will HELP keep members safe. Looking forward to seeing everyone. https://t.co/0clbXskQGu",0
2020-07-02 17:19:47+00:00,"Des Moines, IA ",My latest on COVID-19 in the workplace #COVID19 #employmentlaw https://t.co/oIQDY565dw,4
2020-07-03 22:44:16+00:00,"Nokomis, FL",With all the HS baseball/softball COVID-19 outbreaks/scares here in IA it really makes me wonder how @MLB can have a season... https://t.co/YyusqqO2iL,0
2020-07-03 00:24:41+00:00,,The speed in which advertisers switched between ads about being with us through covid-19 to now airing ads about how excited they are it’s over and we can shop again is upsetting,5
2020-07-05 00:45:09+00:00,"Urbandale, IA","What part of the pandemic do you not understand?
Two Des Moines Restaurants Close After Employees Test Positive for COVID-19 https://t.co/h3i2HJLDY2",1
2020-07-06 23:08:16+00:00,515,"unpopular opinion, especially in coaching circles. but this is actually a pretty smart idea. 

and to think otherwise is just assume that football is the great equalizer to covid-19. (spoiler alert: it’s not and it would more than likely only make it worse.) https://t.co/vaA0eA99we",8
2020-07-06 15:28:58+00:00,"Des Moines, IA",The real concern with COVID is the landmass contracting the virus. Boy. https://t.co/vgUkQv96dx,1
2020-07-06 11:00:14+00:00,"Des Moines, IA","@ColleenB123"" I know you were hoping for the best. RIP
Broadway actor Nick Cordero dies at 41 after months of COVID-19 complications""  https://t.co/QFSjfcojb9",0
2020-07-06 03:40:10+00:00,,Broadway actor Nick Cordero dies at 41 after long battle with COVID-19 https://t.co/Zkh8lHWjrD,0
2020-07-07 02:24:31+00:00,"Des Moines, IA",The East High softball team's season is over after a student-athlete tested positive for covid-19.,2
2020-07-07 00:42:51+00:00,"Des Moines, IA","@thejtlewis @realDonaldTrump “However, despite the findings of the study, the article also stated people should be cautious in their reaction to the seemingly encouraging results. Randomized, controlled trials would still be required to confirm hydroxychloroquine’s effectiveness in treating COVID-19.”",2
2020-07-08 23:19:18+00:00,"Tama, IA","Hospitals are facing a blood shortage due to COVID-19. If you are healthy and can donate blood, please consider doing so.

Be sure to wear a mask when you go to donate. https://t.co/BOPffOCQII",7
2020-07-08 19:28:05+00:00,"Des Moines, IA",My girls working the process this season.. Covid-19 ain’t stopping this 💣 squad! #IowaBlitz young talent on the rise. https://t.co/3f1z2rQiht,15
2020-07-08 18:07:40+00:00,"Des Moines, IA","US surpasses 3,000,000 total COVID-19 cases, reports NBC  https://t.co/VKP0pVVAaN",1
2020-07-08 17:57:24+00:00,"Ankeny, Iowa","@HybergerKevin @Cheritie2 @MarkFreundTV Perhaps this will be a slow learned lesson for the younger folks, but a lesson learned anyways. 10 foot tall and bulletproof ain’t gonna work during COVID-19.",0
2020-07-08 17:31:45+00:00,"Des Moines, IA","I can now confirm that it was a member of Dowling’s coaching staff that tested positive for COVID-19. The test result for this coach originally came back negative, so the Maroons played last night. AD Tom Wilson received word this morning that the test was actually positive.",28
2020-07-08 15:53:30+00:00,"Des Moines, Iowa",".@MarkFreundTV reports Dowling Catholic baseball season is done for the season after positive test for COVID-19. 
The Maroons are ranked #1 and split a doubleheader with Ankeny last night.",125
2020-07-08 15:33:41+00:00,"Des Moines, Iowa",This is interesting. Dowling played last night after previously missing games while awaiting COVID-19 test result. Dowling is ranked #1. https://t.co/l6TmZNAejK,17
2020-07-09 20:52:35+00:00,"Des Moines, IA","Dowling will also be monitoring Covid-19 and it is possible to begin the school year in a different scenario based on the pandemic at the time. Regardless, health and safety guidelines will be adhered to to keep everyone at @DCHSMaroons as safe as possible. https://t.co/KiE6ZlmMMU",8
2020-07-09 17:17:19+00:00,"Des Moines, IA","RETURN TO LEARN UPDATE: Among one of the first in Iowa to finalize plans for the 2020 Fall semester, Dowling Catholic High School confirms they will return with traditional in person schooling. Will switch to a hybrid or online learning model if Covid-19 concerns rise.",35
2020-07-09 15:44:23+00:00,,@Britt_Jill_ Obviously you are against wearing mask and believe Covid is not real. It is up to everyone including kids to keep their classmates and teachers safe. A responsible parent would never post this but would teach their child to take this virus and rules seriously.,0
2020-07-09 02:17:40+00:00,"Iowa, USA","WOW! SOMEBODY OWES ME Some Money!Tulsa sees Covid-19 surge in the wake of Trump's June rally

https://t.co/UnY2Wxp0vB",0
2020-07-10 23:16:39+00:00,"West Des Moines, IA",If you didn't gain the COVID-19 did you even quarantine right?,1
2020-07-10 21:26:53+00:00,"Des Moines, IA","Some snaps of yesterday’s @DM_North at @DSMRoosevelt softball game. From COVID-19 cases to Black Lives Matter solidarity, this Iowa high school baseball and softball season is more for the history books if not the record books. https://t.co/zVvQ1K534b",16
2020-07-10 16:30:24+00:00,"Iowa, USA","Iowa farmers and manufacturers have stepped up to combat COVID-19. Right here in Eddyville,  Wacker Chemical is converting Iowa corn starch into a key ingredient for Remdesivir, which is used right now in hospitals across the nation to fight this pandemic. #99CountyTour https://t.co/BvFKMVXnOS",39
2020-07-10 13:46:17+00:00,Ankeny Iowa,You fight the COVID virus and finally have baseball starting up only to find your local Midwest teams are blacked out. #badbusiness https://t.co/9rWPWwYJno,4
2020-07-10 02:30:55+00:00,Iowa the Hawkeye State,@FuckJerry they should of called it Covid-69 instead of Covid-19.,0
2020-07-11 20:17:42+00:00,,"But yet our Governor does nothing. IDPH: 6 More COVID-19 Deaths, 743 Additional Cases https://t.co/d9g75rM8aI",0
2020-07-12 12:27:40+00:00,"Des Moines, IA",Seriously people! This is why we can’t control the Covid-19 numbers! @IAGovernor does this look like people are being “responsible” for maintaining social distancing?!?🤬🤬🤬 https://t.co/BZeZiUVSZb,2
2020-07-13 19:36:13+00:00,"Windsor Heights, IA",Food assistance is now available to K-12 students who lost access to Free and Reduced Price School Meals due to COVID-19-related school closures. To see if your family is eligible to go: https://t.co/DZtpYJcJXO https://t.co/BqOZY0KtMd,0
2020-07-13 19:15:21+00:00,Mexico,"Who is working on securing extra childcare $ needed to support inevitable online learning @ home? 
Maybe certification program to match communities’ COVID-19-related unemployed (fam/friends??) w families requiring childcare assistance? I am willing to help! STEMistry@gmail.com",1
2020-07-13 17:02:41+00:00,"Des Moines, IA","Bishop Heelan announced that their softball season is done due to a positive COVID-19 test. But the baseball team, also with a positive test, can continue.

I think an explanation, transparency is owed. https://t.co/w6dik2QTCZ",69
2020-07-13 12:14:55+00:00,"Johnston, Iowa","After months of Covid-19 , here’s part of my reset intro chat the other day. https://t.co/QNIzVHx8BH",3
2020-07-13 01:40:39+00:00,"norwalk, Iowa","How stupid is he?! Just because you say to stop testing people for the COVID-19, doesn’t mean it’s going to “disappear!!!” How would he feel if they stopped testing and he ended up with it?!?!?!",0
2020-07-13 00:04:07+00:00,"Des Moines, IA","@MsGifurnasty @rosalita2740 You understand there was a teacher shortage prior to COVID-19, right?",2
2020-07-14 16:45:38+00:00,"41.75767,-93.603582",@joniernst Is it true that you Joni ERNST think wearing bread bags is sufficient deterrent from contracting COVID-19? Do you recommend wearing on the  face or feet? Asking for a friend.,0
2020-07-14 16:42:38+00:00,"41.75767,-93.603582",@GreenfieldIowa @joniernst Is it true that Joni ERNST thinks wearing bread bags is sufficient deterrent from contracting COVID-19? Does@recommend wearing on face or feet? Asking for a friend.,0
2020-07-15 18:25:37+00:00,,covid-19 really brings out how selfish people can be.,3
2020-07-15 02:23:58+00:00,"Des Moines, IA",Map shows county-by-county risk of encountering COVID-19 at an event https://t.co/Q4DExGxqCh via @weareiowa5news,1
2020-07-16 22:04:32+00:00,"Des Moines, IA","It’s time to #MaskUpIA and do our part to beat COVID. There are a LOT of companies that will now REQUIRE a mask when you enter.

Wearing a mask has been scientifically proven to help mitigate the spread of this virus. It is not political. It is not fake. It IS a fact. 😷😷 https://t.co/7pdY6GCRce",16
2020-07-16 19:35:08+00:00,"Iowa, USA",@lucyrohdenTV Isn't 20% capacity for Illinois football a little optimistic even in non-COVID-19 times?,0
2020-07-16 11:00:01+00:00,"Urbandale, IA",The 2020 @PCCTourney has been canceled due to the ongoing #COVID__19 health crisis. Organizers still expect to raise millions of dollars for charity partners. Tickets already purchased will carry over to next year @weareiowa5news. #CoronaVirusUpdate https://t.co/79X5Z7Tz6Q,2
2020-07-17 18:47:34+00:00,"Pleasant Hill, IA","Just heard a story out of Orlando that a guy was unfortunately killed in a motorcycle crash. Yet, his death certificate says he died of Covid-19. 🤔
The virus itself is NO scam, the scam here is the politicalization of it to shutdown everything again.",2
2020-07-17 14:17:58+00:00,"Altoona, IA","And I guess, while I'm on one:

COVID-19 is not imaginary. God is.

Do with that what you need to.",0
2020-07-17 02:39:45+00:00,"Ankeny, IA",The Tigers are now 3-5 on the season. They sat out for 14 days due to a COVID-19 exposure earlier in the season. https://t.co/O7tx3I602d,2
2020-07-17 00:42:30+00:00,"West Des Moines, IA","@emilybazelon schools can't open without teachers. 
The West Des Moines school district has lost at least 4 teachers at one school, who are leaving the profession because the threat of further spreading covid-19. 
Education yes!
Killing our teachers for politics is dumb.",1
2020-07-17 00:34:16+00:00,"Des Moines, IA",Masks and plexiglass and COVID-19: some snaps of the work underway as @DMschools prepares for next month’s return to learning with a mix of online and limited in-person instruction. https://t.co/xE5iwf46dQ,15
2020-07-18 11:41:10+00:00,,"""Still Refuse to WEAR That MASK"" !?!?!?   Can't shake Covid-19: Warnings from young survivors still suffering

https://t.co/vDFCk9plHK",0
2020-07-19 22:16:04+00:00,,Young survivors of COVID-19 speak out about how illness is still affecting them https://t.co/2Rl0USvhoL,0
2020-07-19 21:24:03+00:00,"Atlanta, GA","#AmplifyBlackVoices ✊🏾

I interviewed Black mother's, a Black father, a Black sister, and a Black man's widow about the disproportionate effects of COVID-19 in the community. 

Their stories illustrate coping with… https://t.co/XJnGciK51Z",5
2020-07-19 05:06:43+00:00,"Pleasant Hill, IA",I want to know what y’all think. Do you believe that life will return to a somewhat normal state by Christmas? Given the Covid-19 concerns,2
2020-07-21 23:49:18+00:00,"Des Moines, IA",Was thinking about cracking wise about “this so-called Trump Virus” in reference to Trump calling COVID the “China Virus” but realized “Trump Virus” refers to more than one disease.,1
