Datetime,Location,Text,Like Count
2020-03-11 23:12:32+00:00,"Logan, UT","@CougarNorcal @lilabs4156 @Ch_JesusChrist your claim about trump is silly and completely false. this decision was made to prevent spread of a disease which we have no idea how to treat. the uncertainty with covid-19 is what makes it dangerous. we know how to treat/prevent flu, but not coronavirus https://t.co/jIJqIJafwQ",1
2020-03-11 23:10:29+00:00,,I don’t know what’s more contagious. The scare and paranoia of COVID-19 or the virus itself?,2
2020-03-11 23:07:48+00:00,"Salt Lake City, UT",.@USUAggies to cancel all events and travel as precaution to #coronavirus | #COVID19 https://t.co/m4lg0SiEkU,0
2020-03-11 23:07:18+00:00,"Salt Lake City, Utah","COVID-19 hasn’t stopped company lunches—yet. But today catering was accompanied by these awesome signs declaring that people shouldn’t be opening the boxes and breathing willy nilly on the food. You know, what people generally shouldn’t do anyway... https://t.co/qxModYtaLZ",7
2020-03-11 22:25:45+00:00,"Salt Lake City, UT","@Jaytron7000 @GeekTyrant A glance at my on posts on COVID-19 would tell you my position on how people should act on the eve of this coming pandemic in the US

Not sure if anyone is going to take health advice from GeekTyrant",1
2020-03-11 22:12:25+00:00,"Salt Lake City, UT","Richard Orlandi, MD, speaking about the third COVID-19 case in Utah. 

“In this case he did everything right. He scheduled a Telehealth visit and arranged for testing in an isolated area to minimize exposure to other patients and healthcare workers.” https://t.co/ebbUxYvrTK",38
2020-03-11 21:37:12+00:00,"Utah, USA",COVID-19 conversation! Grateful to work as a NP and share experiences with fellow colleagues #NPChat https://t.co/bxxbi8MUlD,5
2020-03-11 21:10:03+00:00,Salt Lake City,Note: ARUP Laboratories at @UUtah capable of 500 #COVID-19 tests daily #utpol https://t.co/YwqvKji5Ka,3
2020-03-11 20:34:18+00:00,"Millcreek, UT",I do not consent to COVID-19 https://t.co/O0YvjlF9Fl,3
2020-03-11 19:28:09+00:00,"Utah, United States",@drkimalexander @BostonJerry @RanaLaPine Are there any children who contracted this yet at the Covid 19 level?,2
2020-03-11 18:44:29+00:00,"475 South 300 East, Salt Lake","✅The COVID-19 hotline is provided by Utah Poison Control who has the capability of about 150 different languages - 1800-456- 7707 is open 24/7. 
☎️ Feel free to call if you have questions🦠 https://t.co/bnRjxHaWCy",3
2020-03-11 18:31:26+00:00,"Utah, USA","How COVID-19 Affects Conferences

https://t.co/5Kcj9vL68M https://t.co/RfeRPv2XnS",1
2020-03-11 18:07:23+00:00,"South Jordan, UT",World Health Organization Declares COVID-19 a ‘Pandemic.’ Here’s What That Means https://t.co/x8idyuEWys via @NewsNowUK,0
2020-03-11 17:21:21+00:00,"Cydonia, Mars. The Red Planet.","Another Trump failure. 
This is BS.
The WHO just declared that Covid-19 is a Pandemic and these assclowns are more worried about how they are going to look....
Politically.
https://t.co/MBsnVKGfAn",0
2020-03-11 16:17:59+00:00,"Salt Lake City, UT","April 2020 General Conference will be done virtually; members will not gather at the Conference Center in Salt Lake City or at stake centers or meetinghouses in areas where COVID-19 is active.
https://t.co/lwXhU5busy",2
2020-03-11 15:14:16+00:00,"Park City, UT",#coronavirus #COVID19  BITCH! You need to end your world tour! ASAP!,0
2020-03-11 15:12:47+00:00,"475 South 300 East, Salt Lake","⚠️Update
Salt Lake City Mayor Erin Mendenhall Declares State of Local Emergency Tuesday evening to prepare for the potential spread of COVID-19. 
Visit- https://t.co/P12uYEmHVs for more information. 
Follow @UtahCoronavirus for updates. https://t.co/Mph7xPdm9G",3
2020-03-11 13:03:32+00:00,,@LiminalMori International Communication Association in Australia was cancelled for me in May but yea they still said we should note it our CVs as cancelled due to COVID-19,0
2020-03-11 05:43:16+00:00,"Utah, USA","Dear @tedlieu you arrogant prick with  half a brain it's GEOGRAPHICAL, West Nile virus, lime disease, Hongkong flu etc. Wuhan, Corona, Covid, whatever. Are we really trying to go there? Get over yourself. Seriously, find something real to worry about. SMDH https://t.co/vnF51PCXpS",1
2020-03-11 04:40:32+00:00,"Utah, USA","https://t.co/j63MD2MZVU Robert Goulder considers whether the COVID-19 pandemic will necessitate further rounds of fiscal stimulus, including tax cuts and mandatory paid sick leave. OSO TAX SERVICE https://t.co/VGQinSJZd4",0
2020-03-12 23:48:00+00:00,"Cydonia, Mars. The Red Planet.","The @SenateGOP and @senatemajldr value their days off more than solving the problems associated with Covid-19.  I hope every one of you is proud of your response to this pandemic and get what you deserve. 
Karma is a Biitch!",0
2020-03-12 23:03:30+00:00,"Salt Lake City, UT","1/2 I really wish the general masses would inform themselves more. COVID-19 is airborn droplet transmissible. This means just washing your hands isn’t doing shit!

Stay home if you’re positive for the virus. Healthy people chill tf out this virus is like the flu.",1
2020-03-12 22:58:11+00:00,University of Utah,@znali5 @UUtah Clarification regarding the COVID-19 cancellation process can be found here: https://t.co/GMdJ8TxDd7,1
2020-03-12 21:49:29+00:00,Las Vegas; Salt Lake City,This COVID-19 stuff is crazy 😬 what tv show do I need to watch to know what’s going to happen next??,4
2020-03-12 21:46:52+00:00,"Salt Lake City, UT","Genuine question: why has BYU been so (imo) obsessed with citing CES guidelines in their Covid messaging/planning? 

Maybe I'm extra sensitive to it bc of the last 3 weeks, but it seems like they're pointing to CES for everything coronavirus. https://t.co/AnCivdQ3z1",28
2020-03-12 21:42:31+00:00,"Murray, UT",I want to update folks on some things Comcast is doing right now regarding COVID-19. The company recognizes that internet is a critical educational and infrastructure resource at a time like this and has started taking steps to make it more available.,4
2020-03-12 20:56:53+00:00,,@MrAndyNgo @TomFitton Hey fool. FYI two Utah JAZZ players have. Contracted the COVID 19 virus.  And the US government had nothing to do with it. Don't you think people are scared enough from this shit without you spreading more rumors to panic more people.,0
2020-03-12 20:55:51+00:00,"Salt Lake City, UT","It’s seeming more and more likely that movie theaters nationwide will become restricted due to COVID-19. 

Would you pay to see a new releases streaming if movie studios gave you that option?",2
2020-03-12 19:25:40+00:00,"Utah, USA","What a time to be alive😅 #Smiths is out of carts, water, and toilet paper.
#toiletpaperpanic #CoronaOutbreak #Covid_19 https://t.co/bWrmy3a47Y",1
2020-03-12 18:51:49+00:00,"Millcreek, UT",at this point maybe im glad to be getting out of utah for the next week because the cases are growing and i get a break from people going crazy about covid-19,2
2020-03-12 18:47:52+00:00,"Salt Lake City, Utah",Just learned of a COVID-19 spread at @CityCreekCenter. Remain calm. Watch for symptoms. Have vulnerable populations call their healthcare provider. #utpol #CoronavirusPandemic https://t.co/qNabdp5d4H,1
2020-03-12 18:45:40+00:00,"Salt Lake City, UT",We are always ready. Here is what you can expect in regards to Coronavirus (COVID-19). #coronavirus #COVIDー19 @slcfire @SLCgov @SLCtv_17 @bereadyslc https://t.co/azy3t5QYgD,27
2020-03-12 18:24:30+00:00,Salt Lake City,"@GovHerbert says you don’t have to stockpile water, tap water will be fine. #Utpol #Covid_19",2
2020-03-12 18:21:51+00:00,Salt Lake City,"COVID19 IN UTAH: @GovHerbert says he’s made his decisions based on good science, and hasn’t come to these conclusions lightly.  #Utpol #Covid_19",1
2020-03-12 18:20:38+00:00,Salt Lake City,COVID19 IN UTAH:  @GovHerbert says if you can work from home do so. #Utpol #Covid_19,2
2020-03-12 18:20:06+00:00,Salt Lake City,COVID19 IN UTAH: @GovHerbert wants school districts to be smart and decide on case by case basis. #Utpol #Covid_19,2
2020-03-12 18:18:39+00:00,Salt Lake City,"COVID19 IN UTAH:  For the next 2 weeks maybe longer, want mass gatherings to 100, beginning March 16th.  including church, conferences, concerts. Does NOT apply to schools yet. #Utpol #Covid_19",9
2020-03-12 18:17:17+00:00,Salt Lake City,COVID19INUTAH: Seniors and those with underlying health issues need to take particular care. #Utpol #Covid_19,0
2020-03-12 18:15:36+00:00,Salt Lake City,COVID19 IN UTAH: @GovHerbert says have done some testing in Utah.  Sampling shows very few of those sampled have come back positive.  #Utpol #Covid_19,1
2020-03-12 18:13:47+00:00,Salt Lake City,NEW: @GovHerbert points out recent coronovirus diagnosis and cancelation of sports events and activities. #Utpol #Covid_19,1
2020-03-12 18:12:46+00:00,Salt Lake City,@GovHerbert is speaking.  #Utpol #Covid_19,0
2020-03-12 17:49:42+00:00,"Salt Lake City, UT",#AQuietPlacePart2 and #F9 have both been delayed due to COVID-19 concerns. F9 has been pushed back until 2021. https://t.co/EaXpQDcoZF,1
2020-03-12 17:42:24+00:00,,Donovan Mitchell statement on his #Covid_19 diagnosis https://t.co/wwJWXOBvNI,26
2020-03-12 17:38:03+00:00,"2001 State St, SLC UT 84190","To ensure we continue providing essential services should our workforce need to telecommute due to COVID-19, SLCo Mayor’s Finance &amp; Information Technology ran payroll, accounts payable, and all of our IT systems from the Operations Room in our EM Center. Our drill went smoothly! https://t.co/P4BRH8Yeq8",8
2020-03-12 17:34:33+00:00,"Salt Lake City, Utah","This is what the @tooeleschools Superintendent Dr. Scott Rogers sent out to parents and staff

#Covid_19 #KSLTV https://t.co/xE14wNvpCB",2
2020-03-12 16:45:41+00:00,"Salt Lake City, UT","Covid-19: Humankind can have little a existential anxiety, as a threat

Humankinda: hahaha you mispelled treat

Covid-19: I said threat

Humankind: yeah but the meme is supposed to say ""as a treat""

Covid-19: and I said, as a *threat*

Humankind:

Covid-19:

Humankind: 😮",33
2020-03-12 16:25:52+00:00,"Minneapolis, MN",“Go back to Utah” they said. “Only 2 Covid-19 cases” they said. Now the fucking Jazz are responsible for shutting down the NBA,0
2020-03-12 15:04:26+00:00,"Salt Lake City, UT","Utah Jazz's Donovan Mitchell tests positive for COVID-19, NBA source tells ESPN https://t.co/WXkVPnXH40",2
2020-03-12 14:57:57+00:00,"Salt Lake City, UTAH",Donovan Mitchell has also tested positive for COVID-19.  What a wild last 24 hours of living.  @kslsports @kslnewsradio,4
2020-03-12 14:04:37+00:00,"Cydonia, Mars. The Red Planet.","Long time older Republicans are finally starting to see how incompetent Trump and his administration are handling the Covid-19 crisis.  I have seen several reports showing that they've had enough and are switching party’s and not watching Fox News. 
#MoronaVirus45",0
2020-03-12 13:30:50+00:00,"Salt Lake City, UT",Worried about #coronavirus after  attending a recent @utahjazz game? 👇🏽👇🏽👇🏽#COVID19 https://t.co/8cAnbhyXvZ,0
2020-03-12 12:14:33+00:00,"Salt Lake City, UT","The UK is paying people 7k to get injected with COVID-19 and putting them up in quarantine with flatscreens tv and video games

The second the US offers something like that https://t.co/UqMmVEhqvJ",1
2020-03-12 12:08:37+00:00,"Magna, UT","No tenemos el control.  Podemos y debemos tomar medidas para detener la propagación del #COVID-19, pero nuestra capacitación y experiencia combinadas no nos ponen en control.  Sin embargo, Dios tiene el control, incluso cuando parece lo contrario.",1
2020-03-12 06:20:35+00:00,"Salt Lake City, UT","I’m f*cking terrified that my otherwise intelligent husband thinks COVID-19 is no big deal last night... until the NBA suspends the season tonight. Ok, we’re finally getting it. #TakeNote",1
2020-03-12 05:33:34+00:00,"Salt Lake City, UTAH",...to get tested by a licensed medical professional for COVID-19. https://t.co/C6ZIJyLk9L,29
2020-03-12 04:48:37+00:00,,"Coronavirus: WHO classifies COVID-19 as a pandemic, US suspends travel from Europe #Coronavirus https://t.co/lK5ZKj50lE",2
2020-03-12 04:42:26+00:00,,"@richn10 I had the worst flu of my life the third week of January or so, right after I got back from my party cruise. Tested negative for flu A, B, and strep. Not qualified to say if it was COVID-19 but you never know",2
2020-03-12 04:37:45+00:00,,"I have a lot on my mind tonight, after so much breaking news on #COVID19. 

One thing I want to make sure you see—the recovery numbers exceed the deaths by THOUSANDS. 

And that means, for now, we are stronger than this novel virus. 
https://t.co/cqWXWHEm1V",5
2020-03-12 03:23:03+00:00,Utah,@BaxterCavendish @UMwolfpack87 Covid Story 19:  Woody infects Bo,0
2020-03-12 02:57:07+00:00,"Manhattan, NY",Reposted from @SportsInTheBay_ Jazz center Rudy Gobert has tested positive for the Corona Virus. The NBA season has been suspended until further notice. #corona #covid19 #nba #suspension #league #basketball… https://t.co/2cD4YNERHd,1
2020-03-12 02:46:22+00:00,He/Him/His,COVID-19 is about to put this country in a recession.,7
2020-03-12 02:42:25+00:00,"SL,UT","If @rudygobert27 has tested positive for COVID-19, I bet the entire @utahjazz team will too. That's our team, and I hope nothing but the best for the whole squad!",1
2020-03-12 02:08:32+00:00,"Salt Lake City, UT",@MikeJonesSez Oh elves and trolls are immune to Covid-19. You'll be fine!,1
2020-03-12 02:01:50+00:00,"Salt Lake City, UT",BREAKING: NBA suspends season and @utahjazz player Rudy Gobert has tested positive for COVID-19 https://t.co/n3jFFJcFys,0
2020-03-12 02:01:21+00:00,"South Jordan, UT","@jjfuller72 Not saying anything. Just throwing ideas out there. If the COVID-19 is as dangerous as they claim, there should be several people come from Rudy's diagnosis. If there is no other claims...then what?",0
2020-03-12 02:01:08+00:00,Utah,Was just at home relaxing in my Shane robe after my shower... to be attacked by all of the COVID -19 news haha. That was an intense 30 minutes. 🤯 https://t.co/9lTEpqn7gC,8
2020-03-12 01:54:42+00:00,"Salt Lake City, UT","If Rudy has tested positive for COVID-19 it makes you wonder how many other NBA players are possibly carrying the virus right now, symptom free. 🤔 Does the whole NBA get tested now? Do they quarantine for 14 days in the city they’re currently in? This is kind of crazy. https://t.co/bMB9fuFn1n",26
2020-03-12 01:54:02+00:00,"South Jordan, UT",🔥take: How do we really know these tests are coming back COVID-19 positive? All we know they could be just saying that to continue fuel the hysteria.,0
2020-03-12 01:30:13+00:00,,"My 13 yr old son just informed me that the kids are calling CORONAVIRUS the “BOOMER REMOVER”

#interesting #COVID19 #CoronavirusUSA https://t.co/84AsYtPXyd",0
2020-03-13 23:54:18+00:00,"Salt Lake City, UT","Grocery stores in #Utah are rushing to restock shelves amid #CoronavirusPandemic. While toilet paper is running low we found that baby formula was still in stock.

How grocery stores are adapting, NEXT on @KSL5TV at 6pm. @kslnewsradio @KSLcom #coronavirus #Covid_19 https://t.co/4lGn6N3ZXx",4
2020-03-13 23:24:55+00:00,"Sandy, UT",It is with a heavy heart that we join the wave of event cancellations but due to continuing fears surrounding COVID-19 our Authorpalooza event that was scheduled for March 20th and 21st will be postponed until later in the year.,4
2020-03-13 22:06:07+00:00,Utah,"I have to admit that I’m not a fan of the #fridaythe13th movies.
#coronavirus #COVID19 #Covid_19 https://t.co/8RBGQ0JNYt",0
2020-03-13 21:02:40+00:00,"Salt Lake City, UT",A statement from the President of @megaplextheatre regarding COVID-19 and steps being taken to ensure the safety of their patrons. Megaplex Theatres are still open. https://t.co/iWjk7GKdZd,2
2020-03-13 21:01:02+00:00,"Salt Lake City, UT",A statement from the CEO of @Cinemark regarding COVID-19 and steps being taken to ensure the safety of their patrons. Cinemark Theatres are still open. https://t.co/aXnYnSu8Ka,1
2020-03-13 19:53:08+00:00,"SL,UT",Why am I getting COVID-19 messages from every business I’ve ever gone to ??,1
2020-03-13 19:49:42+00:00,"Salt Lake City, UT","Are we surprised that this idiot turned a national emergency announcement into a plug for hyper-privatization and advertisement for corporations? 

No, the answer is no. We are not surprised. #Covid_19",7
2020-03-13 19:17:31+00:00,"Salt Lake City, UT",Here’s the latest updates on #Covid_19 in Utah from a press conference happening now #utpol https://t.co/xl8TsKitXZ,1
2020-03-13 18:32:04+00:00,West Valley City,Keep downplaying the COVID-19 until it happens to you or someone you know....,3
2020-03-13 18:01:34+00:00,"Salt Lake City, UT",Summit Co. announces its third and fourth COVID-19 cases https://t.co/E4TShrAySV,1
2020-03-13 17:40:11+00:00,"Evanston, Wyoming","Updated at noon Eastern every day with 4pm data from the day before.
WHO data PDF seems to run a day behind that for U.S. data.

#COVID19
#Covid_19
#COVID
#Covid19usa

https://t.co/jcgDVZK88G",1
2020-03-13 17:22:18+00:00,"Salt Lake City, Utah","Day 2 without sports on The Riley Show!

- COVID-19 fallout
- League updates
- OTD in March Madness
- @dennisdoddcbs 11:30
- @Tjonesonthenba 12
- @EvricG 12:30
- @PresMoss2 1
+ more

LISTEN: https://t.co/F3zZ4ClHQ1 https://t.co/VbibEdYdvN",0
2020-03-13 17:20:44+00:00,"Utah, USA","The health and wellbeing of our team, artists, and community is our top priority. Due to the expanding impact of COVID-19 (coronavirus) around the country and the guidance of health experts, we have made the… https://t.co/jPfbIBkNQh",0
2020-03-13 16:47:38+00:00,"Cydonia, Mars. The Red Planet.","Good and Bad news.
Trump supposedly tested negative for the Covid-19 Virus. 
Fortunately, he tested positive for the Major AssHole Virus.",1
2020-03-13 16:33:35+00:00,"Salt Lake City, UT","@jessicaxfoard If you're worried about whether you may have COVID-19, 
please call the Utah Coronavirus Information Line at 1-800-456-7707.",1
2020-03-13 16:27:03+00:00,"Salt Lake City, UT","@JeanieOsc @SaltLakeHealth Salt Lake County Health clinics are not offering testing for COVID-19. If you're worried about whether you may have COVID-19, please call the Utah Coronavirus Information Line at 1-800-456-7707.",2
2020-03-13 16:19:05+00:00,,So thanks to COVID-19. I cannot go to see @cher because they rescheduled her when the @KeshaCruise is.,0
2020-03-13 16:07:36+00:00,"Salt Lake City, UT","If you are healthy but have questions or concerns, DO NOT visit a healthcare facility—“worried well” people are flooding healthcare providers with COVID-19 concerns, and exhausting health care resources for those who are truly in need. Instead, call 1-800-456-7707 with questions.",22
2020-03-13 16:04:41+00:00,"Salt Lake City, UT","Starting today our Salt Lake County libraries, rec centers, senior centers, and cultural facilities are closed. @SaltLakeHealth facilities remain open - however, they do NOT offer COVID-19 testing on-site. Please do not visit SLCO health clinics if you are ill. #utpol https://t.co/NOO5DW9GWe",22
2020-03-13 15:40:16+00:00,Planet with the water on it.,"Please say a employee at Fox News tested positive for COVID-19, this sort of news casting is dangerous. https://t.co/TCg9kegIkH",0
2020-03-13 14:05:30+00:00,"Idaho, USA","Like many of my fellow artist, I’m dealing with cancellations of shows as we approach this new way of combating COVID-19 (corona virus). I have decided that during any of the cancelled shows, I’m going to play… https://t.co/mONLstVfNQ",0
2020-03-13 13:41:10+00:00,Utah,This week has been the longest Friday the 13th ever #Covid_19 🦠 https://t.co/lGRrHOhPQH,2
2020-03-13 12:17:24+00:00,"West Jordan, Utah","And we go live, to Eastern Kentucky... 😍 #Kentucky #myoldkyhome #myoldkentuckyhome #COVID19 #coronavirus https://t.co/oczrdYhTZ9",1
2020-03-13 11:19:47+00:00,↟ 𝕌𝕥𝕒𝕙 ↟,"Literally every business that has my email: ""We're monitoring the COVID-19 outbreak closely and recommend shopping through our fantastic app or web store.""

Michaels: ""HERE'S A 90% COUPON FOR ANYTHING BUT YOU HAVE TO COME IN THE STORE TO USE IT.""",1
2020-03-13 10:18:22+00:00,"Evanston, Wyoming","Latest U.S. situation report on #Covid_19

#COVID
#Covid19usa
#CoronavirusPandemic
#CoronaOutbreak
#CoronaVirusUpdate

https://t.co/jcgDVZK88G",1
2020-03-13 10:16:08+00:00,"Evanston, Wyoming","World Health Organization situation reports on #Covid_19

#COVID
#CoronavirusPandemic
#CoronaOutbreak
#CoronaVirusUpdate

https://t.co/1mXbNbwxJK",0
2020-03-13 07:35:04+00:00,"Utah, USA",These @realDonaldTrump haters blaming him for Covid-19? Blame China! He saved many lives banning inbound Asian flights early unlike Europe,0
2020-03-13 05:32:38+00:00,Salt Lake City,I dont know what to think anymore about covid-19. Information overload. 22 million americans had swine flu in 2009 and they are predicting 1 million to have corona by April?  And I dont remember any panic in 2009. I've flip flopped 3 times today.,0
2020-03-13 04:26:16+00:00,"Utah, USA",Indignante es que un país Como USA sólo haya tenido acceso a prueba de detección de Covid-19 hace una semana. ¡Que rabia!,1
2020-03-13 03:12:04+00:00,"Murray, UT","I wipe my ass with dolla bills, yo.

#toiletpaper #coronavirus #covid19 #endoftheworld @ Murray, Utah https://t.co/6LpzGySN7J",1
2020-03-13 02:48:33+00:00,Utah,"But what do I know. I’m not a doctor, I just play one on TV.
#tbt #nostalgia #80s #90s #80skids #90skids #coronavirus #covid19 #covid-19 #80skid #90skid https://t.co/ai1Bi7qgzv",1
2020-03-13 02:19:44+00:00,"Cydonia, Mars. The Red Planet.","#FoxNews propaganda has now devolved into talking about a conspiracy theory of a superlab that manufactured the Covid-19 Virus and how it was developed to:
Make Trump look Bad.",2
2020-03-13 01:48:25+00:00,,When @realDonaldTrump said Covfefe.....he meant COVID-19,2
2020-03-13 01:12:09+00:00,"South Jordan, UT",From the governor: Help Utah officials slow the spread of COVID-19 https://t.co/scUkQCnpTV via @DeseretNews,0
2020-03-13 00:55:06+00:00,"Salt Lake City, UT",Mayor Mendenhall issued an emergency proclamation in response to COVID-19 prohibiting gatherings of over 100 individuals in SLC for the next 30 days. City boards and commissions may convene virtual meetings. City will not turn off water service for failure to pay during the term.,5
2020-03-13 00:14:06+00:00,"Salt Lake City, UT",Covid 19 is only a thing because we never found out why Mike D was fired,0
2020-03-13 00:09:34+00:00,"Salt Lake City, UT",Our @KSL5TV team is covering all angles of #Covid_19. I have a list put together of our team. Follow all of them now for the most accurate information concerning #Utah. https://t.co/rJZwEcdySQ,5
2020-03-14 21:39:59+00:00,hell,shoutout to all of the healthcare professionals in the world rn trying to save everyone’s lives and figure out a cure for covid-19. y’all are the real heroes.,3
2020-03-14 21:15:32+00:00,,Tell ICE to free immigrants in danger of COVID-19.  #FreeThemAll https://t.co/v8zuULWdYi,0
2020-03-14 21:02:31+00:00,"Salt Lake City, Utah",Coronavirus updates: Gobert donates $500K to COVID-19 relief; Mitchell posts update from isolation https://t.co/qMfJgnU0SA via @KSLcom,0
2020-03-14 19:53:48+00:00,"Salt Lake City, UT","In light of the current situation with COVID-19, City Pres is suspending our Sunday morning worship services for tomorrow March 15 and the following Sunday March 22. We desire to love and serve our city and we want to… https://t.co/5hVYLip2ZE",1
2020-03-14 19:52:40+00:00,"Salt Lake City, UT","Very informative and educational podcast on updates in COVID-19 by Emily Landon, MD, Infectious disease @UChicago Well done @chadinabhan Real issues tackled without noise. Thanks for sharing!! https://t.co/aBAejcBoqk",10
2020-03-14 19:44:54+00:00,"Utah, USA",I haven’t seen an email from the CEO of Sherwin Williams telling me they are taking measures to ensure my safety against COVID. Should I risk a trip to buy paint or is it likely I will contract the virus?,1
2020-03-14 19:27:54+00:00,"South Jordan, UT","4:50 am LONG lines, empty shelves, checkout line around whole store. 5:30 AM- in line for 1 hour to check out. So fascinating! Be safe!#COVID19,  #Covid_19, #CoronavirusPandemic, #COVID, #COVID19UTAH, #COVID19US, #COVID19USA, #UtahCOVID19, #coronavirus, #quarantine, #utahshutdown https://t.co/a2FpjnLQJV",1
2020-03-14 19:25:32+00:00,"South Jordan, UT","4:50 am LONG lines, empty shelves, checkout line around whole store. 5:30 AM- in line for 1 hour to check out. So fascinating! Be safe!#COVID19,  #Covid_19, #CoronavirusPandemic, #COVID, #COVID19UTAH, #COVID19US, #COVID19USA, #UtahCOVID19, #coronavirus, #quarantine, #utahshutdown https://t.co/rksDAu6h1E",0
2020-03-14 18:52:44+00:00,He/Him/His,"here soon and if you guys have any thoughts, suggestions or ideas for a way to spread some POSIVITY, let @_joeycunha or I know. 

Believe it or not, most people are just trying to help. 

#Covid_19",5
2020-03-14 17:44:57+00:00,"Salt Lake City, UT","Of course, my hometown is confirmed with two cases of COVID-19...Park City...Park City...Park City... 😫 https://t.co/mWwxqpUomR",0
2020-03-14 17:44:57+00:00,"Salt Lake City, UT","Nuevo caso de COVID-19 de Utah. El primero considerado de contagio comunitario, el afectado no había viajado y no se sabe el origen de la infección. https://t.co/Bji4ZGz2Ks",3
2020-03-14 17:40:52+00:00,"Salt Lake City, Utah","Dear @slcpd: Well played. 
.
.
#mikethejanitor #saltlakecity #saltlake #saltlakevalley #saltlakecounty #downtownslc #utah #coronavirus #covid19 #coronavirushysteria #youneedtocalmdown #epidemic #pandemic… https://t.co/ZTEBLmiMF4",1
