Datetime,Location,Text,Like Count
2020-11-17 18:49:46+00:00,"Salt Lake City, UT","Keep on partying in large club scenes and house parties and acting like the virus isn’t real.. Maybe when you’re done, we can get this little boys info and you can call him and tell him how much fun you’re having 😡😢 #COVID19 https://t.co/XM8eZSoPJU",1
2020-11-17 16:26:45+00:00,"Salt Lake City, Ut","A great way to verify facts in the disinformation age.
https://t.co/PVtBANMIEg
#WhiteHouseKaren #ConcedeNowTrump #tuesdayvibe #SignTheLetter #ELECTIONINTERFERENCE #Election2020results #Covid_19",0
2020-11-17 13:11:18+00:00,Texas-Utah Bernie Progressive,"Utah hospitals are maxing out with covid-19 patients.
40% of those who survive, and are discharged, either lose their jobs or are unable to work.
Yet protesters rail against wearing masks.

https://t.co/iwX5x6zexb",3
2020-11-17 01:23:03+00:00,"Utah, USA",I guess it's okay to open up a liquor store in these times  of Global pandemic then when the state has the highest covid-19 has around when people are already stressed out enough I guess it's encouraging people to go out and buy liquor to me it kind of doesn't make sense ??? https://t.co/y9YPihBiaf,0
2020-11-17 00:45:36+00:00,,"The owner of an Orem tuxedo store is using a Nazi phrase to voice his displeasure over Utah's mask mandate to help fight the current COVID-19 surge.
https://t.co/Fpl1sSSpSj",0
2020-11-18 23:02:32+00:00,"Salt Lake City, UT","The United States has surpassed 250,000 COVID deaths—a quarter of a million Americans have died from COVID-19 this year. A national tragedy, a national disgrace. #COVID19",2
2020-11-18 18:55:31+00:00,"Salt Lake City, UT","Covid 19 cases within the Utah State football program, Aggies games against Wyoming is canceled. https://t.co/UNUBuseNHs",1
2020-11-18 18:00:57+00:00,"Salt Lake City, UT","COVID-19 vaccibe is for those who are 18 years and older

Studies did not test those younger than the age of 18 so they can’t be approved to receive the vaccibe

@abc4utah",0
2020-11-18 17:19:16+00:00,"Salt Lake City, UT","State leaders are discussing their COVID-19 vaccination plans at 10:30

We’ll be live throughout the day on @abc4utah 

- Rules, timeline, who receives initial doses &amp; who can administer vaccine https://t.co/I6Z0pA99rm",5
2020-11-18 15:56:02+00:00,,@DavePlumb15 @harlsburg @PressSec @realDonaldTrump It was?  When did it start?   Moderne and Pfizer were not part of Warp Speed.  @realDonaldTrump hasn’t been to a COVID-19 briefing in 5 months.  Explain this “priority” you speak of.,1
2020-11-18 14:53:04+00:00,Sin city,Covid getting out of hand... I bet there’s atleast one person that you know that’s contracted the virus. Stay safe and most importantly check on to ppl! We in this together!,7
2020-11-18 14:32:50+00:00,"Salt Lake City, UT",.@US_FDA approves first COVID-19 at-home test. https://t.co/Jz5xLBO7sK,0
2020-11-18 10:15:40+00:00,"Salt Lake, Utah","If I get the covid 19 vaccine, am I good? What if a lot of people in my community don’t get it-is it still effective for me?",0
2020-11-18 03:23:50+00:00,"Boston, MA",It’s been a year since the first COVID-19 case was reported. Happy birthday COVID! May this be your last birthday. ☺️,170
2020-11-18 02:12:34+00:00,,What Europe’s latest COVID-19 surge means for the United States l ABC News https://t.co/e2ifMRqaCy via @YouTube,0
2020-11-18 02:11:00+00:00,,🇩🇪 public health advert COVID 19 14 Nov 2020 Episode 2 https://t.co/mUGY3Gng8i via @YouTube,0
2020-11-18 01:01:15+00:00,salt lake ,One of the people that matters most to me has Covid-19:( lil anxious over this!!! ❤️ my brother and his family!! I have a hard time connecting to people and him and his lil family are some of the few that understand it and that I have the connection with!,0
2020-11-18 00:52:08+00:00,"Utah, USA",it will take all of us to stop COVID-19. #allinUT #MaskUp https://t.co/RfObe2bAro,1
2020-11-19 23:37:32+00:00,"Salt Lake City, UT",@JoeBiden @KamalaHarris @NatlGovsAssoc It’s good to see Utah (@GovHerbert) actively participating in a new national effort to beat COVID-19. #utpol,0
2020-11-19 20:27:47+00:00,Salt Lake City,"Another grim record setting Covid day in Utah! 19 deaths with nearly 4,000 cases! #kutv2news 
https://t.co/PwD0cuMS3T",5
2020-11-19 12:19:50+00:00,"Sandy, UT","I'm making this a thing: Ridiculous Covid 19 rumor #1 ""Bee stings kill as many people as Covid, every year"". Ok, whomever let this come out of their mouth, should be slapped. Feel free to add your own ridiculous statements.",0
2020-11-19 04:51:03+00:00,"Salt Lake City, UT",Why you should watch test positivity rates as Utah reports higher COVID-19 cases in coming weeks https://t.co/lwBPdJhZxB https://t.co/zT8bjdDNMC,0
2020-11-19 03:35:49+00:00,"Salt Lake City, UT","STORY: When will you receive the COVID-19 vaccine?

Many hospitals will get it come December if the Pfizer vaccine is approved by the FDA

By July state health leaders say that's when they plan for the general public to be able to get access to the vaccine 

@abc4utah https://t.co/V9ILctYgzQ",4
2020-11-20 20:17:51+00:00,"West Valley City, UT",The real champion of sports this year...COVID 19,4
2020-11-20 15:26:00+00:00,Salt Lake City,"@ballerinaX @UT_MAZ 1st rule in reporting: if your mother says she loves you, check it out. “How many Covid-19 patients ... are really so blinkered by disinformation that they're enraged at caregivers and, in final moments on earth, still dispute what’s happening? No one bothered to find out.”",1
2020-11-20 14:12:05+00:00,"Utah, USA","Good morning, Twitter pals! 🔅

Covid-19 circumstances notwithstanding, it’s a beautiful Friday morning for the #NCA20 “Communication Pedagogy and Social Justice: At the Crossroads of Activist Pedagogy” Short Course! 📚

Ready for a lot of listening &amp; learning today! 👩🏼‍🏫",4
2020-11-21 23:48:44+00:00,#SLC,"Nice story from @rrichardh A New COVID-19 Treatment Is Coming, But There's A Catch https://t.co/hWLXXfBnef",8
2020-11-21 19:15:17+00:00,"Sandy, UT","Let's review all of the Trumpys that have had Covid-19 &amp; seemingly miraculous recoveries. We have Nikki Haley, Kim Guilfoyl, a bunch of Pence's people, and so on. Don't let it dominate your life, is a good plan, so long as you have ""connections"". https://t.co/mTLacMjPqq",0
2020-11-21 18:15:34+00:00,,@realDonaldTrump He’s having COVID-19 treated at a rehab center!  Weird. Not weird.,0
2020-11-21 17:03:30+00:00,In The Data,"These golfing trips cost the American taxpayer, *at least* $150,000,000.00

These golfing trips, since the start of the pandemic also directly exposed hundreds of people to infection by COVID.

Almost 2,000 American died from COVID-19 yesterday. https://t.co/Dz5sRmAPQ5",16
2020-11-21 16:48:30+00:00,Salt lake City. Ut,"@jessecase @neilpX I am far more confident that the German company Pfizer and other reputable companies are the ones coming forward. When Trump was picking winners and losers for a vaccine, that made me very nervous.

FDA cautions against use of hydroxychloroquine or chloroquine for COVID-19",0
2020-11-21 15:21:17+00:00,,"@CNN @realDonaldTrump 
Congratulations!
The USA is number one in Covid-19.
You should be so proud of this accomplishment!",0
2020-11-21 03:40:42+00:00,,I am thankful that my son tested negative for Covid-19 today. #givethanks,1
2020-11-21 00:54:05+00:00,"Salt Lake City, UT",If COVID-19 was a person I would simply bully them.,1
2020-11-23 17:34:45+00:00,,@SenTedCruz shame on you! It’s several weeks after the election and 7 members of my family have Covid-19. It didn’t disappear and I wish my GOP lead state would have been more strict. You’re a lying disgrace. https://t.co/D8rLrR65ul,0
2020-11-23 17:09:46+00:00,"Salt Lake City, UT","The 800 orange flags represent active COVID-19 cases in the Utah prison system. White flags mark the 7 deaths due to COVID-19.

Most incarcerated people should be released immediately! Prioritize the immunocompromised &amp; those with &lt; 1yr left in their sentence! https://t.co/5vcx59P7Aa",109
2020-11-24 04:29:31+00:00,"Salt Lake City, Utah",Supporting #STEAM learning during COVID 19. Please click through to read about our new learning initiatives and how our community can take part. #GivingTuesday https://t.co/Dpg4H87w6i,3
2020-11-24 03:41:48+00:00,,L.A. County inches closer to new COVID-19 stay-at-home order https://t.co/uYtoP60oW6 via @YouTube,0
2020-11-24 01:58:33+00:00,,Millions stick to Thanksgiving travel plans despite urgent COVID-19 warn... https://t.co/M3zKhCOVa4 via @YouTube,0
2020-11-25 23:10:43+00:00,"Salt Lake City, UT","back when this whole covid 19 thing started i assumed it was aliens who had put the virus on the earth and i said to myself, “damn whats next? they going to put a mysterious metal obelisk on here as well??” and guess what. i was right about that. this really happened.",3
2020-11-25 21:34:13+00:00,University of Utah,"A thoughtful dive into the “moral injury” when HCWs are told they are wessential but treated as disposable Beyond burnout: For health care workers, this surge of Covid-19 is bringing burnover https://t.co/Qi63ZrDvwn via @statnews",6
2020-11-25 05:36:08+00:00,"Salt Lake City, UT",Our service industry has been impacted by COVID-19 in ways that have devastating ripple effects across our community. They need @SenatorRomney and @SenMikeLee to get serious about saving jobs in the 4th largest employment sector in Utah now. #utpol https://t.co/MfXHprHx9S,119
2020-11-25 04:04:53+00:00,"Salt Lake City, UT",How do I get an antibody test for COVID-19?? I just wanna see if I had it earlier this year.,18
2020-11-25 03:17:36+00:00,Utah,"@bamadavis14 @BaseHit1 @CFBHeather @jsnshep BYU didn’t pass on Washington, that game was never going to happen due to COVID-19 at ASU",0
2020-11-26 17:33:03+00:00,"South Jordan, UT","My wife said I couldn’t text to my sibs: After 26 people died in Utah due to COVID-19, I am grateful for all those who have chosen to follow the advice of the medical community &amp; sacrifice having Thanksgiving dinner w/ people other than their household this year. #givethanks",1
2020-11-26 16:49:58+00:00,Salt Lake City,Apparently dogs can be trained to  smell #SARSCoV2! But what happens when the dog gets anosmia? #coronavirus #COVID19  #dogs https://t.co/W1K3LYLSKT,0
2020-11-26 03:23:59+00:00,"Washington, DC","Before 2020 this headline would’ve been shocking, now it’s like 🤷🏻‍♀️. “Dead mink infected with a mutated form of COVID-19 rise from graves after mass culling.” https://t.co/fzhB2MWbt1",37
2020-11-27 22:29:23+00:00,"Salt Lake City, UT",Deadass can’t believe the person I was giving a ride back to the dealership was going off about how Covid-19 is fake news. He even said it’s okay for me to take my mask off.,2
2020-11-28 11:14:02+00:00,Texas-Utah Bernie Progressive,"https://t.co/GiDkWF55nu
How many really died of covid-19?
We may never know how big the actual number is
Because employers did not report employee deaths.",6
2020-11-30 14:44:38+00:00,"Silicon Slopes, UT",@MarcRuby Brilliant commentary on amount of financing deals being arranged via Affirm for the hottest and expensive piece of home fitness during Covid-19.. Too many responses of “Now do X” don’t get it.,0
2020-11-30 01:01:54+00:00,Navajo Nation/Southern Utah ,I’ve had COVID-19 and luckily I immediately isolated to prevent any exposures! https://t.co/lYVFVPQWY2,0
2020-12-01 18:17:04+00:00,Salt Lake City,"No vaccinated patient got severe #COVID19. Check out this piece in @ScienceMagazine. Go @moderna_tx! Vaccines to the rescue, but gotta get through a tough winter first.  #SARS_CoV_2 #coronavirus https://t.co/6DKE5wutfb",3
2020-12-01 02:36:01+00:00,In The Data,"Don’t. Touch. Yer face.

Touching the nose and eyes is how many viruses are transmitted.

Interesting study. Direct access to the CNS might explain many of the neurological findings associated with COVID-19.

P.S. Love the ultrastructure. https://t.co/se4nHdWMIb",10
2020-12-02 22:44:08+00:00,Salt Lake City,"Dec. 2 data: Utah reports 17 new COVID-19 deaths, 4,004 new cases. #kutv2news 
https://t.co/nXGqOoyVGc",0
2020-12-02 17:50:07+00:00,,Walter and I are ready to hear about NEW @Intermountain research on a COVID-19 treatment study in Utah. https://t.co/Ohqq1w3WTY,5
2020-12-02 12:30:14+00:00,"Salt Lake City, UT","Buen día! Up since 4am to do hits for Argentina and Miami. First one, talking about the Moderna COVID-19 vaccine! https://t.co/vZFwITh11u",0
2020-12-02 08:55:14+00:00,"Washington, DC",The Husband-and-Wife Team Behind the Leading Vaccine to Solve Covid-19 https://t.co/5eTvXtMVRr,1
2020-12-02 03:45:02+00:00,"Sandy, UT","Today at work, I was schooled on Covid colitis. Yes, this fucking virus has it's own colitis too. Insidious.",1
2020-12-03 18:16:04+00:00,Salt Lake City,"Amid wait for COVID-19 vaccine, Gov. Herbert &amp; Dr. Dunn speak about pandemic. On KUTV live right now! #kutv2news 
https://t.co/6ZfdOeWmOT",0
2020-12-03 16:41:29+00:00,"Murray, UT",More Americans died yesterday from COVID-19 than died from the terrorist attacks on 9/11/2001.,16
2020-12-03 02:36:30+00:00,In The Data,"CDC had a long-running, hospital data tracking system in place for years, but the Trump administration shifted COVID-19 hospital data to private contractors. TeleTracking Technologies Inc., aaaand, Palantir. https://t.co/YMKnRDYGMg",7
2020-12-04 20:40:14+00:00,Salt Lake City,"Dec 4 data: Utah loses 8 lives, confirms 3,005 new COVID-19 cases . #kutv2news 
https://t.co/vtjyLyTX8z",0
2020-12-04 18:37:15+00:00,Salt Lake City,"Romney criticizes Trump's COVID-19 leadership, calling it 'a great human tragedy.' #kutv2news 
https://t.co/YtFC24rvR3",0
2020-12-04 01:54:34+00:00,,2020 Plot twist: Cartels hijack Covid-19 vaccines,0
2020-12-05 19:09:19+00:00,"Boston, MA",Listen to Bill Nye talking about masks &amp; COVID-19. https://t.co/YfPfQk2mqB,1
2020-12-05 19:02:50+00:00,"Boston, MA",Take COVID-19 seriously as cases surge in US. https://t.co/KStqnXVFf6,0
2020-12-05 16:57:33+00:00,,@Ek7_PRN Because if you catch fake covid-19 you have a 99.99% recovery rate . And you can’t catch it again .you even have to be tested to even know you have it . This is a Democrat way of fucking with your head .,1
2020-12-05 16:07:34+00:00,"Salt Lake City, UT",In @NEJM ➡️ Cancer pts receiving immunosuppressive Rx may shed viable #COVID19 virus for 60 days after infection.👇Quarantine guidelines need revision. Pertinent research with huge implications on our practices. 👉🏻 https://t.co/WV1TMmLPNF  @mini_kamboj &amp; team @SocietyofMSKCC https://t.co/6qHw7tJI1n,62
2020-12-05 15:42:39+00:00,,"@realDonaldTrump So have YOU; covid 19 deaths, job losses and unemployment, and just general anxiety among the American people...ALL the HIGHEST, ever and ALL thanks to YOU and YOUR many, many, MANY failures!!
#TrumpIsALoser
#TrumpIsANationalDisgrace 
#LockHimUp",0
2020-12-06 23:07:00+00:00,"salt lake city, ut","When Covid-19 closed schools, Black, Hispanic and poor kids took biggest hit in math, reading https://t.co/CY8SC6s5Z1 via @nbcnews",0
2020-12-06 20:44:33+00:00,"Utah, United States",So It was bound to happen. Rudi Guillani has Covid-19. I despise who he wors for but I Hope he's  ok.,0
2020-12-06 20:25:08+00:00,in the 801,"New nickname for Rudy Giuliani: Super Spreader.

It works for both COVID-19 &amp; all the lies https://t.co/1KOnxmXmwN",0
2020-12-06 20:12:34+00:00,salt lake city,Fpr@all@those who have lost a loved one to Covid 19 hold the @realDonaldTrump &amp; @senatemajldr  and the whole @GOP accountable.This are the in-humans who have cost us all those lives,0
2020-12-06 19:45:16+00:00,Salt Lake City,A little seasonal comic relief from @theadvocateno is always welcome during difficult times. #COVID19 #coronavirus #vaccine https://t.co/UbjB8v3MSV,9
2020-12-06 07:38:24+00:00,"Utah, United States","Trump did a fantastic job with the economy do you think? I mean we're only 3.3 trillion dollars in debt. Half the country is unemployed and the other half has covid-19..  rump is toast. If he had any self-respect, any patriotism and concern 4 our natl. health he would grow up https://t.co/fiKE6id5wG",0
2020-12-07 18:45:30+00:00,"Salt Lake City, UT","In @NatureMicrobiol ➡️ Great news on Rx front of #COVID19 👉🏻a new antiviral drug, MK-4482/EIDD-2801 or Molnupiravir completely suppresses virus transmission in &lt; 24 hours in pre-clinical model. Hope a clinical trial will confirm this soon. https://t.co/et7iZ0nTSY @OncoAlert https://t.co/qEqbC7sFC8",33
2020-12-07 05:41:02+00:00,,@SenatorLoeffler Loeffler:666:  “I shall down play COVID-19 while I dump my stocks that will be harmed before anyone else and buy stocks that will prosper.”   What mewling quim.,2
2020-12-07 03:19:13+00:00,Navajo Nation/Southern Utah ,"Any Diné home builders that wanna go on record for a @navajotimes story? Even as we’re in this COVID-19 pandemic, some of our people are using this time to build their dream homes or make improvements with their own means. I’m talking about handcrafted homes. Please DM. Thanks.",16
2020-12-07 00:41:56+00:00,Western New York,"Kelly Loefler cares about charter schools- rich kids shouldn’t have to rub elbows in the halls w/poor kids.

She refuses to answer directly. 

Using word “cure” re COVID 19 as if that’s any kind of reality. 

I’d love to slap that smirk right off of her lying, privileged face.",1
2020-12-08 19:18:46+00:00,"Washington, DC","If you ever spent school nights imbibing at Sign of the Whale in Washington, D.C., you don’t need to worry about what’s in the COVID-19 vaccine.",115
2020-12-08 17:28:48+00:00,"Midvale, UT","Garber said the league has lost almost $1 billion in revenue this season, and also incurred unexpected expenses. The COVID-19 impact, therefore, has been deeper than expected.",0
2020-12-08 16:26:33+00:00,"Salt Lake City, Utah",A British woman today is the first person in the world to receive the covid-19 vaccine. #COVID19 https://t.co/saXsvaz1sv,1
2020-12-08 16:11:13+00:00,Texas-Utah Bernie Progressive,"https://t.co/44KOS0pAYd

United States
Cumulative Numbers
Covid-19

Cases...15,383, 380
Deaths...291,016
Recovered...8,994,191

Nearly 9 million so far
Covid survivor future
Pre-existing conditions.

Without ACA
These people are
F*****

Georgia, please vote blue. https://t.co/8LvZJbxWGY",0
2020-12-08 05:49:29+00:00,"Salt Lake City, Utah, USA","Thank you @CDCgov for issuing ventilation guidance as part of a multilayer risk reduction strategy for COVID-19. While these strategies aren’t new to industrial hygiene &amp; engineering communities, CDC’s guidance reaches a broad audience. Welcome back CDC!  https://t.co/kcJWA5ppH0",17
2020-12-08 04:43:38+00:00,"Salt Lake City, UT",It never felt better to be home. 65-year-old Laura Balfour last saw the inside of her house on Sept. 3. It’s been a harrowing battle with COVID-19 ever since. Putting the finishing touches on her story that airs tonight on @KSL5TV at 10p #KSLTV #Utah https://t.co/ciVWvYvp6w,7
2020-12-08 04:09:13+00:00,"Salt Lake City, UT",Shocking 14 players have been in the Covid-19 reserve list https://t.co/Cif4FJ824y,0
2020-12-09 19:13:46+00:00,,"I'm not going to lie.  I am more than a little sad this morning.  Right now I should be on a plane to Tampa to be with all my NIAAA family.  Thanks COVID-19
@NIAAA9100 
@utahiaaa 
#NADC2020 https://t.co/iGXJv48gP0",26
2020-12-10 19:51:17+00:00,,"Just got word that this game we were planning to broadcast Saturday has been canceled due to positive COVID-19 results at Utah State. 
The teams are exploring options of rescheduling the game later in the season. 
#aggiesalltheway
#weareweber https://t.co/Zql5EufCUP",1
2020-12-10 18:51:32+00:00,"Salt Lake City, UT","Working on a CITI program training about COVID-19 Strategic Planning for 2021 and guess who pops up... I see you, @LoriKMcDonald! Thankful for you and your leadership. 🙌🏾 #UofU #ThatsMyVPSAYall #GoUtah https://t.co/791WrqSHiU",4
2020-12-10 18:43:37+00:00,"Salt Lake City, UT","Dr. Dunn days Utah has now surpassed 1,000 deaths due to covid-19",2
2020-12-10 15:50:05+00:00,"Murray, UT","There’s no doubt the COVID 19 pandemic will count among the most horrifying loss of life events in American history, and we should do our best to mourn these almost uncountable dead as though they were our own kin.",2
2020-12-10 10:39:54+00:00,"SLC, Utah","The end of the beginning or the beginning of the end?? Hoping for the latter... 🤞 
#COVID19 #2020 #contagion 
 
A 90-year-old UK woman becomes the first in the world to receive a COVID-19 vaccine outside of trial  https://t.co/W2zSFpoesH",0
2020-12-10 10:11:58+00:00,"Boston, MA","As my family tests for COVID-19 for the 2nd time, I remind myself how lucky I am to have so much support from our hospitals, friends, and internet friends. Despite being apart, I feel connected to you all. We got this. We will get through this together.",30
2020-12-10 07:12:15+00:00,sumplace 🇺🇸,"@Skillingthemso1 @Faungirl123 Yes... If you actually had a virus that was a killer, unlike Covid-19 which... By itself cannot kill... Nothing mote than a horrible flu...
**FACTS**",0
2020-12-10 05:10:44+00:00,"Sandy, UT",@SpencerKeele It’s going to be covid-19,1
2020-12-10 03:21:01+00:00,sumplace 🇺🇸,"Mitch McConnell unleashed on Speaker of the House Nancy Pelosi as she continues to block COVID-19 funding.

The comments from McConnell also come after Pelosi admitted that she purposely blocked COVID funding and wouldn't agree to a smaller bill unless Joe Biden is in office.",1
2020-12-11 23:07:07+00:00,"Cincinnati, Ohio",Skiing in the time of COVID-19 @ Alta Ski Area https://t.co/0uMrI6bj9b,0
2020-12-11 17:07:34+00:00,"Lexington, VA",@robbypeckham Creamery chocolate milk kills COVID-19,2
2020-12-11 14:18:30+00:00,"Salt Lake City, UT",This is the third trip in the span of a year the “Backcountry Santas” have loaded up planes with donated supplies to take to the Navajo Nation. This is their second time for Christmas but the community is among the hardest hit by Covid-19 and help is much needed. ❤️ https://t.co/5thf3EGyrL,4
2020-12-12 22:13:29+00:00,In The Data,"COVID-19.

It did not have to happen, at this scale.

Thank you for your music Charley. https://t.co/iu5KdS3GvP",16
2020-12-12 20:49:34+00:00,"Utah, USA","@stagzr @iuki001 @tepperleen @Kes_Kon @ClayTravis @realDonaldTrump We got to this point because early measures were not taken which prolonged the virus, now we are dealing with anti- maskers ( TY TRUMP) and covid fatigue.

Biden will do many positive things to make this better but Trumper's will undermine.",1
2020-12-12 05:09:59+00:00,Salt Lake City,This is what an effective #vaccine looks like compared to placebo when plotting #COVID19 cases vs time. Impressive! See study in @NEJM.  #coronavirus https://t.co/WmYOnZNNSX https://t.co/5YHtWEWGBP,2
2020-12-12 03:14:49+00:00,,"Holy utter embarrassing, Uof A! Sheesh! Hoping this domination by the Tempe team will symbolize what the vaccine will do to covid-19! Trying to find some silver lining in this #rivalrygame!  #AZvsASU",1
2020-12-12 00:51:50+00:00,"Utah, USA",@Lawrence @TexasGOP @realDonaldTrump Trump as the new Jefferson Davis? I still think Trump is channeling Herbert Hoover. Depression? What depression? Covid-19? Soon those cases will be zero,0
2020-12-13 22:53:31+00:00,,"@Alias_Reign @cassierae___ @SistaRetro @IJefTomI @SpaceCorpsUS @HillaryClinton I think you need to change your crack pipe 🤔🤫or get something else to smoke 
My looking at CDC stats for the past five years 
there’s almost the same from flu in five years... not one 
In Comparison to COVID-19 &amp; this is slight of a year - 300,000
SORRY ITS SO NOT THE SAME!🧐",0
2020-12-13 18:42:31+00:00,,"@SpaceCorpsUS @HillaryClinton I like how you want to blame her for these people’s deaths over war yet not hold accountable the Scumbag criminal occupant for COVID-19 deaths &amp; protest deaths
yet Hilary wouldn’t had been all over this thing unlike who you wont yet not blame more for almost 300,000 Deaths",1
2020-12-13 00:21:29+00:00,"Salt Lake City, UT",Oh man- praying that she recovers. No #VERZUZ  tonight because Ashanti tested positive for COVID-19. 😔 https://t.co/pM7Yj001tT,2
2020-12-14 20:25:27+00:00,"Utah, United States",@Anons_daddyO Where are they going what are they doing are they not wearing masks? What is it they're doing that's exposing them to covid-19 so much?,0
2020-12-14 17:19:44+00:00,sumplace 🇺🇸,"Due to my entitled white privilege, 
I'll be donating my Covid-19 vaccine to someone less fortunate.
No need to thank me. 
😁😍👍",2
2020-12-14 00:58:32+00:00,"Salt Lake City, UT",Republicans—who give a SHIT about the virus &amp; who have all contracted covid &amp; infected countless others—have decided the White House &amp; “senior government officials” are going to be among the first to get vaccinated?!?! What the actual F*CK?!?!,3
2020-12-15 23:30:43+00:00,"Salt Lake City, UT",What is an MRNA vaccine? How does it work? @UofUHealth  breaks down how the COVID-19 vaccine works in your body to fight the virus. MORE: https://t.co/G5mz92ygi4 https://t.co/LDWgUt6IGQ,2
2020-12-15 20:46:58+00:00,Salt Lake City,"Dec. 15 data: As some Utahns get COVID-19 vaccine, 15 more deaths reported. #kutv2news 
https://t.co/oMwjuzEzND",1
2020-12-15 20:46:16+00:00,Salt Lake City,"First doses of COVID-19 vaccine administered to Utah frontline workers. #kutv2news 
https://t.co/6NgftroH6M",2
2020-12-15 20:19:51+00:00,"Salt Lake City, UT","WATCH LIVE: @Intermountain is giving healthcare workers the COVID-19 vaccine right now

Below is part of the process

Link here —&gt; https://t.co/dq8KhtoErK

@abc4utah https://t.co/bxsxcAdNpy",5
