Datetime,Location,Text,Like Count
2020-07-21 13:51:02+00:00,Texas-Utah Bernie Progressive,"@bunkybun We're still testing those damn things?
Money for covid-19 tests,
Not nuclear tests.",1
2020-07-21 11:35:39+00:00,"Salt Lake City, UT",Don’t miss this COVID-19 update with @MJAckermanMDPhD  interviewing @DrStaceyRizza this Friday #FacebookLive @PACESep @CardioGC https://t.co/oBB5KK2Kz8,2
2020-07-21 10:38:44+00:00,,@ArtValley818 We all have covid 19 . Now open every thing up and let’s start living again . Trump 2020 !!!!!,1
2020-07-21 02:09:32+00:00,In The Data,"Dear politicians: Please don’t try and spin COVID-19 numbers. Viruses don’t have an agenda. They simply follow the laws of biology. Just report the numbers and enact policy based upon the numbers to keep people safe.

That is the only thing that matters.",92
2020-07-22 21:10:31+00:00,"West Jordan, Utah","#Update: 10 new deaths, 566 new Utah COVID-19 cases reported Wednesday https://t.co/lpuxIsqgFd via @GephardtDaily",1
2020-07-22 19:58:54+00:00,Salt lake City. Ut,@NikkiHaley Trump does not even agree with his own COVID-19 medical experts. He and you republicans are the only ones playing politics.,1
2020-07-22 17:40:18+00:00,"Salt Lake City, Utah",I think I caused the coronavirus pandemic.  #coronavirus #covid https://t.co/bNo1i12VZk https://t.co/CPpT7VYWfN,5
2020-07-22 16:42:04+00:00,"Utah, USA",🍉 😷🍉 Today’s mask has the summer vibe! Watermelon is one of my favorites!! Reality &amp; data support wearing a mask to reduce the transmission of COVID-19! We are collectively proving it!! PLEASE keep it up Utah!! #MaskUpUtah #MasksAreFun @UofUHealth https://t.co/zst0l8e45P,13
2020-07-22 14:20:13+00:00,"Salt Lake City, UT","@RidePriority Any discounts for people who have lost their jobs due to COVID-19 and is about to lose his car as well? You know, hypothetically?",0
2020-07-22 02:37:25+00:00,"Salt Lake City, UT","@Joshua_Newman Considering Tokyo's daily record of COVID-19 cases is something like 783, and that was in April, and Utah has had several straight days of 400 plus with a third of the population ... yes?",0
2020-07-22 02:21:17+00:00,"East Millcreek, UT","The U.S. is a complete shitshow, in direct relation to the President who is a complete shitshow. End the nightmare!
@realDonaldTrump @GOP #COVID__19 #VoteBlueToSaveAmerica2020 https://t.co/PEretYZyCZ",1
2020-07-23 23:42:30+00:00,"West Jordan, Utah","Utah COVID-19 update: 7 deaths, 521 new cases reported Thursday https://t.co/mbOFbmNgKQ via @GephardtDaily",3
2020-07-23 23:13:29+00:00,"Salt Lake City, UT","Taking the Trax to my overnight shift in the cancer ICU tonight. Disappointed to see only about 1/2 of people wearing a “required” face covering. @RideUTA how can we do better at enforcing the mask rule to keep me, other riders, and my patients safe? #Covid_19",6
2020-07-23 15:12:43+00:00,West Jordan Middle School,"I just sent a message with @NASSP to my members of Congress urging them to support emergency COVID-19 relief funding for K-12 schools. 

Can you join us and make a difference? It only takes a few clicks to send an important message! https://t.co/19a0neslB4 

#principalsadvocate",9
2020-07-23 03:34:34+00:00,"Utah, USA",California surpasses New York to become the state with the most COVID-19 cases  https://t.co/spwiXSADYE,0
2020-07-24 17:03:17+00:00,"Midvale, UT",Positive stories are kinda rare in the age of the coronavirus. So I’m glad I got to write one about how #RSL forward Justin Meram honored the mother-in-law of the team’s head athletic trainer. She died of COVID-19 in April. https://t.co/FSqgt38OYS,14
2020-07-24 16:23:10+00:00,Texas-Utah Bernie Progressive,"@at_revenge Yeah, I believe it.
I have family and friends in Texas.
It is an absolute covid-19 catastrophe,
And they all know who's to blame.",0
2020-07-24 09:18:10+00:00,"Salt Lake City, UT","Psychological hell is when your contractor doesn’t finish on schedule. You are surrounded by dust, you have ocd, and every time you cough or sneeze makes you believe that you have covid-19.",0
2020-07-24 03:55:46+00:00,"Utah, USA",This is just awesome. 🤣😂🤣#pandemiclife #coronavirus #infj #COVID19 #humor #amwriting #introverts #AloneTogether #pandemic #AllInThisTogether https://t.co/xXri7bHKNt,36
2020-07-24 01:01:49+00:00,"Draper, UT",Parents and students please check your inbox for the newly released @JDCHS COVID 19 Education Plan. Be sure to watch the video and then view the frequently asked questions document.,14
2020-07-25 21:18:31+00:00,In The Data,"New Zealand can do this right now because they have good leadership that listened to the scientists, and as a result, contained COVID-19.

Farmers markets are packed, restaurants humming, sports being played and attended. An economy busy doing what healthy economies do. https://t.co/egw2QYE4P3",34
2020-07-25 19:34:24+00:00,Utah,"Coronavirus US live: Georgia Senate candidate Jon Ossoff awaiting Covid-19 results after wife tests positive

https://t.co/FzoYCF0PHY",0
2020-07-25 08:49:04+00:00,"Denver, CO",First stop on the Darkside of Covid-19 red light therapy tour. #photobiomodulaion #redlighttherapy #sportsrecovery #fitnessrecovery #covid19 #cyrotherapy #medspalife seattlehearingservices https://t.co/fxTbbVu1eX @ Salt Lake… https://t.co/OI9UqxrGpg,0
2020-07-25 02:57:24+00:00,,Cover Ups In China ‘Happen Almost Daily’ — COVID-19 not first coverup https://t.co/D4uEEDKTzH via @YouTube,0
2020-07-26 05:10:37+00:00,"Salt Lake City, UT","@lkjohnson1950 Lonny, I am sorry to hear this. There is so much anxiety and worry due to COVID-19. Yet for it to strike home is unfathomable.

I'm praying for your niece, her family, and for you.",2
2020-07-27 20:55:54+00:00,Nevada,Tune in to @GovSisolak press conference this evening at 5PM for an update on #COVID-19 response efforts ➡️ https://t.co/gmKvC7ZzV2,0
2020-07-27 20:27:35+00:00,Texas-Utah Bernie Progressive,"As an increasing number of Florida children are hospitalized with COVID-19,
Governor DcSatan and Cruella DeVos still insist the children in Florida be thrown into huge COVID-19 Petri dishes, AKA schools.

https://t.co/Nz8S9l9Jch",0
2020-07-27 20:04:19+00:00,"Salt Lake City, UT",Leaders everywhere - please join us for an exciting conversation around the @WGU learner-centered approach to maintaining our robust community of care (at scale) during COVID-19: https://t.co/f1o2dS7TUM https://t.co/4TmPTyuh3D,11
2020-07-27 18:47:59+00:00,In The Data,"The Boston Red Sox have a net value of $3.3 billion and generate $519 million per year, and one of their players has myocarditis as a result of to COVID-19 https://t.co/8Gng4rrq0Q https://t.co/omamYXg70w",10
2020-07-27 18:25:41+00:00,In The Data,"Five before 12:30pm...

I can’t wait to see everyone in person again. Face to face is so much more efficient.

So, if everyone would please be disciplined, and not treat COVID-19 in a half-assed fashion, we can all get back to in person meetings.

I’d appreciate it.",7
2020-07-27 04:20:14+00:00,sumplace 🇺🇸,@KarlHun27985381 What Flu ? Everyone will have Covid and a case of Corona... Total quarantine,0
2020-07-27 02:52:02+00:00,"Salt Lake City, UT",The covid-19 pandemic has been the ultimate test of durability and resilience of individual businesses across industries and geographies. Many great management teams will be identified in these times. Establish a strong foundation for your wealth creation. Put in the work today.,60
2020-07-27 00:16:59+00:00,In The Data,"8 weeks.

8 weeks is what is would take if we aggressively shut things down, to eradicate COVID-19 from America.

8 weeks to recover our economy and see friends and family and play and watch sports together.

But it would have to be 8 weeks of discipline. No half assed measures. https://t.co/ARGSteAuWJ",505
2020-07-28 23:56:53+00:00,"Sandy, UT",6/12 English Paper pieced quilt. It’s slower than making a quilt but so satisfying and I’m half way done! The Covid-19 is given time to slow down. #thenewhexagon #millefiorequiltalong #bonnieandcamillefabric… https://t.co/EzgbRNU9c9,0
2020-07-28 23:47:18+00:00,slc ,"i didn’t rlly want to tweet ab this so consider it a PSA: ‼️‼️‼️

Covid-19 is FAR from being gone &amp; It’s getting closer to home.
For the past several months in a way I boasted that I’d not known anyone personally who contracted covid. 

I now know of at LEAST 5 ppl w/ it",3
2020-07-28 22:57:02+00:00,"Midvale, UT",#MLS reports no new COVID-19 tests.,6
2020-07-28 20:13:04+00:00,"Dallas, TX",I closed my first deal today at my new job and I tested negative for Covid-19. Lets gooooooo,33
2020-07-28 20:09:00+00:00,"Salt Lake City, UT","""there's no i in team, but there is an I in covid... Yea and virus"" 😂😂😂😂 https://t.co/5dTwqf1cUI",2
2020-07-28 19:05:22+00:00,,"@MeidasTouch #TrumpKillsTexas #TrumpKillsTexas #TrumpKillsTexas   #TrumpKillsTexas @realDonaldTrump has killed almost 150,000 Americans with his negligent care of Covid-19. Please VOTE!",0
2020-07-28 17:38:17+00:00,,"Davis School District just announced because of the number of COVID-19 cases locally, they changed their minds about the back to school plan. Students will now go to school two days a week and do online learning the other three. I need a Diet Coke. #KSL5TV #KSL #DSD",31
2020-07-28 16:48:19+00:00,In The Data,"I’m gonna say something that is not intended to offend, but seems to be a sticking point for many in the conversation about interpreting data regarding COVID-19.

Physician != Scientist
Scientist != Physician

Completely different skill sets.",63
2020-07-28 02:01:22+00:00,"Sandy, UT",Not Miami? U r kidding me? Miami Florida?  Where Ron DiSanto said there were no cases of covid-19? Ron Di Santo it's such a Trump ass kisser he wouldn't care of his whole state died. As long as Trump got his butt kissed they don't care about any of us. https://t.co/CsbdYxB3Y5,0
2020-07-29 20:16:06+00:00,"East Millcreek, UT",So @replouiegohmert thinks he gave #Covid_19 to himself? That's what he's saying by claiming a mask did it. Total incompetence.  I've got some pills and a special drink to sell this guy.,12
2020-07-29 19:51:14+00:00,"Salt Lake City, UT","Thank you and shout out to the afsp for creating this COVID-19 mental health first aid kit essentially.
.
.
I know that a lot of people are feeling alone right now because I, myself have felt alone a lot! 
.
.
The… https://t.co/1lVrpgCtfL",0
2020-07-29 19:50:22+00:00,"Salt Lake City, Utah",@_CountyLibrary Immunity from Covid-19.,5
2020-07-29 18:35:57+00:00,Center of the Earth,"@girlymamax3 @MyLifeInBooks @thehill No, just morons who think masks should not be worn, or that drinking any concoction will cure you of Covid-19. https://t.co/53y2b7Mfze",0
2020-07-29 16:51:41+00:00,"Boise, ID","Did a Covid-19 test yesterday. They swab my throat, guess you now have to have one 3 days before you can have surgery. Makes sense just now I'm worrying about the test, my surgery, my recovery. Deep Breath....
I will be Fine..",4
2020-07-29 15:27:12+00:00,,@GovHerbert @SpencerJCox We need Masks! Italy had half of Covid 19 cases yesterday as Utah. Our strategy did not work.,0
2020-07-29 12:31:38+00:00,"Ohio, USA",Raise your hand if debunking conspiracy theories has become a part of your “job” as a scientist 👩‍🔬 🙋🏼  #2020 #AcademicTwitter #AcademicChatter #science #Covid_19,0
2020-07-30 21:26:44+00:00,"Salt Lake City, UT",Hopefully COVID-19 cure also cures Popcorn Lung.,2
2020-07-30 20:57:59+00:00,Filmoria Utah,@RepChrisStewart So courageous buddy.... with your Orangy track record I assumed you would have submitted legislation to ban mail in voting. @realDonaldTrump @aubrey_huff #coronavirus #COVID19 #DonaldTrumpJr #utahpol #TrumpFailsAmerica,0
2020-07-30 20:45:47+00:00,"Cydonia, Mars. The Red Planet.","@IngrahamAngle Laura, I won't say anything about what I think of you except this, all of the false information spread by you,  fellow ”Journalists” &amp; Trump along with his sycophants about Covid-19 has cost lives on both sides. Start telling the reality of CV-19, it kills impartial of
Politics.",1
2020-07-30 18:27:01+00:00,"Salt Lake City, UT","Medical professionals silently protesting, but their message is loud and clear, they want Utah meat plants to close to help prevent the spread of COVID-19. Full story on @KSL5TV #COVID19 #KSLTV https://t.co/iSLmXSQTXS",1
2020-07-30 15:12:53+00:00,"Salt Lake City, UT","Sad to hear about Herman Cain. No matter your political views, this is sad. There has to be a point where we can see that our fellow citizens are being lost to this monster Covid -19. They are not just a number for the news. Please take this more serious.",0
2020-07-30 15:05:49+00:00,801,@KSLcom To distract from #HermanCain sadly passing away from COVID-19 which he contracted at the failed #tulsatrumprally #rip,12
2020-07-30 13:19:11+00:00,,We have a drug that works and the Democrats don’t want to use it . That tells me this covid 19 is a scam .,1
2020-07-30 13:00:10+00:00,"Sandy, UT","I love seeing this kind of collaboration around a challenge that is impacting so many in our state!! Please share this with those around you whose employment has been negatively impact by COVID-19. #utpol 

https://t.co/qgfCVpPdQt",0
2020-07-30 05:09:36+00:00,"West Valley City, UT","@the_resistor @realDonaldTrump Show us where @realDonaldTrump created the virus, released the virus, inflated the ""Infected"" &amp; ""Death"" numbers, put Covid infected people in Nursing homes &amp; is continuing to keep statates locked down.........We're waiting (&amp; will probably die of old age before you can)🇺🇸🇺🇸🇺🇸💪",2
2020-07-31 19:31:44+00:00,"Brighton, Utah",All other employees have thankfully tested negative for Covid-19 and the 3 who were infected are recovered. All infected employees will only be returning to work after they complete the CDC recommended self quarantine.,1
2020-07-31 19:31:43+00:00,"Brighton, Utah","Management made the decision to temporarily close our doors to allow time for all staff to be tested, a through deep cleaning to be performed, and a Covid-19 consultant was brought in to help further.",0
2020-07-31 19:31:43+00:00,"Brighton, Utah","Hello, we hope everyone is doing well! 

On July 25th Silver Fork Lodge made the decision to close our doors due to 3 employees testing positive for Covid-19. Based on these test results, the SLC Health Department would have allowed us to reopen after a deep cleaning.",1
2020-07-31 12:36:01+00:00,"Salt Lake City, UT","@samhawkewrites Wish I could have been there instead of rereading all the SOPs in my sleep about the clinical trials were starting for COVID-19, cuz that's still a thing here.",1
2020-07-31 01:22:14+00:00,Salt Lake City,"Project Protect, a Utah public-private collaboration of @UofUHealth, @Intermountain, and @ldscharities, has produced 5,000,000 masks, all by volunteers (50,000 of them). Nice work! #COVID19 #CoronaVirus https://t.co/o0SJUpwTtf",10
2020-08-01 21:01:02+00:00,"Salt Lake City, UT","A Public Service Announcement from Des: Listen up, Coronavirus. Move off. Go into space. We wish you weren’t real. 🚫🦠 #COVID19 #utpol https://t.co/XzM7Hcfpug",45
2020-08-01 19:25:49+00:00,Texas-Utah Bernie Progressive,"You have no more right
To breathe
Potentially covid-19 breath on me
Than you do to breathe
Second-hand carcinogen cigarette smoke on me.

Wearing a mask is
Not a matter of *your* rights
But a matter of *my* rights.",0
2020-08-01 17:21:39+00:00,"Utah, USA","@peterbakernyt @hughhewitt Whatever Trump record you want to tout, his colossal failure to lead the fight against Covid-19 will do him in. Then there’s the systemic corruption, Russia, Ukraine, revenge against enemies, and on and on. Trump is the worst and most incompetent president ever",0
2020-08-01 13:41:10+00:00,Salt Lake City,This study in @Nature suggests that pre-existing T-cells from prior exposure to a related #coronavirus may explain why some people have mild #COVID19 symptoms. Cross reactive T-cells to the rescue! https://t.co/2yR0MEpYgy,3
2020-08-01 03:06:17+00:00,"Salt Lake City, UT","@espn700bill @Utah_Football ‼️ And don’t forget, royalties from face mask sales are donated to @UofUHealth COVID-19 efforts.",0
2020-08-02 17:16:00+00:00,"Centerville, UT",Des is right! 🙌 no more Covid we are done with it! #BackToSchool2020 #COVID__19 #Utah #utpol https://t.co/rr9xvE76xv,4
2020-08-02 15:49:18+00:00,In The Data,"No benefit to hydroxychloroquine in the context of COVID-19, that is.",10
2020-08-02 00:44:08+00:00,Texas-Utah Bernie Progressive,"Democrat test positive for covid-19 and slams GOP colleagues for not wearing masks.

But, dammit, the slam is only verbal, not physical, which is what they deserve.

https://t.co/EiQsV0iLqT",2
2020-08-03 22:00:48+00:00,"Boise, ID",@MysterySolvent I hope he gets Covid-19,0
2020-08-03 20:37:29+00:00,Texas-Utah Bernie Progressive,"COVID-19
May cause
Psychiatric disorders.

https://t.co/dZWjYgrWYB",2
2020-08-03 18:08:37+00:00,in the 801,"Hey good news, I am not going to infect &amp; kill anyone with COVID. I had a more mundane, non-lethal, non-pandemic virus that just made me feel like road kill, which I will take over guilt anytime. 😀 https://t.co/krO40txK73",15
2020-08-03 02:17:34+00:00,"South Jordan, UT","Africa in the news: New funding to fight COVID-19 in Africa, Somalia’s prime minister voted out, and political updates in Mali and Côte d’Ivoire https://t.co/Fy2lnyDZ3C via @NewsNowUK",0
2020-08-04 20:53:41+00:00,"Centennial, CO",Trump Collapses Under Pressure of Extremely Basic Follow-Up Questions About COVID-19 https://t.co/GUVhGtSSZ8 via @RollingStone,1
2020-08-04 14:58:08+00:00,Otago/Hopkins/MIT/Utah,@ProfBootyPhD @cb0321 Huh?! You do know that even most adults are asymptomatic with COVID infections. The people dying or who die aren’t the ones spreading the virus! Kids are more resistant to infection but not by that much.,4
2020-08-04 03:22:46+00:00,"Sandy, UT","Lucy, we don't understand why Trump says less testing less cases of Covid 19? Trumps an idiot. https://t.co/lCRnBJ5Oj4",0
2020-08-05 23:43:14+00:00,"Utah, USA","How could there be people out there like that. trump should do something to help the Dr and his family. Dr. Fauci reveals he's received death threats, daughters have been harassed resulting from his statements on COVID-19 https://t.co/c1P7tC9fuK",0
2020-08-05 22:55:36+00:00,"Salt Lake City, UT","If you're wondering what I'm like at home during Covid-19, it's 💯 this.
https://t.co/pXHJL8EyZA",20
2020-08-05 21:44:13+00:00,"Utah, USA","😩🚧🔨🙌🏻 Great Safety Stand Down w/ @UofUHealth @UUtah F&amp;E teams along w/ Big D Construction reviewing what we do well, what we can enhance &amp; COVID-19 safety protocols! We work very hard to be &amp; stay safe! New clinic space on its way! TY! #oneteamonemission https://t.co/FZTpCEcqo2",12
2020-08-05 20:41:26+00:00,Texas-Utah Bernie Progressive,"@lilith2u @Roscoe_Notrub @mariecountryman @Mikel_Jollett @Jankowski60 @EclecticRadical @mellors_karen @EffTheTories @expressionessd1 @k4_owen @Patrick63104016 @VictorK43995989 @bilbalbag @LPeckerman People can have COVID-19 for weeks before showing any symptoms. Just because somebody doesn't drop dead immediately, it doesn't mean they're not dying of COVID.",4
2020-08-05 19:57:39+00:00,Salt Lake City,Six practical ways for academic types to cope with the #COVID19 pandemic from a piece in @Nature. Good stuff! #Coronavirus https://t.co/LZ8xSWDA7X,2
2020-08-05 16:32:20+00:00,"Utah, USA","Why is Utah still supporting @realDonaldTrump ?

Lots of children in Utah  whose parents are campaigning to get them back in school because they believe Trump when he calle covid 19 a  HOAX.",1
2020-08-05 16:03:17+00:00,Texas-Utah Bernie Progressive,"Health officials in Wisconsin have informed the Dem Convention Committee that speakers should no longer travel to Milwaukee due to COVID-19.
https://t.co/EQv5vdmFHt",0
2020-08-05 15:28:22+00:00,"Salt Lake City, UT",Utah is seeing a drop in COVID-19 cases and a drop in people seeking tests https://t.co/4Qbx5QpdtT.  A good update from @BenWinslow and @SpencerJCox.  #Wearamask.,5
2020-08-05 12:50:11+00:00,"Salt Lake City, UT","After Kilpest,now Titan Biotech delivers an outstanding set of earnings, turbocharged by Covid-19. 

The government of India finally allowed export of VTM kits last week &amp; Titan Biotech is the only publicly listed beneficiary.

Work hard today to let good luck find you in future. https://t.co/mlOMlH6wzv https://t.co/f2FefWZ2qf",70
2020-08-05 00:10:48+00:00,,This Covid-19 really sucks!,1
2020-08-06 21:22:16+00:00,"Salt Lake City, Utah","Oh boy! Another quality score from savers_thrift! For a mere $7.99, I found this brand new ""Tipsy Land"" board game! Perfect fun for a group of drunks!
.
.
Sadly, since this COVID-19 shit is still ongoing, it looks… https://t.co/rGKPmHhvYF",0
2020-08-06 18:08:58+00:00,"Utah, USA",A Covid-19 patient spent 6 weeks in the hospital. His bill was $1.9M.  https://t.co/9hbNVQH0Na,0
2020-08-06 17:05:50+00:00,Salt lake City. Ut,@carlquintanilla @Reuters Trump also said Clorox might cure Covid-19,0
2020-08-06 15:36:34+00:00,The final frontier?,"""Utah’s COVID-19 testing numbers are down and it’s unclear why""

Bottom line, 9-10% of Utah's population has the #coronavirus, at a minimum. 

https://t.co/oACw1BVUau",0
2020-08-06 15:29:24+00:00,"Salt Lake City, UT",Amid COVID-19; @UTNationalGuard’s 118th Transportation Company training while moving ‘munitions’ at @USArmyTEAD  https://t.co/QKOKeEtNeB,1
2020-08-06 01:36:57+00:00,"Centennial, CO","Twitter temporarily restricted Trump campaign's ability to tweet over false Covid-19 claims

https://t.co/zJFPnYpl3q",1
2020-08-07 22:03:15+00:00,"Sandy, UT",I know why did a good man John Weaver get covid 19 virus. Why is Trump still walking around? He has to be taking something to protect him. https://t.co/JGWTUGtESd,0
2020-08-07 18:01:09+00:00,"Salt Lake City, UT","This comment is disturbing. From the beginning of #COVID19, I’ve been very concerned and pushed for interventions to stop the spread of the virus in our jails. I’ve asked regularly if we had enough PPE &amp; what we were doing to make sure that a trip to jail doesn’t mean exposure. https://t.co/HC83HKJIJG",62
2020-08-07 16:19:50+00:00,Texas-Utah Bernie Progressive,"""India's Serum Institute pledges to sell 100m doses of a possible COVID-19 vaccine for $3 each""  https://t.co/ioRlTsfPfW",1
2020-08-07 15:08:59+00:00,"Utah, USA","Otro comisionado etnico muerto por  Covid 19. Lamentamos perderla, hoy más que nunca las comunidades de la Colombia profunda necesitan vivos y luchando sus lideres. #cacariqueña https://t.co/QO3hWuI1Ix",2
2020-08-07 14:42:08+00:00,"Bountiful, Utah",@realDonaldTrump @POTUS How about the COVID-19 death numbers?!,0
2020-08-07 00:54:17+00:00,"Lima, Peru","En Perú casi 1,000 mujeres y niñas han desaparecido durante la cuarentena y toque de queda por COVID-19 . Hasta ahora no hay un registro oficial de si han muerto las desaparecidas o han sido recuperadas. Tampoco ningún medio de comunicación ha tocado el tema 🤬 #NiUnaMenos",13
2020-08-08 23:39:52+00:00,"Kaysville, UT",COVID has now hit closer to home. I lost my cousin this weekend after a monthlong battle. Heartbreaking! I tire of telling people this virus is serious. Now I get to personally feel it. #maskuputah #lovethyneighbor https://t.co/PAl2MwM3lF,1
2020-08-08 18:31:14+00:00,in the 801,"It's interesting to see Utah Jazz players wearing masks, even out of the public eye, even though they live in a bubble, probably the safest place from COVID-19 IN THE U.S. https://t.co/trdaZ5wM8Y",0
2020-08-08 17:07:20+00:00,"Centerville, UT",One thing Covid-19 taught us is that we re-evaluate what we value! #utpol #uteconomics https://t.co/MjH1fjSy3a https://t.co/KDTZsKPUa4,10
2020-08-08 02:46:27+00:00,"Cydonia, Mars. The Red Planet.","Despite Dr. Stephan Smith's claims,
@IngrahamAngle 
Hydroxychloroquine is not beneficial in curing every case of Covid-19, your playing with people’s lives by spreading misinformation before a complete study has been effectively done. Smiths' claim only encompasses a small study.",0
2020-08-09 19:06:54+00:00,"Utah, USA","@BerryTramel Sweden is nearly finished with the covid19 virus and they never shut down. Berry, have you been living under a rock?",1
2020-08-09 18:36:55+00:00,"Utah, USA","@sltrib Lockdowns don’t work.  Sweden looks to be done with Covid-19.  Protect vulnerable and as for everyone else, wash your hands, be smart, move on.",3
2020-08-09 17:33:06+00:00,Texas-Utah Bernie Progressive,"Remember this pic
From just a few days ago?
That school now has nine cases of covid-19.

https://t.co/UNRpZASZKD",1
2020-08-09 13:40:20+00:00,Texas-Utah Bernie Progressive,"""New Zealand has gone 100 days without community transmission of COVID-19 — here's how they did it"" 

Here's our national plan! https://t.co/bFSttqEIoT",3
2020-08-10 19:39:16+00:00,salt lake city,Fuck you and yours.America needs a plan on COVID-19 you abusing conniving fucker https://t.co/OTlhOszxLO,0
2020-08-10 19:20:18+00:00,#Milan2026,"USA Nordic overcame challenges presented by Covid-19 to host a successful Fly Camp for 13 athletes from across the country. Head to our website to read the full article‼️
#usanordic #howdoyoufly
https://t.co/OqLeYQ366x",4
2020-08-10 15:54:50+00:00,Texas-Utah Bernie Progressive,"American Academy of Pediatrics
Reports 97,000
 COVID 19 cases
In children
In the second half of July.

https://t.co/sOMTCexEl1",0
2020-08-10 15:43:41+00:00,Texas-Utah Bernie Progressive,"Just watched a piece on CNN.
Remote reporter talked about school holding classes outside.
Made it sound great.
Then anchor asked him
What if it rains?
There was no answer.

97,000 children in the United States tested positive for covid-19 in the last half of July.",2
