Datetime,Location,Text,Like Count
2020-03-11 23:58:37+00:00,Illinois,"@_kaelanoel_ @MarthaMihalick *takes bow* glad to be of service. 

If I were *really* in the zone, the note would be: ""Corona is a beer. Coronavirus is a family of viruses. SARS-CoV-2 is proper, but I concede a mouthful. Can we say COVID19 here? Another option is Covid.""",2
2020-03-11 23:55:21+00:00,"Elgin, IL","@tanyaboza I have reset my social media limit timer. Last week, I thought 3 hrs a day was enough.... before covid-19 and me constantly checking to see if fans will be at my next few camera gig and when my kids school will shut down. I've only edited for 5min and filled in half an invoice",2
2020-03-11 23:50:30+00:00,"Chicago, IL","Dear Parents and Guardians,
The health and safety of our students and staff is our top priority at Noble, so I am writing to you today to share the latest information we have related to the Coronavirus Disease 2019 (COVID-19).
We are monitoring the situation closely and continue https://t.co/ex8anf6Yjw",0
2020-03-11 23:46:28+00:00,United States,One positive outcome of COVID-19 is that nobody is paying attention to Donald’s tweets. Yes!!!,0
2020-03-11 23:38:31+00:00,Ho-Chunk Land (Madison),"Wow! Look where are trajectories are and look where the US is! #COVID19 #coronavirus #CoronaVirusUpdate 
h/t @JasonSynaptic https://t.co/OfBP96wdBV",30
2020-03-11 23:34:45+00:00,"Bozeman, MT","I see a lot of hate with how this whole covid-19 situation is playing out. It’s not the best method for athletes, but best method for people’s safety.",2
2020-03-11 23:30:41+00:00,"Illinois, USA","As schools close for #covid19, I worry that the park districts I work for will be a place for these kids to go and subsequently be closed. Please keep kids at home, please! I would like to stay working and minimize the risk my family  gets the virus!",0
2020-03-11 23:30:16+00:00,"Chicago, IL",University of Illinois system classes migrating to online delivery to limit spread of COVID-19.  https://t.co/REStsCUSZT,5
2020-03-11 23:18:46+00:00,"Fort Lauderdale, FL",Can’t believe they are canceling the St Patrick’s Day river dying parade in Chicago due to COVID-19 that big news around here,19
2020-03-11 23:15:12+00:00,The Chi,"@advocatehealth While washing my hands in a bathroom at a major hospital in Oaklawn, an employee walks out of the toilet stall and out of the door. She didn’t wash her hands. Let’s do better #WashYourHands #hospitalworkers #COVID19 #advocatehospitals #coronavirus #healthcare https://t.co/0EvzoErYlt",0
2020-03-11 23:10:16+00:00,,*crosses COVID-19 off list of future kid names*,8
2020-03-11 22:47:21+00:00,"Chicago, IL","coronavirus to the left of me, COVID-19 to the right

stuck in the middle with flu :/",34
2020-03-11 22:45:04+00:00,"Schaumburg, IL",I'm sitting on my couch in tears because I just saw on the news my high school will be closed for at least the week end because of Covid 19. I know it was 50 years but seeing the front steps on the news...sigh,0
2020-03-11 22:17:22+00:00,"Milwaukee, WI",I just received 3 emails from school &amp; 2 from my jobs regarding COVID-19...all at the exact same time.,0
2020-03-11 22:12:32+00:00,West Michigan,"Amid fears of Covid-19, the Detroit Lions will be sitting out the 2021 super bowl.",1
2020-03-11 22:05:35+00:00,"Appleton, WI, USA","Talking to Children about COVID-19 from the National Association of School Psychologists @nasponline
 https://t.co/NnG0q3KTKZ",0
2020-03-11 22:00:56+00:00,"Long Beach, CA",Me deleting another COVID-19 corporate email from my inbox https://t.co/dVo0Y6vRU8,11
2020-03-11 21:58:28+00:00,United States,"“. . non-drug products promoted to mitigate, prevent, treat, diagnose, or cure diseases such as COVID-19 are unapproved new drugs in violation of the Federal Food, Drug &amp; Cosmetic Act (FD &amp; C Act).” @natlawreview @US_FDA @FTC #COVIDー19 #CoronaVirus #CoronaVirusFakeCures #Fraud https://t.co/aCfCSf8QuG",0
2020-03-11 21:50:17+00:00,"Chicago, IL",It’s hard being pregnant during the COVID-19 scare. Is my shortness of breath because of coronavirus or because fetus is crowding my lungs? The world may never know.,6
2020-03-11 21:38:41+00:00,Chicago,Worried you might have #COVID19? We spoke with an infectious disease doctor for @Froedtert &amp; @MedicalCollege on steps to test for the virus. Details coming up at 5pm on @CBS58. #CoronaVirusUpdate https://t.co/YoJg2JUR01,5
2020-03-11 18:26:51+00:00,"Milwaukee, WI",Didn't Covid-19 used to open for Blink-182?,34
2020-03-11 17:18:38+00:00,Greater Milwaukee (WI) Area,"#PSA

WHO declares the #COVID19
outbreak a #pandemic

#coronavirus #PublicHealth 

https://t.co/EIXyRxRVIM",0
2020-03-11 16:49:50+00:00,"Milwaukee, WI",Coronavirus: WHO classifies COVID-19 as a pandemic #Coronavirus https://t.co/jSL5THB6I2,0
2020-03-11 16:47:36+00:00,"Mequon, WI","#BreakingNews 

WHO declares a #pandemic due to the #coronavirus
#COVID19 outbreak. 
#PublicHealth #publichealthemergency
#CoronavirusPandemic
#Coronavirusupdate
https://t.co/ySrNnfJD8R",0
2020-03-11 16:23:31+00:00,"Mequon, WI","Wow! #Madison #Wisconsin university suspends in-person classes for the rest of the Spring semester due to #coronavirus
#COVID19
https://t.co/4VbI3G3XIf",0
2020-03-11 12:50:42+00:00,"Chucalissa, MS ","I'm going to be honest and say, with all the conflicting information...I truly don't know what to take of this coronavirus. #COVID19 

How worried should I be? One ""expert"" says we're not taking it seriously enough. Another just says wash your hands and all will be well. 🤦🏾‍♀️",0
2020-03-11 07:53:31+00:00,"Milwaukee, WI","In case anyone was still unaware, #bats have been known as the source of #coronavirus for quite sometime now. The problem is they’re just so adorable! 🦇😍🦇#COVID19 #Corona #CoronaVirusUpdate  #BREAKING @WHO https://t.co/4pdOfADQAQ",2
2020-03-11 04:54:04+00:00,,"My spring break got extended a week and classes will switch to online because of the COVID-19, but we still have classes til Friday?! Fucked up #Corona #uwm",0
2020-03-11 04:27:09+00:00,,Chancellor of Students : COVID-19 Threat at University of Wisconsin - Sign the Petition! https://t.co/pU9DEQRe2m via @Change,0
2020-03-11 01:33:30+00:00,"Milwaukee, WI",https://t.co/p84qkTxY1w some good news in all the bad news! Some large corporations have adjusted their policies so that those that fear covid-19 can stay home without penalty.,0
2020-03-12 23:47:19+00:00,Milwaukee ,My two biggest fears in relation to COVID-19 are not for me. There’s a good chance I will contract the virus because my work requires me to be near a lot of people all at once. Chances are I will come in contact and contract it. But my fear then isn’t for me. I likely will,2
2020-03-12 23:12:58+00:00,,I have never read so many emails 🙄 #Covid_19,2
2020-03-12 21:01:14+00:00,"Flint, MI","It said “no one associated with the Arena has tested positive for Covid-19. Nevertheless, we feel that postponing public events is in the best interest of our community The entire team at Fiserv Forum is a community as well, and your health and safety is most important to us”",10
2020-03-12 20:56:58+00:00,"Milwaukee, Wisconsin","Now @lakefront will close temporarily too: “Effective tomorrow until further notice, Lakefront Brewery will be closed for public tours, dining and drinking. We are being preventative and proactive about the spread of the COVID-19 virus and no one at Lakefront has been infected.”",2
2020-03-12 20:42:45+00:00,"Norfolk, VA","After seeing him touching all those mics... 😳 In the French version, he says he thanks everyone who’s reached out, and after he was diagnosed he faced a barrage of emotions- anxiety, fear, and embarrassment. #NBA #Suspended #Covid_19 https://t.co/LuCfdRxari",1
2020-03-12 19:46:55+00:00,Milwaukee,"Making the decision to postpone is never easy. Each event has different resources allocated and contingency options. I’m proud of our team who responded to the circumstances, and am looking forward to regrouping soon! #RespondvsReact #Covid_19 @SIOR_Wisconsin https://t.co/YlsACQAixU",6
2020-03-12 18:05:27+00:00,"Wisconsin, USA","The World Health Organization has announced that dogs cannot contract Covid-19. Dogs previously held in quarantine can now be released. To be clear, WHO let the dogs out.",0
2020-03-12 17:49:54+00:00,"Milwaukee, Wisconsin",6 feet is not enough if the #Covid_19 stays active in the air for up to 3 hours.,0
2020-03-12 16:42:50+00:00,"Chucalissa, MS ",@GovEvers encourages absentee voting to help curb spread of #COVID19 #coronavirus @SpectrumNews1WI,0
2020-03-12 15:58:24+00:00,Dairy Air State,NOOOOOOOOOOOOOOOOOOOOOOOOOOOOOOOOOOOOOOOOOOOOOOOOOOOOOOOOOOOO WISCONSIN HAD THE NUMBER ONE SEED 🖕🏻YOU COVID 19 https://t.co/BvJ2FGG6SO,0
2020-03-12 15:55:02+00:00,"Washington, DC","@SEC sending this alert: Based on the latest developments and the continued spread of the coronavirus (COVID-19), the Southeastern Conference today announced the cancellation of the remainder of the 2020 Men’s Basketball Tournament in Nashville. @NC5",0
2020-03-12 15:50:11+00:00,Milwaukee,I’ve always wondered how much it would suck to not have sports.....never thought I’d see it a actually happen! Hoping this gets figured out quickly. I don’t know how long I’ll last without 🏀 #Covid_19,5
2020-03-12 15:45:21+00:00,"Milwaukee, Wisconsin",It may not kill you but if you are a carrier and you are responsible for infecting someone who dies because they are more susceptible including loved ones...that is scary! #CoronavirusPandemic #Covid_19,0
2020-03-12 14:52:27+00:00,Chicago,"Serious tone during the @CBS58 morning meeting as we try to plan the best news coverage to inform our viewers about the #coronavirus outbreak &amp; its impact. This isn’t about ‘media hysteria,’ it’s about keeping our communities &amp; families safe. #COVID19 https://t.co/fqq0meBEfz",14
2020-03-12 12:14:16+00:00,BLACK LIVES MATTER,"COVID-19
Having a fever dream
In this moment
I puked up EVERYTHING! https://t.co/H3YphVuloo",1
2020-03-12 03:29:10+00:00,,If Gobert was being tested for covid-19 then why wasn’t he in quarantine until his results came back??? Why woukd you risk being around everyone with that uncertainty,0
2020-03-12 02:39:35+00:00,"Milwaukee, WI",Yeah. Y’all thought this was a game? Are you woke yet? #Covid_19 #nba #postponed,1
2020-03-12 02:32:25+00:00,"Flint, MI",Utah Gov. Gary R. Herbert and Lt. Governor Spencer J. Cox release the following statement on the positive case of COVID-19 on the Utah Jazz. https://t.co/rp24K3JXZ5,30
2020-03-12 02:09:46+00:00,"Miami, FL","#NBA response to #COVID19, after Jazz player preliminarily tests positive for virus. https://t.co/U1w8V8Cxnj",0
2020-03-12 01:39:35+00:00,"Milwaukee, WI",NBA's season suspended after player's positive COVID-19 test https://t.co/b3PNk6sgrQ,0
2020-03-12 01:35:13+00:00,"Milwaukee, WI","Sports, music groups and CNN have led the movement to cancel audience attendance, along with two game shows on antenna TV.

Trump refused to cancel his coming rally.  Perhaps now he will.

We don't know if a victim of covid-19 can catch it again.  So 30 days is, to me, a starter.",0
2020-03-12 01:28:09+00:00,"Milwaukee, WI","Our nation has to radically shut down all but most essential gatherings of people.

Close all schools and colleges and universities for 30 days.

A business with one victim of covid-19 can cause disease to seed hundreds of households around a city...multiply.",0
2020-03-12 00:44:12+00:00,,Am I the only one that’s low key scared of all these shutdowns because of COVID-19?! #COVID19 #Corona,0
2020-03-12 00:33:11+00:00,"Milwaukee, WI","COVID-19 ""...is the worst pandemic in a century!""  CNN specialist just now.

The coronavirus is out of control.  We will see it get worse.  ""Stop everything NOW!"" Advice given by expert during AC360 on CNN, referring to all activity that is non essential. Avoid where people meet.",0
2020-03-13 23:17:28+00:00,"Milwaukee, WI",COVID-19 officially in Milwaukee. Worker at 330 Kilbourn tests positive. https://t.co/KU1zV0IajN,13
2020-03-13 22:35:05+00:00,"Milwaukee, WI","It has been a hectic week, but I am so thankful for:
✅ incredibly supportive colleagues
✅ wonderful students and faculty who do things like this https://t.co/5TavYCekeB
We will be as proactive as we can to get through #Covid_19",3
2020-03-13 22:12:08+00:00,"Milwaukee, WI","Surely, God is able. #Covid_19 #coronapocalypse",0
2020-03-13 22:11:21+00:00,"Milwaukee, WI",Does anyone have an update? Milwaukee takes care of its own. #unity #Covid_19 #Bucks https://t.co/Dp9gje6I4V,0
2020-03-13 21:59:46+00:00,"Milwaukee, WI","The world: COVID-19! Stay home!
My Husband: So fish fry for dinner?",2
2020-03-13 21:20:14+00:00,"Wisconsin, USA","The Coronavirus (COVID-19) is causing a ruckus. There is a lot of panic and fear secondary to misinformation. While this is serious, 𝗦𝗧𝗢𝗣 𝗣𝗔𝗡𝗜𝗖𝗞𝗜𝗡𝗚 𝗮𝗻𝗱 𝗔𝗖𝗧 !
Your healthcare workers are on the frontlines of this (as… https://t.co/0kWO2ZHCqE",1
2020-03-13 20:34:32+00:00,"Milwaukee, WI","Walmart n Walgreens reps declared they would be setting up drive through covid-19 testing sites in their parking lots.  CVS and Target were also represented to announce they would be open 24/7 to meet the needs of Americans.

Rose Garden announcement s by Trump.",0
2020-03-13 20:12:33+00:00,"Milwaukee, WI","Do you feel the Trump administration is doing enough to address the Covid-19 pandemic? (If no, what would you like to see?)",3
2020-03-13 19:52:22+00:00,Nationally Recognized,"As a business owner...talk about #YourGovernment
#NoBidContracts #Covid_19",0
2020-03-13 19:08:49+00:00,"Wauwatosa, WI","More positive news.
My dog cannot contract COVID-19",0
2020-03-13 18:42:14+00:00,"Milwaukee, Wisconsin","Fellow shoppers: my overflowing cart has nothing to do with COVID-19.
My son is coming home this weekend. #boymom",4
2020-03-13 18:05:38+00:00,"Milwaukee, WI","The ENTIRE republican establishment is responsible for the response to COVID-19 because they 1) elected Trump, 2) allowed him to fire the entire pandemic response team (created by Obama to respond to emerging viral threats) simply because they wanted to tear down Obama's legacy",8
2020-03-13 17:58:30+00:00,Milwaukee,"Live look inside a @Target durring #CoronavirusPandemic.... 

#CoronaOutbreak #Covid_19 #panicbuying #coronapocalypse https://t.co/wQMtg4RwtC",5
2020-03-13 17:49:12+00:00,"Milwaukee, Wisconsin","It's what you don't know or told because nobody knows how this #Covid_19 reacts to each individual at any age! Information is trickling out, but the world is incubator. Human experiment",0
2020-03-13 17:40:23+00:00,"Milwaukee, WI",2pm cst Trump will be announcing he has tested positive for #Covid_19 heard it here first,1
2020-03-13 16:24:40+00:00,"Wisconsin, USA",We are currently in great need of Dr. House #Covid_19 #coronapocalypse https://t.co/WWnB2e5ON4,6
2020-03-13 16:10:34+00:00,"Milwaukee, WI","@barstoolsports To be fair, if we wanted a group of people to get covid-19 it would be people who go to a Post Malone concert.",1
2020-03-13 15:43:43+00:00,"Milwaukee, WI","If you’ve gotten a lab test done recently, thank a med tech. Even in #bloodbank we feel the strain of #Covid_19. Cancer patients? We provide safe blood products. Bone marrow transplants? We help monitor the status of the graft. Newborns? We perform DATs and make sure mom
1/2",7
2020-03-13 14:51:45+00:00,"Brookfield, WI","My students may not have designed a microarray for #Covid_19 like they are using Singapore right now, but they did work on a microarray lab today to examine differences in gene expression across cancer patients! #Genomics @edvotek (235) https://t.co/O986WlxRS9",4
2020-03-13 14:49:17+00:00,"ÜT: 43.08564,-87.912054",Fuck Covid-19 @ East East East https://t.co/dcS0Gfl0VI,0
2020-03-13 13:07:54+00:00,"Wisconsin, USA",Cuando el #Covid_19 no te quita el merito de ser #OrgulloUninorte https://t.co/3dNCEHRwBO,39
2020-03-13 13:03:53+00:00,"Mequon, WI","We can all speculate on how the next few months go, but why cancel instead of postpone? Postponing all activities until further notice doesn’t put student athletes at any risk in the short term. Spring Championship events are months away.
#seniors2020 #Covid_19 @NCAA  
🙏 🌎",62
2020-03-13 10:30:01+00:00,"Mequon, WI","A Note from Elements Massage Mequon, COVID-19 Update...https://t.co/1slihqAGwt",0
2020-03-13 06:08:44+00:00,E- Solutions@ColinCloud.com,"I remember “stay safe” meant “wear a condom.”

Now, it’s stay 6ft apart, wash your hands constantly &amp; don’t make direct eye contact (unless someone sneezes, then growl at them).

What I’m asking is, can I just wear one big condom? I don’t care if I’ll look like a dick.

#Covid_19",90
2020-03-13 04:27:22+00:00,,"Just reminding everyone to check on loved ones, neighbors, friends &amp; even strangers — especially the sick or elderly. If you are hurting, don’t be afraid to ask for help. We will get through this together. And don’t forget to pray🙏🏽...and WASH. YO. HANDS💕 #Covid_19 #Coronavirus",19
2020-03-13 03:51:49+00:00,"Milwaukee, WI","COVID-19 for President 2020 

The Coronavirus is doing more for this country than any president. Lowering airline prices, gas prices, free sick days from work, school, less traffic because of that.  

#COVID19 for president 2020. Don't forget to vote !! 📮",1
2020-03-13 03:49:56+00:00,"Milwaukee, Wisconsin","OMG, I did this for the hashtag and Twitter memory! Disaster Voltron! 🤷🏻‍♂️🤦🏻‍♂️😂🤣

#coronavirus #Covid_19 #COVID19  #disastervoltron https://t.co/BHzv6xxgfU https://t.co/sPKbbme9fW",2
2020-03-13 02:56:09+00:00,E- Solutions@ColinCloud.com,"If it makes you feel better

... then share it with the rest of us!

It’s known globally as ‘the vaccine.’

And we all want in.

-XOXO

#Covid_19",15
2020-03-13 02:28:37+00:00,"Dallas, TX",With the cancellation of The Players championship there will officially be no sports of any kind on tv for the foreseeable future. I’m going to have to get creative with my weekend plans #Covid_19,2
2020-03-13 02:27:42+00:00,"Milwaukee, WI",COVID-19 tearing through Mar A Lago is not the worst thing I’ve heard all day. https://t.co/XESsHYAMaq,4
2020-03-13 01:13:44+00:00,,🚨#NEW: Rory McIlroy calls for every tour player to be tested for COVID-19 (@WillGrayGC),0
2020-03-13 01:10:36+00:00,"Milwaukee, WI","“Five letters here just for everybody out there in Packer-land: R-E-L-A-X” 
#Covid_19",4
2020-03-13 00:57:04+00:00,,I heard U2’s “Until the End of the World” playing in my pharmacy today. Maybe not the best choice today. #Covid_19 #lockdown #Corona,0
2020-03-13 00:36:00+00:00,Milwaukee●Somewhere afar,This COVID-19 is hitting us so hard they lowered gas prices. My car picked the right time to be on E. Too bad we can’t freeze it and save it later as back up. https://t.co/hRArpzilcp,0
2020-03-13 00:25:59+00:00,215,"COVID-19, EAD",0
2020-03-14 23:36:57+00:00,"Milwaukee, WI","Perfectly sums up how I’m handling COVID-19. @ Milwaukee, Wisconsin https://t.co/URUr2djlj5",0
2020-03-14 20:01:01+00:00,Medical College of Wisconsin,In the middle of long days focused on COVID-19 and with my annual Holy Half Marathon cancelled I decided to do the 13.1 today!! Split of 56:27 and completion in 1:51:28 for a second best ever half marathon time!! Thx to my Sprint playlist!! https://t.co/juIozq7laY,66
2020-03-14 19:46:45+00:00,"Oak Creek, WI","@CullenBurnsCD29 @ABC13Miya You haven’t expressed anything remotely resembling a cogent thought, so you’re only adding to the pollution. We have 1 mill hospital beds in the US, nearly already at capacity. What will happen when COVID-19 incidence begins to peak? Delete your account.",1
2020-03-14 17:27:10+00:00,Sol 3,More help from actual experts on #pandemic experience &amp; behavior. #COVID19 #coronavirus https://t.co/tvbHto2Im4,0
2020-03-14 16:45:46+00:00,"milwaukee, wi","@Delta hey delta, sister doesn’t have a Twitter. She’s standing in a wedding next month that’s probably being postponed due to Covid-19. No official postpone date, can she get a refund for this",0
2020-03-14 15:22:20+00:00,"Milwaukee, Wisconsin",@johndissauer @JMV1070 People are going to start contracting Covid-19 while waiting in line to buy hand sanitizer. #ironic,1
2020-03-14 06:53:44+00:00,E- Solutions@ColinCloud.com,"I fucking hate #FakeNews, so I hope this is real. 

People are working hard on this.

Stay the course people!!

We’re gonna get through this. Together.

#Covid_19 https://t.co/FAfJwYr87s",20
2020-03-14 06:50:09+00:00,"Milwaukee, WI","@crutchfoot @TeamPelosi It can as of 12:10 AM today in the House bill Family Act that will be picked up by the Senate on Monday and has already gotten Trump's backing via tweets for the bill.

All covid-19 tests are to be free and about 500M will be given to Medicaid to offset increased medical costs.",0
2020-03-14 05:26:49+00:00,"Milwaukee, WI","@davidhhughes @Ferchland @JellyBearDemMom @Fudamentals @NickKristof @IPM_HQ At the WA nursing home where 24 residents died, a family was told the coroner would not test for covid-19 because of the patients age.  Died of natural causes, is the classification.",0
2020-03-14 03:49:14+00:00,Milwaukee,@PhilipRucker Mar-A-Lago is a hot spot of the Covid19 virus,0
2020-03-14 03:22:42+00:00,E- Solutions@ColinCloud.com,"We’re in a state of unknown. We can allow that to cause panic or strengthen our nation’s &amp; cultures.

We need to start asking #WhatCanIDoToHelp?

It may not be easy, but together we can overcome this.

Share good information.
Care about each other.
Keep washing hands!

#Covid_19",24
2020-03-14 03:16:51+00:00,"Milwaukee, WI","As of today, @DHSWI confirms 19 COVID-19 cases in Wisconsin. https://t.co/QySVlYoobf",0
2020-03-14 03:03:44+00:00,"Milwaukee, WI","The entire time I’ve lived here and the digital marquis at the Riverside has never been dark.  I miss the flickering light beckoning me to come see something or someone cool. 

🎶 COVID-19
Oh I swear
At this… https://t.co/O7y4xCxXte",0
2020-03-14 02:55:45+00:00,"Milwaukee, WI","Ladies if you're pregnant and the baby is ready to come out, tell him/her to WAIT! Not right now. Stay in there!
#seriously
#coronapocalypse 
#coronavirus 
#NationalEmergency 
#COVID19 
#Covid_19",0
2020-03-14 02:18:12+00:00,"Milwaukee, WI","Even medical visits are ordered to be cancelled.  Should an exception be made that resident must live isolated for 14 days.

Goal:  no one get covid-19.

Not staff.  Not residents.

No visitors, incl family, except for end of life visits.

Staff have new protocols for this.",0
2020-03-14 02:00:56+00:00,"Milwaukee, WI","I keep close track of the news and that includes on covid-19.

I filled my kitchen and bathroom two weeks ago, discussing this and coronavirus at each meal w/ friends at our table in t/community dining room.

Others listen in, but don't want to believe t/warnings until yesterday.",1
2020-03-14 01:00:32+00:00,Milwaukee,"Supt. Posley has announced all MPS schools will close effective Monday, March 16 to minimize potential exposure of students &amp; staff to Coronavirus (COVID-19). Closure will last through Spring Break, with classes resuming Tuesday, April 14. https://t.co/lRZdbafy64",0
2020-03-14 00:55:39+00:00,Milwaukee,"This made us cry and smile all at the same time. Let’s remember this for the days ahead. Coming together by song even in isolation ... 

https://t.co/Y63Bs9exK9

#Covid_19 #coronavirus #Italy #ItalyCoronavirus",11
2020-03-14 00:39:00+00:00,"Milwaukee, WI",Do you think there will be longterm economic hardships that result from the Covid-19 preventative measures?,2
2020-03-14 00:27:14+00:00,"Milwaukee, WI","@HarmonyMurray6 https://t.co/nj4WVUahyx ""As the World Health Organization adviser Bruce Aylward clarified last week, a “mild” case of COVID-19 is not equivalent to a mild cold. Expect it to be much worse: fever and coughing, sometimes pneumonia—anything short of requiring oxygen. """,0
2020-03-15 19:11:29+00:00,"Milwaukee, WI","HAPPENING NOW:

@MayorOfMKE and Neil Albrecht of the Election Commission are providing an update on the upcoming election in the wake of COVID-19. @CBS58 https://t.co/gS9yphr81A",3
2020-03-15 18:45:16+00:00,"Glendale, WI",We will keep everyone posted as things progress! Stay Healthy! #covid_19 #update #barnesandnoble https://t.co/zoP173w2Ox,1
2020-03-15 18:35:04+00:00,"Milwaukee, WI","IBEW Local 494 office closed to public due to potential COVID-19 exposure until further notice. 

All IBEW 494 business will be handled by phone or online only (no walk-ins will be allowed). The Union office will… https://t.co/yJen6JmwOV",1
2020-03-15 15:54:48+00:00,wauwatosa,"🇺🇸STATE LEGISLATORS:

This link is scheduled to update regularly regarding COVID-19.

#COVID19 

https://t.co/VD9c5sqeRy",0
2020-03-15 15:31:52+00:00,,"@nickbilton This is false. My husband works for Whole Foods and was told on Friday point blank, if you test positive for COVID-19 or need to quarantine, you'll get two weeks paid sick leave no questions asked (in addition to whatever PTO you already have).",58
2020-03-15 15:07:56+00:00,"Milwaukee, WI","Wisconsin DHS has only tested a few hundred people for SARS-COV-2/COVID-19, with 27 positive... And now the state has shut everything down... Great response I guess if you want to just pretend you have low numbers?",0
2020-03-15 14:46:05+00:00,,Thanks also for your very timely contribution to GIE regarding Endoscopy during COVID 19. Very helpful. Stay safe https://t.co/bO6irkeoRL,2
2020-03-15 13:41:21+00:00,"Wisconsin, USA",These simulations show how to flatten the coronavirus growth curve https://t.co/ZrIpbq1veu #COVIDー19 #COVID19,0
