Datetime,Location,Text,Like Count
2020-07-28 14:55:41+00:00,"Milwaukee, WI",First he got $4 million in COVID-19 relief loans. Then he bought a Lamborghini. https://t.co/uGCSQUhL4Z via @YahooNews,0
2020-07-28 12:22:44+00:00,"Milwaukee, WI #CreamCity","Dr. James Todaro: Google and YouTube Censored Paper Outlining Evidence of HCQ Treating COVID-19 for ""Violating Terms of Service"" https://t.co/3wfES5gfzz via @gatewaypundit",0
2020-07-29 22:52:07+00:00,"Geneva, Switzerland","Humbling to see how COVID-19 has impacted our nation’s blood supply as we represent @JuniorLeagueMKE on tonight’s Versiti @BloodCenterWI Zoom call update. The needs are great. If you can, please #giveblood https://t.co/GyXtlK8w4z",5
2020-07-29 21:01:42+00:00,The Prescott Group,I heard the compassion in your voice telling the stories of Covid victims. I saw you fighting back tears speaking of a 9yr old. Thank YOU @NicolleDWallace for humanizing this agonizing virus @DeadlineWH,0
2020-07-30 23:14:42+00:00,"Milwaukee, WI","We support @GovEvers plan to #MaskUpWisconsin to stop the spread of #COVID19 

The statewide order starts Saturday. Spread the word, not the virus! https://t.co/vTLPEZZu9I",29
2020-07-30 22:49:06+00:00,Milwaukee,"@whatifisaidit Whoops,  he didn't think that one through apparently.  I mean other than Cali,  the majority of the hardest hit eras in the country for covid-19 is where their base live 😬",0
2020-07-30 21:06:50+00:00,Milwaukee,"@AdrianaMendez I knew this was going to happen eventually and have no problem with it.  Would rather have a mask 😷 mandate statewide then to be back under a new shelter in place/ safer at home order 🤷🏽‍♂️, we got to do our part to stop this covid-19 spread",0
2020-07-30 19:41:42+00:00,"Milwaukee, WI","Herman Cain: black, pro Trump, anti-BLM, anti-mask, and now deceased because of COVID-19. #WearAMask",0
2020-07-30 19:18:47+00:00,the good land,I have a family member who is adamant about not wanting to wear face coverings to help prevent the spread of COVID-19. Does it take personal experiences to get some people on board?,0
2020-07-30 18:48:26+00:00,USA,@ron_fournier @JohnJHarwood And you support a racist like Donald J Trump got covid-19 and died.,0
2020-07-30 18:35:49+00:00,🌎 ,#coronavirus                                               #COVID19 https://t.co/vBqKijlVFL,1
2020-07-30 13:29:01+00:00,"Hales Corners, WI, USA","@jeffwagner620 @620wtmj “Fauci recommended goggles in addition to a face mask for those who want ‘perfect protection’ from the COVID-19, but admitted it’s not ‘universally recommended.”  If you’re that worried about the virus, wear it.  If not, don’t.  Who cares?",2
2020-07-30 11:47:02+00:00,"Milwaukee, WI","The left would rather you, or your loved ones, die from COVID 19 than have Trump be right about something. https://t.co/IQptrWA0r8",34
2020-07-30 11:20:54+00:00,"Based in Milwaukee, WI. USA",Stay positive and see your own beauty. #COVID19 #coronavirus #Neverbroken #staypositive #MaskUp https://t.co/SP7mvjsDqp,0
2020-07-30 02:25:36+00:00,"Milwaukee, WI","If they can ban HCQ for COVID-19 because they want to own Trump, imagine what government-run healthcare will do to you, and your loved ones, if they don’t like what you do.",752
2020-07-30 00:05:41+00:00,"Milwaukee, WI","@680x0kern So now we have to wear masks all the time or not be pro-life? Because we might spread a virus (be it COVID or flu or a cold) to someone else? 

With some limited exceptions (the assholes who cough/spit on ppl), no one is actively seeking to spread the virus to kill someone.",1
2020-07-31 19:32:08+00:00,,"@DeminMN77 @PressSec Wow that was impressive straight from the CCP. Here’s what you don’t understand Trump loses and the CCP wins. The CCP thInks  unleashing COVID-19 on America will make trump lose the election. That -32% GDP 100% credit to the CCP don’t do their dirty work maybe ur just a BOT,",0
2020-07-31 16:57:28+00:00,"Illinois, USA","So just so I’m clear COVID-19 is so dangerous that we can’t hold a national election for President, BUT it is safe enough to open schools.",2
2020-07-31 15:40:35+00:00,"Milwaukee, WI",MLB confirmed in its statement that today’s postponement is the result of two positive tests for COVID-19 in the Cardinals organization.,14
2020-07-31 13:56:18+00:00,"Milwaukee, WI",#BREAKING Brewers vs Cardinals game postponed due to COVID-19.,5
2020-07-31 06:56:12+00:00,"Wisconsin, USA","Ben RULES!

ALWAYS tellin' it like it is!!

Keep it up Ben!

Riffin' on LeBron who gained a Covid-19 POUNDS (conservatively speaking) over the apocalypse!!

Always tellin' the truth about the Asssssstros!!!

Tune in to the Big Ben Maller Show Kids!!!

Corndog in MILWAUKEE!!! https://t.co/m3untEnkXV",0
2020-07-31 06:13:26+00:00,"Milwaukee, WI",@RepHorlacher You vehemently disagree with an action that has been proven to be an effective way to slow the spread of COVID-19? You want more people to die? I think you should probably answer this because none of you want to actually do your jobs as state reps and save lives. #WearADamnMask,3
2020-07-31 04:19:49+00:00,"Milwaukee, WI","Trump &amp; his conservative assholes are politicizing EVERYTHING: Schools &amp; public colleges, pandemic assistance, census, COVID-19 death count, BLM, mail-in ballots, masks, puppies, taco bowls, Lysol &amp; bleach, @StormyDaniels —the list goes on!",7
2020-07-31 01:31:48+00:00,"Milwaukee, WI",Has COVID-19 effected you As A Artist 😷🤔 https://t.co/dJUMMQWqRY,30
2020-07-31 00:12:40+00:00,Wherever the Reese's are 🍫🥜,"This is some BULLSHIT. US relations with China, Kobe Bryant's death and COVID-19 did not just impact the Lakers.  Sick and tired of the LeBron and the Lakers are the best at everything narrative. #ThereAreOtherTeams #FearTheDeer https://t.co/zLKyinUb3a",0
2020-08-01 23:59:16+00:00,"Milwaukee, WI",I know people who are battling this every day. This shouldn't be your hill to die on over statistics. The sheer thought and discussion being raised here is fueling people to rally for anti-mask usage. Many will die. It's scary. #COVID19 #coronavirus,0
2020-08-01 23:54:39+00:00,"Milwaukee, WI","That feeling when a college professor who taught you valuable analytical reasoning skills uses these skills today to suggest that covid lockdown is ""painful"" and people will die from lockdown sooner then from the virus. All respect gone. So dangerous. #COVID19 #coronavirus",0
2020-08-01 20:22:20+00:00,"ÜT: 18.485485,-69.8791546","El jugador de los brewers #LorenzoCain anuncia, se retira de lo que resta de la temporada @mlb #2020.

#mlb #beisbol #2020 #sports #lasmayores #pelotacaliente #covid_19 #brewers #milwaukee #retiro #lorenzocain… https://t.co/kID8vJxdnN",3
2020-08-01 04:45:41+00:00,USA,@Hope012015 @nicolejames She already had covid-19 now he wants her to get pneumonia,0
2020-08-01 04:40:34+00:00,"Milwaukee, Theed, Coruscant",But @realDonaldTrump won’t do anything about COVID-19..... makes sense! 🤷🏼‍♂️😷🤦🏼‍♂️👎🏻🗑 https://t.co/izbKnRyMHa,0
2020-08-01 01:23:00+00:00,"Greenfield, WI","Since @THEHermanCain’s death, a lot of people have been spreading myths that he thought COVID-19 wasn’t serious. Cain’s editor sets the record straight.
https://t.co/71SKTmCokF",0
2020-08-02 23:28:44+00:00,"Bayside, WI","Milwaukee Journal Sentinel: Brewers learn that COVID-19 dictates whether games are played

https://t.co/bVCGlyjIW3",3
2020-08-02 20:17:24+00:00,Nomad,"Commentary:

Overall it was a very strong month for my individual holdings. COVID-19 has sped up the move to e-commerce, tech adoption, and remote work, which has greatly helped the companies I hold. I know this cannot last forever as many of the gains are now “priced in.”",0
2020-08-02 17:47:35+00:00,United States,"@KnolesMichael I'd talk about decency, unity, mutual respect, keeping safe through Covid-19.",1
2020-08-02 14:16:44+00:00,,Let's all lend a hand. Covid-19 Economic Response:  Cancel Student Loans by Executive Order. - Sign the Petition! https://t.co/SSCCPbQZJN via @Change,0
2020-08-02 13:41:30+00:00,Global,"@brill_leah @myartsells @mmpadellan It was evident from the start that they were augmenting the spread by any means possible (PPE shortage, masks were the enemy, promoting hydroxychloroquine, attacking WHO, CDC &amp; Fauci, withholding funds to states) rather than take any &amp; all measures to stop COVID-19. #MURDERERS",2
2020-08-03 23:25:07+00:00,USA,Trump and Friends are surpressing the vote in plain sight. They are spreading lies about fraudulent in absentee ballets. Get your absentee ballet to exercise your rights and prevent your self from covid-19 at the same time. 0000.1 fraudulent has been reported.,0
2020-08-03 18:25:27+00:00,Milwaukee,@Derrick_Wolfrex Well blame Covid-19.. if it wasnt for that they would be feuding right now going into SummerSlam..,1
2020-08-03 15:45:39+00:00,,"@realDonaldTrump The Covid-19 has been successfully controlled in China. But the TrumpVirus is spreading in US. He has killed 150,000 people. If TrumpVirus doesn’t go, the death toll in US will rise. Blaming China wouldn’t reduce the death toll in US, will only appear that Trump is incompetent.",0
2020-08-03 13:31:00+00:00,"Bayside, WI","Milwaukee Journal Sentinel: Brewers learn that COVID-19 dictates whether games are played.

https://t.co/bVCGlyjIW3",2
2020-08-03 02:36:40+00:00,"Bayside, WI","Milwaukee Journal Sentinel: Brewers learn that COVID-19 dictates whether games are played

https://t.co/bVCGlyBkkD",5
2020-08-03 00:08:50+00:00,United States,"Still waiting for any Republican with a set of balls to actually stand up for America. 
And that's why You will get Your asses handed to You November 3.
Your  callousness, as We burn in a new depression and Covid-19. You hand $$$ to Your Corporate Masters and kiss tRUMP's ass. 🖕 https://t.co/L9SHwcaTNx",12
2020-08-04 17:27:31+00:00,Milwaukee,"Just another reason to hate Yadier. MT @anne__rogers: Cards announce that C Yadier Molina, SS Paul DeJong, IFs Rangel Ravelo &amp; Edmundo Sosa and RPs Junior Fernández &amp; Kodi Whitley are 6 of the 7 who tested positive for COVID-19.

These individuals gave consent to be identified.",0
2020-08-04 02:23:25+00:00,mke,I see we’re back to the “unable to find paper towels” part of COVID-19.,3
2020-08-04 02:08:02+00:00,Milwaukee,"@MomsThoughts At this point,  all of those things are a priority.  But gun control,  limiting the spread of covid-19 and passing the violence against women act are the three things that need to be addressed off the bat",2
2020-08-04 00:17:13+00:00,USA,@mitchellreports They are immune to covid-19,0
2020-08-04 00:01:12+00:00,USA,"Dr said trump need to stay in his lead when it comes to science and medical. Because he doesn't have a dam clue of what he is talking about. He doesn't know anything about how hydroychloroquine work for covid-19.
#trustscience
#doctorfauci
#medicalteams
#NursesActive",0
2020-08-05 23:55:01+00:00,"Chicago, IL","If Covid is the “China Virus,” surely stupidity is the @realDonaldTrump virus",1
2020-08-05 22:50:41+00:00,"Bay View, Milwaukee","A short summary of my research on COVID-19 and Bioethics that was presented yesterday at @marquette COVID-19 Pandemic Related Lighting Talks hosted by MU Covid-19 Research Initiative and @MUInnovation 

COVID-19 Research on Ethical Issues https://t.co/7dMY2BROFE via @YouTube",8
2020-08-05 17:11:07+00:00,Milwaukee,@danielle_hamlin @TeaPainUSA The economy was baller before covid-19 because it wasn't Trump's in the first place.  He inherited it from the Obama administration that was in place from 2009 until February of this year So all of the great things that happened in this country was because of 44's policies not 45,0
2020-08-05 13:04:48+00:00,,Coronavirus in Illinois updates: Here’s what’s happening Wednesday with COVID-19 in the Chicago area https://t.co/oszOGWY4Lo,0
2020-08-05 06:01:56+00:00,Milwaukee,"@meralee727 Almost 160,000 people dead from covid-19 in this country 

Trump : ""it is what it is "" 😒",5
2020-08-05 00:06:37+00:00,Milwaukee,"@MystickTheater @jeffwagner620 So much to dissect here.

First, H3N2 only killed 100,000 in the US, way less than COVID-19.

Second, let’s pretend for a second you actually did know how to do math &amp; H3N2 killed more people than COVID-19, which it didn’t; yah.. I’d expect more deaths if they didn’t shut down.",0
2020-08-06 18:54:10+00:00,"Milwaukee, WI",It really bothersome that my 60-something year old parents who work part time in healthcare refuse to get tested for #COVID__19,0
2020-08-06 12:48:37+00:00,Milwaukee,"Went to @cvspharmacy to get a Covid-19 test 12 days ago, just to be safe. Still don’t have results back. How is getting tested there even worthwhile, given that timeline?",5
2020-08-07 23:55:07+00:00,"Milwaukee, Wisconsin",Surviving COVID-19 one bottle at a time. #thatcovidlife #wineoclock @ Vintage 38 Wine Bar &amp; Craft Beer Lounge https://t.co/7ozCJEjIs6,1
2020-08-07 16:55:15+00:00,Milwaukee,".@voces_milwaukee Another @StraussMeats worker, Neri with his family. Neri was fired with 30 other workers for organizing better covid-19 worker protections.

#immigrantworkersareessential https://t.co/FPJbq2ZDQV",5
2020-08-07 14:52:17+00:00,"Milwaukee, WI","This virus has been real since day 1 for me. Friends and family friends have been afflicted. Having friends with deaths in family due to COVID-19 brings it one step closer to home. Stay safe, wear masks.",9
2020-08-07 13:34:46+00:00,"733 N 12th Street, Milwaukee, WI 53233","COVID-19 is drastically increasing the number of food insecure individuals in our communities. Sacrifice a Starbucks run and donate money, food, or time to help our food insecure peers! Read more about this crisis in blog by grad student Rachel Beilfuss: https://t.co/OfHVqVKVwE https://t.co/BwnwUFxJfA",2
2020-08-07 04:25:56+00:00,"Milwaukee, WI","@GeekyGearhead99 @BCBrownell @MINIUSA I believe you're correct Joel: College grads/students first, then like more recently to first responders in wake of COVID-19, and then now anyone. It's a ton of (fun) car for not a lot of cash.",2
2020-08-08 14:48:33+00:00,,I’m taking @ChildrensWI's #ShineThroughPledge to support my child’s mental and behavioral health. I promise to talk with my child before school starts so I can better understand their feelings about returning to school during COVID-19.,17
2020-08-08 05:03:12+00:00,,You’d have to think a Norwex mask would end the virus #coronavirus #COVID,0
2020-08-08 04:24:18+00:00,milwaukee,St Louis Cardinals are close to a perfect Covid 19 straight flush. #corona,0
2020-08-08 03:17:49+00:00,USA,@realDonaldTrump Nope you said Covid-19 was a hoax made up by the radical left,0
2020-08-08 00:21:51+00:00,"Milwaukee, WI","Official: Three more COVID-19 positives for the Cardinals, and three more postponements. https://t.co/RrHZFT0lRM",30
2020-08-09 20:48:07+00:00,"Milwaukee, WI",@KorverSZN_ I can tell you more kids will die from suicide than covid if we don’t get them in school.  I feel very confident in the plans my kids schools have released to us.  It would be odd to jeopardize our children’s education for a virus that has a 99.4% survival rate🤷‍♂️,0
2020-08-09 15:47:18+00:00,"Milwaukee, WI","Welp. There’s your ad @realDonaldTrump. 

“China would prefer Joe Biden.” 

The China that is systematically exterminating the Uyghurs, that unleashed Covid-19 on the world, that oppresses democracy in Hong Kong and suppresses Taiwan. That awful country.

They prefer Biden. https://t.co/yDCkz6qXYH",39
2020-08-09 12:08:03+00:00,"Cudahy, WI","100 days without Covid-19: How New Zealand got rid of a virus that keeps spreading across the world, via @nzherald https://t.co/Zuv6BK3hq6",1
2020-08-10 20:44:49+00:00,"Milwaukee, WI",@scorpio_19_11 @DEvanAltman @JonFerlise I guess the radiologist does the procedure but the hospital was packed and I think they’re catching up on a lot of COVID-related postponements,2
2020-08-10 13:19:31+00:00,,1 in every 60 people in the United States has COVID-19 as of now. Good god.,206
2020-08-10 11:29:45+00:00,"Milwaukee, WI","Over a billion people in India and they have 2 million cases. United States, a population of less then 400 million has over 5 million cases of COVID-19. Poor leadership across the board.",3
2020-08-10 03:13:25+00:00,"Brew City, WI",@masnKolko I see 0 games missed for A’s and Astro’s because of COVID-19 but many games missed because of suspensions.,0
2020-08-10 01:36:16+00:00,"Milwaukee, WI",Big Ten set to shut down its 2020 football season because of COVID-19. Can the league hold a season in the spring? https://t.co/XbWYwysPZY via @journalsentinel,0
2020-08-10 01:17:14+00:00,Milwaukee,"@pcbrynn This is probably the least surprising thing I've heard tbh, it's crazy there's people in society who think younger people can't get this virus.  Granted their recovery rate is higher than a person with underlying health conditions.  But Covid doesn't discriminate against anybody",1
2020-08-10 00:59:11+00:00,Milwaukee,"@Leslieoo7 I like you too and respect where you are coming from cause I feel the same way.  That date can't come soon enough.  Honestly once we take over the senate,  keep the house, remove trump and stop the spread of covid-19, we all need to go out and celebrate with a few drinks 🍸 🥂",7
2020-08-10 00:29:29+00:00,,"@quite_savi24 @peter_king Nope.  People who have died without having COVID test, arent counted as a COVID death, even with ALL the symptoms.  And, most importantly, we have been in some state of lockdown since March, which keeps us from ever knowing the ""normal"" path of this virus.",3
2020-08-11 17:02:36+00:00,United States,"Hey Fat Nixon, Spanky McnoonelikesMe, @realDonaldTrump I'm a @Bucks fan, does that make an ""NBA guy""? Cause if so, I am honored to criticize You, hate You, wish You a Covid-19 future, prison, etc. You suck!! https://t.co/SGBIGyXu7R",1
2020-08-11 14:34:17+00:00,"Milwaukee, WI",COVID-19 dreams are just exhausting.,0
2020-08-11 14:09:20+00:00,"Wisconsin, USA","I've BEEN waiting!

DAMN YOU COVID-19!!

#WonderWoman1984 https://t.co/6u7dfC1sq7",1
2020-08-11 01:31:19+00:00,USA,@CBSNews And some of the students were tested positive for covid-19.,0
2020-08-11 01:02:48+00:00,USA,"@realDonaldTrump You want them to play because you tweeted so, covid-19 is real and attacking children, teens and young adults as well as the elderlies. #BidenHarris2020",0
2020-08-11 00:42:20+00:00,,I'm confused how he voted for Trump's 2018 tax cut and increased the federal debt to give more money to rich people - but suddenly is worried about the federal debt now when people need help because Trump screwed up the response to Covid-19. @MollyBeck https://t.co/LSHi3y7geI,1
2020-08-12 21:38:23+00:00,"Milwaukee, WI","REMINDER:

WE'VE BEATEN OTHER PANDEMICS WITH EARLY LEADERSHIP AND SCIENCE. 

SARS: R0=1.5-2.75
H1N1: R0=1.4-1.5
Ebola: R0=1.5-2.5

**COVID-19: R0=1.4-2.8**

WEAR A DAMN MASK + SOCIAL DISTANCE BECAUSE YOUR FEDERAL GOVERNMENT HAS FAILED US AND THE PLANET.",3
2020-08-12 15:28:07+00:00,United States,@politvidchannel Nope. Once they gaze upon their precious Children and fear Covid-19?? No way.,20
2020-08-12 01:49:45+00:00,United States,Can You wish this great resister a speedy recovery and follow Him please?? He's gonna kick Covid-19's a$$ !! https://t.co/xLPqjfNi7G,6
2020-08-13 19:30:12+00:00,"Oak Creek, WI",Isn’t it at least a little bit funny that all the same people who are extolling Sweden’s approach to COVID-19 would punch you in the face pronto if you suggested they should adopt Swedish-style politics?,0
2020-08-13 18:05:31+00:00,Wisconsin,New Resource: Questions for Proactive and Equitable Educational Implementation During the COVID-19 Crisis - NCLD https://t.co/UHkMiK8vp9,1
2020-08-13 16:38:16+00:00,Wisconsin,New Resource: Questions for Proactive and Equitable Educational Implementation During the COVID-19 Crisis - NCLD https://t.co/UHkMiK8vp9,0
2020-08-13 15:44:09+00:00,The pale blue dot. ,"13/14 * College job placement service tried to steer me to Joliet sports reporter position, but I opted for @mkeadmirals &amp; a career in sports admin instead
* I think I found our COVID-19 hero!
* Q&amp;A w/MKE in Polish
* 1999 MN Thunder Championship articles https://t.co/qVwerwFM1O",1
2020-08-13 12:26:07+00:00,Franklin WI ,One of the COVID-19 work from home benefits. The Deck Office https://t.co/2QfDtJbIb4,2
2020-08-13 02:28:43+00:00,"Milwaukee, WI",SOCIAL DISTANCE IS A MUST. This might look funny but it’s the “NEW NORM.” Stand 6 feet away like in the 2nd picture Shown..... The Life you safe might be your own. We’re All In!! For safety tips during this COVID-19… https://t.co/rMAu9adxq2,0
2020-08-14 03:12:23+00:00,,"@nicolegulatz @RedCrossBloodNC Thank you for your blood donation, and thank you for spreading the word about Antibodies Covid-19 testing as donors are more than encouraged to highlight it :).",1
2020-08-14 00:28:59+00:00,"Geneva, Switzerland",My results are in! Another great reason to #giveblood &amp; this one gives back to you! Grateful to @RedCrossBloodNC for providing free COVID-19 antibody testing for donors. Sign up quick &amp; easy through the Red Cross Blood App or online at https://t.co/xTKBkUdytS https://t.co/A3GEbVoUXW,8
2020-08-16 14:31:34+00:00,"Milwaukee, WI","Regular exercise can improve mental and emotional health, and since people with comorbidities are more susceptible to COVID improving her health is probably helping decrease her risk from the virus. 

Why can no one do something for themselves without someone being offended? https://t.co/ItSU5Ktm12",8
2020-08-17 22:53:53+00:00,"Washington, D.C.","Trump’s “hollow trade deal with China, and the disastrous tariff war before it, helped drive manufacturing into recession — even before his historic mismanagement of COVID-19. It devastated farmers across the country, &amp; it did nothing to address [China’s] unfair trade practices.” https://t.co/l2VodFbdgt",4
2020-08-17 22:42:28+00:00,Milwaukee,"@MollyJongFast F*ck this POS,  like seriously I try to keep my cool when it comes to this guy. But when he goes out of his way to blatantly lie and make *everything about him, and not show any sympathy to the families of these 170k people killed from covid-19... it really pisses me off 😒",1
2020-08-17 22:10:32+00:00,,"@ZekeJMiller @ddale8 I'm sure Covid-19 won't infect anyone since it's a ""peaceful protest."" 😂",7
2020-08-17 19:39:53+00:00,Milwaukee,"@kathrynw5 Knowing how we're leading the world in total cases and deaths from covid-19, if I was a refuge,  why in the hell would I want to come to the United States right now,  I'd take my chances elsewhere than risks being in a country ran by sycophantic idiots who downplayed this virus",1
2020-08-18 22:33:41+00:00,Wisconsin,When life gives you lemons...no that’s not right...when COVID-19 takes away your favorite neighborhood watering hole you create your own! #Rayborhood @raysgrowler https://t.co/GA5yxFORlq,1
2020-08-18 14:18:43+00:00,United States,"Spanky's total incompetence, lack of anything close to leadership, &amp; corruption is the reason our country has been brought to its knees by Covid-19.  He is uniquely unfit for office. That is why we need @joebiden &amp; @KamalaHarris to win the election. And @AdamSchiff for A.G.",3
2020-08-18 13:44:55+00:00,,"“Wisconsin recorded 455 new COVID-19 cases on Monday, the lowest total in two weeks.” https://t.co/7cKTYc4d6r",1
2020-08-18 11:23:44+00:00,"Milwaukee, WI","Serious question that I hope doesn’t turn into a heated battle. Where do you stand on a COVID-19 vaccine? Choose one or provide your own:

1. I’m in. As soon as it’s available.
2. I’ll see how it goes with other people before I commit.
3. No way. I’ll take my chances without it.",7
2020-08-18 06:49:36+00:00,Milwaukee,"@shannonwoodward Don't feel bad,  other than Bernie and Michelle Obama speeches which are must watches btw and a scorched earth takedown of 45 from the a woman who lost her dad due to covid-19, something else you need to see, you didn't miss much honestly still #VoteBidenHarris2020",0
2020-08-18 04:10:28+00:00,USA,@Jackasaurus3 The postal master need to go he is help trump kill more elderlies. It's bad enough to be fight with covid-19,1
2020-08-18 03:37:08+00:00,"Wisconsin, USA","@Breska16 @BetterCallSaul @BreakingBad Again,

When the newest season drops.

Best to just buy it somewhere if You haven't seen it already!

It's gonna be a ""minute""!!

Thanks Covid-19!!!🖕

#BetterCallSaul",0
2020-08-18 03:35:53+00:00,"Wisconsin, USA","@66Guerrero66 @BetterCallSaul When the newest season drops.

Best to just buy it somewhere if You haven't seen it already!

It's gonna be a ""minute""!!

Thanks Covid-19!!!🖕

#BetterCallSaul",0
2020-08-18 01:48:01+00:00,"Boston, MA","COVID-19 Ready. Thank you, DNC Milwaukee!!! #cdc #who #DNC2020 #battlefirstaidresponderservices #laqueenbattle #covidready",0
2020-08-18 01:27:23+00:00,"Boston, MA",Less Covid-19 Issues...DNC Milwaukee..,0
2020-08-19 19:46:45+00:00,Milwaukee,"Ex-coach wrong in saying governors, especially Dems, canceling college football due to COVID-19. https://t.co/8lekxFPxba",1
2020-08-19 16:24:13+00:00,"Milwaukee, WI","“If our response had been as effective as South Korea, Australia, or Singapore’s, fewer than 2,000 Americans would have died. We could have prevented 99% of those COVID-19 deaths. But we didn’t.” https://t.co/dgHpYxo1vn via @pewtrusts",3
2020-08-19 13:20:37+00:00,"Milwaukee, WI",Have you or someone you know had covid-19 (coronavirus)?,2
